0,0.94011,0.88909,0.64014,0,0,"Die Lehramtsbefähigung für die Sekundarstufe II (berufliche Fächer) kann auch erworben werden, wenn der Diplom- oder Masterabschluss eines einschlägigen Fachhochschulstudiums nachgewiesen wird.
Wenn Sie die Voraussetzungen für einen Quereinstieg nicht erfüllen, haben Sie die Möglichkeit, Studien- und Prüfungsleistungen eines vorangegangenen Studiums auf ein Lehramtsstudium anrechnen zu lassen.
Wenn Bewerberinnen und Bewerber das Ziel haben, im Rahmen einer Beschäftigung im Schuldienst die zweijährige berufsbegleitende Ausbildung nach der Ordnung zur berufsbegleitenden Ausbildung von Seiteneinsteigerinnen und Seiteneinsteigern und der Staatsprüfung (OBAS) zu absolvieren, müssen sie sich zunächst auf die Stellenausschreibung einer Schule bewerben, die mit dem Zusatz ``Bewerbung von Seiteneinsteigerinnen und Seiteneinsteigern ohne Lehramtsbefähigung'' oder vergleichbaren Zusätzen die Bewerbungsmöglichkeit für Seiteneinsteigerinnen und Seiteneinsteiger eröffnet.
Voraussetzungen für die Teilnahme an der berufsbegleitenden Maßnahme : An der berufsbegleitenden Ausbildung kann teilnehmen, wer 1. einen an einer Universität erworbenen Hochschulabschluss nachweist, der auf einer Regelstudienzeit von insgesamt mindestens acht Semestern beruht, 2. eine mindestens zweijährige Berufstätigkeit oder eine mindestens zweijährige Betreuung eines minderjährigen Kindes nach Abschluss des Hochschulstudiums nachweisen kann, 3. die für die Unterrichts- und Erziehungstätigkeit erforderlichen deutschen Sprachkenntnisse besitzt und 4. im Rahmen eines Auswahlverfahrens mit positiver Prognose über den Ausbildungserfolg in den Schuldienst des Landes Nordrhein-Westfalen im Tarifbeschäftigungsverhältnis eingestellt wurde.
Im Rahmen der Einstellung in den Schuldienst ist festzustellen, ob ein Einsatz in zwei Fächern und eine erfolgreiche Teilnahme an der berufsbegleitenden Ausbildung in zwei Fächern erwartet werden kann.
Die Ausbildung umfasst 24 Monate.
Sie schließt mit der Staatsprüfung und dem Erwerb der Lehramtsbefähigung ab.
Die Qualifizierung im Seiteneinstieg kann auch in Teilzeitbeschäftigung erfolgen.
Ein Seiteneinstieg in den Lehrerberuf ist nur möglich, wenn Laufbahnbewerberinnen oder Laufbahnbewerber nicht zur Verfügung stehen.
Nach erfolgreichem Abschluss der Qualifizierungsphase, das heißt einem Prüfungsergebnis von 3,49, ist eine unbefristete Weiterbeschäftigung, gegebenenfalls auch im Beamtenverhältnis, beabsichtigt.
Die Stellen für den Seiteneinstieg werden im Bildungsportal- siehe ``Stellenangebote Seiteneinstieg''- ausgeschrieben.
Quereinstieg Bewerben können sich Absolventinnen und Absolventen von Universitäten und gleichgestellten Hochschulen, die einen Studiengang (Diplom/Magister/Master) in einem dringend benötigten Unterrichtsfach oder in einer dringend benötigten beruflichen Fachrichtung abgeschlossen haben.
Bewerberinnen und Bewerber für den Quereinstieg an den Berufsbildenden Schulen müssen außerdem eine mindestens einjährige förderliche berufspraktische Tätigkeit nachweisen.
Die Ausbildung als Quereinsteigerin / Quereinsteiger erfolgt im Rahmen eines achtzehnmonatigen Vorbereitungsdienstes im Beamtenverhältnis auf Widerruf (Referendariat) in einer Fachrichtung und in einem Unterrichtsfach.
Für die Ableistung dieses Vorbereitungsdienstes gelten die gleichen Vorschriften und Bedingungen, wie für die Bewerberinnen und Bewerber, die auf Lehramt studiert haben.
Eine Gleichstellung mit der Ersten Staatsprüfung für das Lehramt erfolgt jedoch nicht.
Neben dem Weg über den Vorbereitungsdienst, besteht auch die Möglichkeit, sich direkt für die Einstellung in den niedersächsischen Schuldienst zu bewerben.
Bei direkter Bewerbung für den Schuldienst erfolgt eine Berücksichtigung im Bewerbungs- und Auswahlverfahren nur nachrangig, da es grundsätzliches Ziel der Landesregierung ist, Lehrkräfte mit grundständiger Lehramtsausbildung einzustellen.
Die Möglichkeit der Bewerbung besteht bei allgemein bildenden Schulen für Stellen an Haupt- und Realschulen, Gesamtschulen, Gymnasien und an Förderschulen sowie an allen berufsbildenden Schulen.",0.90356,0.86345,0.554,0,0,"Grundsätzlich wird vor der Bewerbung für eine dieser Maßnahmen dringend empfohlen, sich über die Anforderungen des Lehrkräfteberufs z.B. auf der deutschen Seite des Programms ``Career Counselling for Teachers'' (CCT) zu informieren und Ihre persönliche Eignung als Lehrerin oder Lehrer festzustellen.
Quereinstieg in den pädagogischen Vorbereitungsdienst (Referendariat) Die Möglichkeit für einen Quereinstieg in den pädagogischen Vorbereitungsdienst existiert bereits seit mehreren Jahren und ist in Teilbereichen dieser Lehrämter möglich :.
Lehramt an Haupt- und Realschulen Unter bestimmten Voraussetzungen kann ein fachlich passender universitärer Studienabschluss einer ersten Staatsprüfung für ein Lehramt gleichgestellt werden und die Bewerberin bzw. der Bewerber direkt in das Referendariat eintreten.
Wenn Sie die Voraussetzungen für einen Quereinstieg nicht erfüllen, haben Sie die Möglichkeit, Studien- und Prüfungsleistungen eines vorangegangenen Studiums auf ein Lehramtsstudium anrechnen zu lassen.
Der Gesetzgeber hat mit dem Lehrerausbildungsgesetz vom 12. Mai 2009 (§ 13) die Eckpunkte einer berufsbegleitenden Ausbildung für Seiteneinsteigerinnen und Seiteneinsteiger festgelegt.
Wenn Bewerberinnen und Bewerber das Ziel haben, im Rahmen einer Beschäftigung im Schuldienst die zweijährige berufsbegleitende Ausbildung nach der Ordnung zur berufsbegleitenden Ausbildung von Seiteneinsteigerinnen und Seiteneinsteigern und der Staatsprüfung (OBAS) zu absolvieren, müssen sie sich zunächst auf die Stellenausschreibung einer Schule bewerben, die mit dem Zusatz ``Bewerbung von Seiteneinsteigerinnen und Seiteneinsteigern ohne Lehramtsbefähigung'' oder vergleichbaren Zusätzen die Bewerbungsmöglichkeit für Seiteneinsteigerinnen und Seiteneinsteiger eröffnet.
Stellen schreiben Schulen für den Seiteneinstieg im Internet unter www.lois.nrw.de aus.
Im Rahmen der Einstellung in den Schuldienst ist festzustellen, ob ein Einsatz in zwei Fächern und eine erfolgreiche Teilnahme an der berufsbegleitenden Ausbildung in zwei Fächern erwartet werden kann.
Im Rahmen dieser Qualifizierungsmaßnahme sind von den Seiteneinsteigerinnen und Seiteneinsteigern im ersten Jahr 15 Stunden und im zweiten Jahr 16 Stunden eigenverantwortlicher Unterricht zu erteilen.
Ein Seiteneinstieg in den Lehrerberuf ist nur möglich, wenn Laufbahnbewerberinnen oder Laufbahnbewerber nicht zur Verfügung stehen.
Bei dauerhafter Übernahme in den Schuldienst erfolgt eine Eingruppierung in die Entgeltgruppe, nach der auch voll ausgebildete Lehrkräfte vergütet werden.
Quereinstieg Bewerben können sich Absolventinnen und Absolventen von Universitäten und gleichgestellten Hochschulen, die einen Studiengang (Diplom/Magister/Master) in einem dringend benötigten Unterrichtsfach oder in einer dringend benötigten beruflichen Fachrichtung abgeschlossen haben.
Aufgrund der besonderen Bedarfs- und Bewerberlage für einige Unterrichtsfächer, berufliche und sonderpädagogische Fachrichtungen steht der Weg in den niedersächsischen Schuldienst nicht nur Lehrkräften mit einer grundständigen für die Unterrichtstätigkeit an Schulen in Niedersachsen vorgesehenen Lehramtsausbildung offen, sondern auch Bewerberinnen und Bewerbern, die ein anderes Hochschulstudium als ein Lehramtsstudium erfolgreich abgeschlossen haben oder über eine in Niedersachsen nicht als gleichwertig anerkannte Lehramtsausbildung verfügen.
Durch das erfolgreiche Ablegen der Staatsprüfung am Ende des Vorbereitungsdienstes wird die Lehrbefähigung erworben.",0.93504,0.86108,0.63379,0,0,"Ausschreibungen Aktuelle Ausschreibungen zum berufsbegleitenden Vorbereitungsdienst Allgemeine Informationen zur Seiteneinsteigerqualifizierung Stehen zur Deckung eines unabweisbaren Unterrichtsbedarfs keine ausgebildeten Lehrkräfte zur Verfügung, können Personen, die kein lehramtsbezogenes Universitätsstudium nachweisen, jedoch über einen Diplom-, Magister- oder Masterabschluss verfügen, mit dem Ziel qualifiziert werden, die Befähigung insbesondere für eines der folgenden Lehrämter zu erwerben :.
Lehramt an Haupt- und Realschulen Unter bestimmten Voraussetzungen kann ein fachlich passender universitärer Studienabschluss einer ersten Staatsprüfung für ein Lehramt gleichgestellt werden und die Bewerberin bzw. der Bewerber direkt in das Referendariat eintreten.
Nach erfolgreichem Ablegen der Zweiten Staatsprüfung ist eine Bewerbung in den Schuldienst im Rahmen der üblichen Bewerbungsverfahren möglich.
Wenn Sie die Voraussetzungen für einen Quereinstieg nicht erfüllen, haben Sie die Möglichkeit, Studien- und Prüfungsleistungen eines vorangegangenen Studiums auf ein Lehramtsstudium anrechnen zu lassen.
Quereinstieg in den hessischen Schuldienst (QuiS) Die Möglichkeiten für einen direkten Einstieg in den hessischen Schuldienst sind sehr begrenzt.
Ein Quereinstieg ist nur in der Fachrichtung Metall- und Elektrotechnik für das Lehramt an beruflichen Schulenmöglich.
Der Gesetzgeber hat mit dem Lehrerausbildungsgesetz vom 12. Mai 2009 (§ 13) die Eckpunkte einer berufsbegleitenden Ausbildung für Seiteneinsteigerinnen und Seiteneinsteiger festgelegt.
Der Zugang zu diesem berufsbegleitenden Vorbereitungsdienst ist nicht wie bisher von der formalen Anerkennung eines Hochschulabschlusses als Erste Staatsprüfung für ein Lehramt abhängig.
Auf Vorschlag der Schule unter Beteiligung einer Vertreterin oder eines Vertreters der Lehrerausbildung wird im Rahmen des Einstellungsverfahrens über die Teilnahme an der berufsbegleitenden Ausbildung entschieden.
Wenn Bewerberinnen und Bewerber das Ziel haben, im Rahmen einer Beschäftigung im Schuldienst die zweijährige berufsbegleitende Ausbildung nach der Ordnung zur berufsbegleitenden Ausbildung von Seiteneinsteigerinnen und Seiteneinsteigern und der Staatsprüfung (OBAS) zu absolvieren, müssen sie sich zunächst auf die Stellenausschreibung einer Schule bewerben, die mit dem Zusatz ``Bewerbung von Seiteneinsteigerinnen und Seiteneinsteigern ohne Lehramtsbefähigung'' oder vergleichbaren Zusätzen die Bewerbungsmöglichkeit für Seiteneinsteigerinnen und Seiteneinsteiger eröffnet.
Voraussetzungen für die Teilnahme an der berufsbegleitenden Maßnahme : An der berufsbegleitenden Ausbildung kann teilnehmen, wer 1. einen an einer Universität erworbenen Hochschulabschluss nachweist, der auf einer Regelstudienzeit von insgesamt mindestens acht Semestern beruht, 2. eine mindestens zweijährige Berufstätigkeit oder eine mindestens zweijährige Betreuung eines minderjährigen Kindes nach Abschluss des Hochschulstudiums nachweisen kann, 3. die für die Unterrichts- und Erziehungstätigkeit erforderlichen deutschen Sprachkenntnisse besitzt und 4. im Rahmen eines Auswahlverfahrens mit positiver Prognose über den Ausbildungserfolg in den Schuldienst des Landes Nordrhein-Westfalen im Tarifbeschäftigungsverhältnis eingestellt wurde.
Sie schließt mit der Staatsprüfung und dem Erwerb der Lehramtsbefähigung ab.
Mit Bestehen der Staatsprüfung werden diese Lehrkräfte in ein Dauerbeschäftigungsverhältnis, bei Vorliegen der persönlichen Voraussetzungen ins Beamtenverhältnis, übernommen.
Bewerberinnen und Bewerber, die die oben genannten Voraussetzungen für den Seiteneinstieg mit berufsbegleitender Ausbildung nicht erfüllen, können in den Schuldienst in Verbindung mit der Pädagogischen Einführung übernommen werden.
Aus Wissenschaft und Wirtschaft in die Schule : die Wege in den Schuldienst Seiteneinstieg Für Absolventinnen und Absolventen von Universitäten und gleichgestellten Hochschulen, die einen Studiengang (Diplom/Magister/Master) in einem dringend benötigten Unterrichtsfach oder in einer dringend benötigten beruflichen Fachrichtung abgeschlossen haben und eine mehrjährige praktische Berufserfahrung nachweisen, besteht die Möglichkeit einer Einstellung in den Schuldienst im Wege des Seiteneinstiegs.
Für Fachhochschulabsolventinnen und -absolventen wird ein akkreditierter Masterabschluss vorausgesetzt.
Diese Qualifizierungsmaßnahme erfolgt in einem auf zwei Jahre befristeten Beschäftigungsverhältnis berufsbegleitend in der Regel in zwei Unterrichtsfächern.
Im Rahmen dieser Qualifizierungsmaßnahme sind von den Seiteneinsteigerinnen und Seiteneinsteigern im ersten Jahr 15 Stunden und im zweiten Jahr 16 Stunden eigenverantwortlicher Unterricht zu erteilen.
Seiteneinsteigerinnen und Seiteneinsteiger mit nur einem Unterrichtsfach müssen im ersten Jahr 17 Stunden und im zweiten Jahr 18 Stunden eigenverantwortlichen Unterricht erteilen.
Darüber hinaus nehmen die Seiteneinsteigerinnen / Seiteneinsteiger an Ausbildungsveranstaltungen des Instituts für Qualitätsentwicklung an Schulen Schleswig-Holstein (IQSH) für Laufbahnbewerberinnen und Laufbahnbewerber teil.
Die Qualifizierung im Seiteneinstieg kann auch in Teilzeitbeschäftigung erfolgen.
Ein Seiteneinstieg in den Lehrerberuf ist nur möglich, wenn Laufbahnbewerberinnen oder Laufbahnbewerber nicht zur Verfügung stehen.
Nach erfolgreichem Abschluss der Qualifizierungsphase, das heißt einem Prüfungsergebnis von 3,49, ist eine unbefristete Weiterbeschäftigung, gegebenenfalls auch im Beamtenverhältnis, beabsichtigt.
Eine Übernahme in das Beamtenverhältnis ist unter anderem nur möglich, wenn nach Beendigung der Qualifizierungsphase die Höchstaltersgrenze, das heißt die Vollendung des 45.
Lebensjahres, noch nicht überschritten ist.
Quereinstieg Bewerben können sich Absolventinnen und Absolventen von Universitäten und gleichgestellten Hochschulen, die einen Studiengang (Diplom/Magister/Master) in einem dringend benötigten Unterrichtsfach oder in einer dringend benötigten beruflichen Fachrichtung abgeschlossen haben.
Bewerberinnen und Bewerber für den Quereinstieg an den Berufsbildenden Schulen müssen außerdem eine mindestens einjährige förderliche berufspraktische Tätigkeit nachweisen.
Die Ausbildung als Quereinsteigerin / Quereinsteiger erfolgt im Rahmen eines achtzehnmonatigen Vorbereitungsdienstes im Beamtenverhältnis auf Widerruf (Referendariat) in einer Fachrichtung und in einem Unterrichtsfach.
Für die Ableistung dieses Vorbereitungsdienstes gelten die gleichen Vorschriften und Bedingungen, wie für die Bewerberinnen und Bewerber, die auf Lehramt studiert haben.
Eine Gleichstellung mit der Ersten Staatsprüfung für das Lehramt erfolgt jedoch nicht.
Aufgrund der besonderen Bedarfs- und Bewerberlage für einige Unterrichtsfächer, berufliche und sonderpädagogische Fachrichtungen steht der Weg in den niedersächsischen Schuldienst nicht nur Lehrkräften mit einer grundständigen für die Unterrichtstätigkeit an Schulen in Niedersachsen vorgesehenen Lehramtsausbildung offen, sondern auch Bewerberinnen und Bewerbern, die ein anderes Hochschulstudium als ein Lehramtsstudium erfolgreich abgeschlossen haben oder über eine in Niedersachsen nicht als gleichwertig anerkannte Lehramtsausbildung verfügen.
Der Quereinstieg in den niedersächsischen Schuldienst ist auf zwei Wegenmöglich : Der favorisierte Weg über den Vorbereitungsdienst ist nur für bestimmte Fächer und Studienabschlüsse möglich.
Neben dem Weg über den Vorbereitungsdienst, besteht auch die Möglichkeit, sich direkt für die Einstellung in den niedersächsischen Schuldienst zu bewerben.",0.74809,0.62069,0.40549,0,0,"Lehramt an Haupt- und Realschulen Unter bestimmten Voraussetzungen kann ein fachlich passender universitärer Studienabschluss einer ersten Staatsprüfung für ein Lehramt gleichgestellt werden und die Bewerberin bzw. der Bewerber direkt in das Referendariat eintreten.
Ein Quereinstieg ist nur in der Fachrichtung Metall- und Elektrotechnik für das Lehramt an beruflichen Schulenmöglich.
Der Gesetzgeber hat mit dem Lehrerausbildungsgesetz vom 12. Mai 2009 (§ 13) die Eckpunkte einer berufsbegleitenden Ausbildung für Seiteneinsteigerinnen und Seiteneinsteiger festgelegt.
Stellen schreiben Schulen für den Seiteneinstieg im Internet unter www.lois.nrw.de aus.
Sie schließt mit der Staatsprüfung und dem Erwerb der Lehramtsbefähigung ab.
Die Unterrichtsfächer sollten sich aus dem absolvierten Studium ergeben.
Nach erfolgreichem Abschluss der Qualifizierungsphase, das heißt einem Prüfungsergebnis von 3,49, ist eine unbefristete Weiterbeschäftigung, gegebenenfalls auch im Beamtenverhältnis, beabsichtigt.
Quereinstieg Bewerben können sich Absolventinnen und Absolventen von Universitäten und gleichgestellten Hochschulen, die einen Studiengang (Diplom/Magister/Master) in einem dringend benötigten Unterrichtsfach oder in einer dringend benötigten beruflichen Fachrichtung abgeschlossen haben.
Für Fachhochschulabsolventinnen und -absolventen wird ein Masterabschluss vorausgesetzt.
Aufgrund der besonderen Bedarfs- und Bewerberlage für einige Unterrichtsfächer, berufliche und sonderpädagogische Fachrichtungen steht der Weg in den niedersächsischen Schuldienst nicht nur Lehrkräften mit einer grundständigen für die Unterrichtstätigkeit an Schulen in Niedersachsen vorgesehenen Lehramtsausbildung offen, sondern auch Bewerberinnen und Bewerbern, die ein anderes Hochschulstudium als ein Lehramtsstudium erfolgreich abgeschlossen haben oder über eine in Niedersachsen nicht als gleichwertig anerkannte Lehramtsausbildung verfügen."
1,0.5118,0.25091,0.24255,0,0,"Ausschreibungen Aktuelle Ausschreibungen zum berufsbegleitenden Vorbereitungsdienst Allgemeine Informationen zur Seiteneinsteigerqualifizierung Stehen zur Deckung eines unabweisbaren Unterrichtsbedarfs keine ausgebildeten Lehrkräfte zur Verfügung, können Personen, die kein lehramtsbezogenes Universitätsstudium nachweisen, jedoch über einen Diplom-, Magister- oder Masterabschluss verfügen, mit dem Ziel qualifiziert werden, die Befähigung insbesondere für eines der folgenden Lehrämter zu erwerben :.
Maßnahmen der Lehrkräftequalifizierung sind :.
Teilnahme am berufsbegleitenden Vorbereitungsdienst gemäß § 7 Absatz 1BbgLeBiG (nähere Informationen).
Die Veröffentlichung der Ausschreibung erfolgt in diesem Fall frühestens im Mai des jeweiligen Jahres im Amtsblatt des Ministeriums für Bildung, Jugend und Sport.
Der Ausschreibung sind die Angaben zu Bewerbungsfristen, Fächerkombinationen und den einzureichenden Unterlagen zu entnehmen.
Lehramt an Haupt- und Realschulen Unter bestimmten Voraussetzungen kann ein fachlich passender universitärer Studienabschluss einer ersten Staatsprüfung für ein Lehramt gleichgestellt werden und die Bewerberin bzw. der Bewerber direkt in das Referendariat eintreten.
Studien- und Prüfungsleistungen, aus denen ein zweites Fach als Unterrichtsfach abgeleitet und anerkannt werden kann.
Ein Lebensalter von höchstens 40 Jahren.
Bewerberinnen und Bewerber mit Behinderungen gem.
Wenn Sie die Voraussetzungen für einen Quereinstieg nicht erfüllen, haben Sie die Möglichkeit, Studien- und Prüfungsleistungen eines vorangegangenen Studiums auf ein Lehramtsstudium anrechnen zu lassen.
Die Prüfungsstellen der Hessischen Lehrkräfteakademie halten im Internet entsprechende Antragsformulare bereit.
Auf Vorschlag der Schule unter Beteiligung einer Vertreterin oder eines Vertreters der Lehrerausbildung wird im Rahmen des Einstellungsverfahrens über die Teilnahme an der berufsbegleitenden Ausbildung entschieden.
Zeitpunkt und Note des Abschlusses können in die Gesamtbewertung einfließen; einschlägige Berufserfahrungen sollen berücksichtigt werden.
Die Ausbildung umfasst 24 Monate.
Mit Bestehen der Staatsprüfung werden diese Lehrkräfte in ein Dauerbeschäftigungsverhältnis, bei Vorliegen der persönlichen Voraussetzungen ins Beamtenverhältnis, übernommen.
Die Handreichung zur Pädagogischen Einführung dienst als Unterstützung für Schulleitungen und Lehrkräfte bei der Bewältigung der besonderen Anforderungen an die Einarbeitung und leistet konkrete Hilfestellungen hinsichtlich der Gewährleistung unterstützender schulinterner Maßnahmen für diese Lehrkräfte Aktuell sind die Bewerbungschancen mit Ausnahme der MINT-Fächer, Elektrotechnik, Kfz-Technik und Maschinenbautechnik sehr gering.
Darüber hinaus nehmen die Seiteneinsteigerinnen / Seiteneinsteiger an Ausbildungsveranstaltungen des Instituts für Qualitätsentwicklung an Schulen Schleswig-Holstein (IQSH) für Laufbahnbewerberinnen und Laufbahnbewerber teil.
Die Qualifizierung im Seiteneinstieg kann auch in Teilzeitbeschäftigung erfolgen.
Lebensjahres, noch nicht überschritten ist.
Senden Sie bitte Ihre formlose Bewerbung mit einem tabellarischen Lebenslauf sowie unbeglaubigten Zeugniskopien und Arbeitsnachweisen an die dort angegebene E-Mail-Adresse.
Informationen über deren Höhe finden Sie unter ``Stellenmarkt Schule- Einstellung in den Vorbereitungsdienst- Merkblatt''.
: 0431 988-2444 E-Mail : waldemar.maron @ bimi.landsh.de Stellenangebote Max-Planck-Schule, Gymnasium der Landeshauptstadt Kiel; Physik und Informatik, zur pdf-Datei Schule am Meer, Lübeck, Mathematik und Chemie, zur pdf-Datei Publikationen.
Durch das erfolgreiche Ablegen der Staatsprüfung am Ende des Vorbereitungsdienstes wird die Lehrbefähigung erworben.
Bei direkter Bewerbung für den Schuldienst erfolgt eine Berücksichtigung im Bewerbungs- und Auswahlverfahren nur nachrangig, da es grundsätzliches Ziel der Landesregierung ist, Lehrkräfte mit grundständiger Lehramtsausbildung einzustellen.
Die Möglichkeit der Bewerbung besteht bei allgemein bildenden Schulen für Stellen an Haupt- und Realschulen, Gesamtschulen, Gymnasien und an Förderschulen sowie an allen berufsbildenden Schulen.",0.49895,0.23319,0.22415,0,0,"Ausschreibungen Aktuelle Ausschreibungen zum berufsbegleitenden Vorbereitungsdienst Allgemeine Informationen zur Seiteneinsteigerqualifizierung Stehen zur Deckung eines unabweisbaren Unterrichtsbedarfs keine ausgebildeten Lehrkräfte zur Verfügung, können Personen, die kein lehramtsbezogenes Universitätsstudium nachweisen, jedoch über einen Diplom-, Magister- oder Masterabschluss verfügen, mit dem Ziel qualifiziert werden, die Befähigung insbesondere für eines der folgenden Lehrämter zu erwerben :.
Maßnahmen der Lehrkräftequalifizierung sind :.
Teilnahme am berufsbegleitenden Vorbereitungsdienst gemäß § 7 Absatz 1BbgLeBiG (nähere Informationen).
Die Veröffentlichung der Ausschreibung erfolgt in diesem Fall frühestens im Mai des jeweiligen Jahres im Amtsblatt des Ministeriums für Bildung, Jugend und Sport.
Der Ausschreibung sind die Angaben zu Bewerbungsfristen, Fächerkombinationen und den einzureichenden Unterlagen zu entnehmen.
Lehramt an Haupt- und Realschulen Unter bestimmten Voraussetzungen kann ein fachlich passender universitärer Studienabschluss einer ersten Staatsprüfung für ein Lehramt gleichgestellt werden und die Bewerberin bzw. der Bewerber direkt in das Referendariat eintreten.
Studien- und Prüfungsleistungen, aus denen ein zweites Fach als Unterrichtsfach abgeleitet und anerkannt werden kann.
Bewerberinnen und Bewerber mit Behinderungen gem.
Wenn Sie die Voraussetzungen für einen Quereinstieg nicht erfüllen, haben Sie die Möglichkeit, Studien- und Prüfungsleistungen eines vorangegangenen Studiums auf ein Lehramtsstudium anrechnen zu lassen.
Auf Vorschlag der Schule unter Beteiligung einer Vertreterin oder eines Vertreters der Lehrerausbildung wird im Rahmen des Einstellungsverfahrens über die Teilnahme an der berufsbegleitenden Ausbildung entschieden.
Zeitpunkt und Note des Abschlusses können in die Gesamtbewertung einfließen; einschlägige Berufserfahrungen sollen berücksichtigt werden.
Die Ausbildung umfasst 24 Monate.
Mit Bestehen der Staatsprüfung werden diese Lehrkräfte in ein Dauerbeschäftigungsverhältnis, bei Vorliegen der persönlichen Voraussetzungen ins Beamtenverhältnis, übernommen.
Die Qualifizierung im Seiteneinstieg kann auch in Teilzeitbeschäftigung erfolgen.
Lebensjahres, noch nicht überschritten ist.
Senden Sie bitte Ihre formlose Bewerbung mit einem tabellarischen Lebenslauf sowie unbeglaubigten Zeugniskopien und Arbeitsnachweisen an die dort angegebene E-Mail-Adresse.
Zurzeit ist die Einstellung von Quereinsteigerinnen und Quereinsteigern nur an den Berufsbildenden Schulen und hier nur in den Fachrichtungen Bautechnik, Elektrotechnik, Metalltechnik, Fahrzeugtechnik, Informationstechnik, Sozialpädagogik, Agrarwissenschaften sowie Labortechnik/Prozesstechnik möglich.
Informationen über deren Höhe finden Sie unter ``Stellenmarkt Schule- Einstellung in den Vorbereitungsdienst- Merkblatt''.
: 0431 988-2444 E-Mail : waldemar.maron @ bimi.landsh.de Stellenangebote Max-Planck-Schule, Gymnasium der Landeshauptstadt Kiel; Physik und Informatik, zur pdf-Datei Schule am Meer, Lübeck, Mathematik und Chemie, zur pdf-Datei Publikationen.
Durch das erfolgreiche Ablegen der Staatsprüfung am Ende des Vorbereitungsdienstes wird die Lehrbefähigung erworben.
Bei direkter Bewerbung für den Schuldienst erfolgt eine Berücksichtigung im Bewerbungs- und Auswahlverfahren nur nachrangig, da es grundsätzliches Ziel der Landesregierung ist, Lehrkräfte mit grundständiger Lehramtsausbildung einzustellen.
Die Möglichkeit der Bewerbung besteht bei allgemein bildenden Schulen für Stellen an Haupt- und Realschulen, Gesamtschulen, Gymnasien und an Förderschulen sowie an allen berufsbildenden Schulen.",0.61811,0.39015,0.31332,0,0,"Ausschreibungen Aktuelle Ausschreibungen zum berufsbegleitenden Vorbereitungsdienst Allgemeine Informationen zur Seiteneinsteigerqualifizierung Stehen zur Deckung eines unabweisbaren Unterrichtsbedarfs keine ausgebildeten Lehrkräfte zur Verfügung, können Personen, die kein lehramtsbezogenes Universitätsstudium nachweisen, jedoch über einen Diplom-, Magister- oder Masterabschluss verfügen, mit dem Ziel qualifiziert werden, die Befähigung insbesondere für eines der folgenden Lehrämter zu erwerben :.
Die Lehramtsbefähigung für die Sekundarstufe II (berufliche Fächer) kann auch erworben werden, wenn der Diplom- oder Masterabschluss eines einschlägigen Fachhochschulstudiums nachgewiesen wird.
Teilnahme am berufsbegleitenden Vorbereitungsdienst gemäß § 7 Absatz 1BbgLeBiG (nähere Informationen).
Grundsätzlich wird vor der Bewerbung für eine dieser Maßnahmen dringend empfohlen, sich über die Anforderungen des Lehrkräfteberufs z.B. auf der deutschen Seite des Programms ``Career Counselling for Teachers'' (CCT) zu informieren und Ihre persönliche Eignung als Lehrerin oder Lehrer festzustellen.
Die Veröffentlichung der Ausschreibung erfolgt in diesem Fall frühestens im Mai des jeweiligen Jahres im Amtsblatt des Ministeriums für Bildung, Jugend und Sport.
Der Ausschreibung sind die Angaben zu Bewerbungsfristen, Fächerkombinationen und den einzureichenden Unterlagen zu entnehmen.
Lehramt an Haupt- und Realschulen Unter bestimmten Voraussetzungen kann ein fachlich passender universitärer Studienabschluss einer ersten Staatsprüfung für ein Lehramt gleichgestellt werden und die Bewerberin bzw. der Bewerber direkt in das Referendariat eintreten.
Studien- und Prüfungsleistungen, aus denen ein zweites Fach als Unterrichtsfach abgeleitet und anerkannt werden kann.
Ein Lebensalter von höchstens 40 Jahren.
Bewerberinnen und Bewerber mit Behinderungen gem.
Wenn Sie die Voraussetzungen für einen Quereinstieg nicht erfüllen, haben Sie die Möglichkeit, Studien- und Prüfungsleistungen eines vorangegangenen Studiums auf ein Lehramtsstudium anrechnen zu lassen.
Die Prüfungsstellen der Hessischen Lehrkräfteakademie halten im Internet entsprechende Antragsformulare bereit.
Voraussetzungen für die Teilnahme an der berufsbegleitenden Maßnahme : An der berufsbegleitenden Ausbildung kann teilnehmen, wer 1. einen an einer Universität erworbenen Hochschulabschluss nachweist, der auf einer Regelstudienzeit von insgesamt mindestens acht Semestern beruht, 2. eine mindestens zweijährige Berufstätigkeit oder eine mindestens zweijährige Betreuung eines minderjährigen Kindes nach Abschluss des Hochschulstudiums nachweisen kann, 3. die für die Unterrichts- und Erziehungstätigkeit erforderlichen deutschen Sprachkenntnisse besitzt und 4. im Rahmen eines Auswahlverfahrens mit positiver Prognose über den Ausbildungserfolg in den Schuldienst des Landes Nordrhein-Westfalen im Tarifbeschäftigungsverhältnis eingestellt wurde.
Die Entscheidung über den Zugang zur Ausbildung für den Lehrerberuf basiert auf der Einschätzung der Eignung der Bewerberin oder des Bewerbers im Rahmen einer Prognose über den zu diesem Zeitpunkt erwarteten Ausbildungserfolg in den beiden Fächern, die im Einstellungsverfahren getroffen wird.
Bei dieser Prognoseentscheidung sind insbesondere für das erste Fach vorgelegte Hochschulabschlüsse und fachwissenschaftliche Studieninhalte zu berücksichtigen.
Für das zweite Fach sind im Regelfall mindestens ein Drittel der fachwissenschaftlichen Studienleistungen nachzuweisen.
Vergleichsmaßstab sind die Studienleistungen, die im Rahmen des jeweiligen Lehramtsstudiums für dieses Fach zu erbringen sind.
Zeitpunkt und Note des Abschlusses können in die Gesamtbewertung einfließen; einschlägige Berufserfahrungen sollen berücksichtigt werden.
Die Ausbildung umfasst 24 Monate.
Mit Bestehen der Staatsprüfung werden diese Lehrkräfte in ein Dauerbeschäftigungsverhältnis, bei Vorliegen der persönlichen Voraussetzungen ins Beamtenverhältnis, übernommen.
Die Handreichung zur Pädagogischen Einführung dienst als Unterstützung für Schulleitungen und Lehrkräfte bei der Bewältigung der besonderen Anforderungen an die Einarbeitung und leistet konkrete Hilfestellungen hinsichtlich der Gewährleistung unterstützender schulinterner Maßnahmen für diese Lehrkräfte Aktuell sind die Bewerbungschancen mit Ausnahme der MINT-Fächer, Elektrotechnik, Kfz-Technik und Maschinenbautechnik sehr gering.
Für Fachhochschulabsolventinnen und -absolventen wird ein akkreditierter Masterabschluss vorausgesetzt.
Die Unterrichtsfächer sollten sich aus dem absolvierten Studium ergeben.
Darüber hinaus nehmen die Seiteneinsteigerinnen / Seiteneinsteiger an Ausbildungsveranstaltungen des Instituts für Qualitätsentwicklung an Schulen Schleswig-Holstein (IQSH) für Laufbahnbewerberinnen und Laufbahnbewerber teil.
Die Qualifizierung im Seiteneinstieg kann auch in Teilzeitbeschäftigung erfolgen.
Nach erfolgreichem Abschluss der Qualifizierungsphase, das heißt einem Prüfungsergebnis von 3,49, ist eine unbefristete Weiterbeschäftigung, gegebenenfalls auch im Beamtenverhältnis, beabsichtigt.
Lebensjahres, noch nicht überschritten ist.
Bei der Tätigkeit unter Einschluss des Sekundarstufe II-Bereichs an Gymnasien und Gemeinschaftsschulen mit Oberstufe sowie an den beruflichen Schulen erfolgt die tarifliche Vergütung nach der Entgeltgruppe 12 Stufe 1 TV-L; bei der Tätigkeit im Sekundarstufe I-Bereich an Regional- und Gemeinschaftsschulen erfolgt die Vergütung nach der Entgeltgruppe 11 Stufe 1 TV-L.
Die Stellen für den Seiteneinstieg werden im Bildungsportal- siehe ``Stellenangebote Seiteneinstieg''- ausgeschrieben.
Senden Sie bitte Ihre formlose Bewerbung mit einem tabellarischen Lebenslauf sowie unbeglaubigten Zeugniskopien und Arbeitsnachweisen an die dort angegebene E-Mail-Adresse.
Quereinstieg Bewerben können sich Absolventinnen und Absolventen von Universitäten und gleichgestellten Hochschulen, die einen Studiengang (Diplom/Magister/Master) in einem dringend benötigten Unterrichtsfach oder in einer dringend benötigten beruflichen Fachrichtung abgeschlossen haben.
Zurzeit ist die Einstellung von Quereinsteigerinnen und Quereinsteigern nur an den Berufsbildenden Schulen und hier nur in den Fachrichtungen Bautechnik, Elektrotechnik, Metalltechnik, Fahrzeugtechnik, Informationstechnik, Sozialpädagogik, Agrarwissenschaften sowie Labortechnik/Prozesstechnik möglich.
Ausdrücklich begrüßen wir es, wenn sich Menschen mit Migrationshintergrund bei uns bewerben.
Auf die Vorlage von Lichtbildern/Bewerbungsfotos verzichten wir ausdrücklich und bitten daher, hiervon abzusehen.
Für die Ableistung dieses Vorbereitungsdienstes gelten die gleichen Vorschriften und Bedingungen, wie für die Bewerberinnen und Bewerber, die auf Lehramt studiert haben.
Während der Ausbildung im Vorbereitungsdienst werden Anwärterbezüge gewährt.
Informationen über deren Höhe finden Sie unter ``Stellenmarkt Schule- Einstellung in den Vorbereitungsdienst- Merkblatt''.
Beratung Ministerium für Schule und Berufsbildung des Landes Schleswig-Holstein Waldemar Maron / III 4211 Brunswiker Straße 16-22 24105 Kiel Tel.
: 0431 988-2444 E-Mail : waldemar.maron @ bimi.landsh.de Stellenangebote Max-Planck-Schule, Gymnasium der Landeshauptstadt Kiel; Physik und Informatik, zur pdf-Datei Schule am Meer, Lübeck, Mathematik und Chemie, zur pdf-Datei Publikationen.
Durch das erfolgreiche Ablegen der Staatsprüfung am Ende des Vorbereitungsdienstes wird die Lehrbefähigung erworben.
Weitere Informationen über die Bewerbungsvoraussetzungen und Einstellungsmodalitäten für den direkten Quereinstieg finden Sie im Merkblatt für den direkten Quereinstieg.",0.44656,0.15709,0.16635,0,0,"Die Lehramtsbefähigung für die Sekundarstufe II (berufliche Fächer) kann auch erworben werden, wenn der Diplom- oder Masterabschluss eines einschlägigen Fachhochschulstudiums nachgewiesen wird.
Teilnahme am berufsbegleitenden Vorbereitungsdienst gemäß § 7 Absatz 1BbgLeBiG (nähere Informationen).
Die Ausbildung umfasst 24 Monate.
Zeitpunkt und Note des Abschlusses können in die Gesamtbewertung einfließen; einschlägige Berufserfahrungen sollen berücksichtigt werden.
Der Ausschreibung sind die Angaben zu Bewerbungsfristen, Fächerkombinationen und den einzureichenden Unterlagen zu entnehmen.
Informationen über deren Höhe finden Sie unter ``Stellenmarkt Schule- Einstellung in den Vorbereitungsdienst- Merkblatt''.
Nach erfolgreichem Ablegen der Zweiten Staatsprüfung ist eine Bewerbung in den Schuldienst im Rahmen der üblichen Bewerbungsverfahren möglich.
Mit Bestehen der Staatsprüfung werden diese Lehrkräfte in ein Dauerbeschäftigungsverhältnis, bei Vorliegen der persönlichen Voraussetzungen ins Beamtenverhältnis, übernommen.
Studien- und Prüfungsleistungen, aus denen ein zweites Fach als Unterrichtsfach abgeleitet und anerkannt werden kann.
Einstellung von Bewerberinnen und Bewerbern ohne Lehrbefähigung (Seiteneinstieg) Weitere Informationen.
Eine Gleichstellung mit der Ersten Staatsprüfung für das Lehramt erfolgt jedoch nicht.
Ein Seiteneinstieg in den Lehrerberuf ist nur möglich, wenn Laufbahnbewerberinnen oder Laufbahnbewerber nicht zur Verfügung stehen.
Ein Quereinstieg ist nur in der Fachrichtung Metall- und Elektrotechnik für das Lehramt an beruflichen Schulenmöglich.
Die Möglichkeit der Bewerbung besteht bei allgemein bildenden Schulen für Stellen an Haupt- und Realschulen, Gesamtschulen, Gymnasien und an Förderschulen sowie an allen berufsbildenden Schulen.
In beiden Fällen ist die erfolgreiche Teilnahme am entsprechenden Bewerbungs- und Auswahlverfahren erforderlich."
