8,0.78584,0.66364,0.48872,11,1,"Ausschreibungen Aktuelle Ausschreibungen zum berufsbegleitenden Vorbereitungsdienst Allgemeine Informationen zur Seiteneinsteigerqualifizierung Stehen zur Deckung eines unabweisbaren Unterrichtsbedarfs keine ausgebildeten Lehrkräfte zur Verfügung, können Personen, die kein lehramtsbezogenes Universitätsstudium nachweisen, jedoch über einen Diplom-, Magister- oder Masterabschluss verfügen, mit dem Ziel qualifiziert werden, die Befähigung insbesondere für eines der folgenden Lehrämter zu erwerben :.
Die Stellen für den Seiteneinstieg werden im Bildungsportal- siehe ``Stellenangebote Seiteneinstieg''- ausgeschrieben.
Im Rahmen der Einstellung in den Schuldienst ist festzustellen, ob ein Einsatz in zwei Fächern und eine erfolgreiche Teilnahme an der berufsbegleitenden Ausbildung in zwei Fächern erwartet werden kann.
Die Lehramtsbefähigung für die Sekundarstufe II (berufliche Fächer) kann auch erworben werden, wenn der Diplom- oder Masterabschluss eines einschlägigen Fachhochschulstudiums nachgewiesen wird.
Für das zweite Fach sind im Regelfall mindestens ein Drittel der fachwissenschaftlichen Studienleistungen nachzuweisen.
Teilnahme am berufsbegleitenden Vorbereitungsdienst gemäß § 7 Absatz 1BbgLeBiG (nähere Informationen).
Die Ausbildung umfasst 24 Monate.
Mit Bestehen der Staatsprüfung werden diese Lehrkräfte in ein Dauerbeschäftigungsverhältnis, bei Vorliegen der persönlichen Voraussetzungen ins Beamtenverhältnis, übernommen.
Lehramt an Haupt- und Realschulen Unter bestimmten Voraussetzungen kann ein fachlich passender universitärer Studienabschluss einer ersten Staatsprüfung für ein Lehramt gleichgestellt werden und die Bewerberin bzw. der Bewerber direkt in das Referendariat eintreten.
Für die Ableistung dieses Vorbereitungsdienstes gelten die gleichen Vorschriften und Bedingungen, wie für die Bewerberinnen und Bewerber, die auf Lehramt studiert haben.
Die Entscheidung über den Zugang zur Ausbildung für den Lehrerberuf basiert auf der Einschätzung der Eignung der Bewerberin oder des Bewerbers im Rahmen einer Prognose über den zu diesem Zeitpunkt erwarteten Ausbildungserfolg in den beiden Fächern, die im Einstellungsverfahren getroffen wird.
Wenn Sie die Voraussetzungen für einen Quereinstieg nicht erfüllen, haben Sie die Möglichkeit, Studien- und Prüfungsleistungen eines vorangegangenen Studiums auf ein Lehramtsstudium anrechnen zu lassen.
Die Ausbildung als Quereinsteigerin / Quereinsteiger erfolgt im Rahmen eines achtzehnmonatigen Vorbereitungsdienstes im Beamtenverhältnis auf Widerruf (Referendariat) in einer Fachrichtung und in einem Unterrichtsfach.
Die Qualifizierung im Seiteneinstieg kann auch in Teilzeitbeschäftigung erfolgen.
Ein Seiteneinstieg in den Lehrerberuf ist nur möglich, wenn Laufbahnbewerberinnen oder Laufbahnbewerber nicht zur Verfügung stehen.
Bei direkter Bewerbung für den Schuldienst erfolgt eine Berücksichtigung im Bewerbungs- und Auswahlverfahren nur nachrangig, da es grundsätzliches Ziel der Landesregierung ist, Lehrkräfte mit grundständiger Lehramtsausbildung einzustellen.
Die Möglichkeit der Bewerbung besteht bei allgemein bildenden Schulen für Stellen an Haupt- und Realschulen, Gesamtschulen, Gymnasien und an Förderschulen sowie an allen berufsbildenden Schulen.
Quereinstieg Bewerben können sich Absolventinnen und Absolventen von Universitäten und gleichgestellten Hochschulen, die einen Studiengang (Diplom/Magister/Master) in einem dringend benötigten Unterrichtsfach oder in einer dringend benötigten beruflichen Fachrichtung abgeschlossen haben.
Wenn Bewerberinnen und Bewerber das Ziel haben, im Rahmen einer Beschäftigung im Schuldienst die zweijährige berufsbegleitende Ausbildung nach der Ordnung zur berufsbegleitenden Ausbildung von Seiteneinsteigerinnen und Seiteneinsteigern und der Staatsprüfung (OBAS) zu absolvieren, müssen sie sich zunächst auf die Stellenausschreibung einer Schule bewerben, die mit dem Zusatz ``Bewerbung von Seiteneinsteigerinnen und Seiteneinsteigern ohne Lehramtsbefähigung'' oder vergleichbaren Zusätzen die Bewerbungsmöglichkeit für Seiteneinsteigerinnen und Seiteneinsteiger eröffnet.",0.68553,0.53782,0.38495,0,4,"Ausschreibungen Aktuelle Ausschreibungen zum berufsbegleitenden Vorbereitungsdienst Allgemeine Informationen zur Seiteneinsteigerqualifizierung Stehen zur Deckung eines unabweisbaren Unterrichtsbedarfs keine ausgebildeten Lehrkräfte zur Verfügung, können Personen, die kein lehramtsbezogenes Universitätsstudium nachweisen, jedoch über einen Diplom-, Magister- oder Masterabschluss verfügen, mit dem Ziel qualifiziert werden, die Befähigung insbesondere für eines der folgenden Lehrämter zu erwerben :.
Im Rahmen der Einstellung in den Schuldienst ist festzustellen, ob ein Einsatz in zwei Fächern und eine erfolgreiche Teilnahme an der berufsbegleitenden Ausbildung in zwei Fächern erwartet werden kann.
Quereinstieg Bewerben können sich Absolventinnen und Absolventen von Universitäten und gleichgestellten Hochschulen, die einen Studiengang (Diplom/Magister/Master) in einem dringend benötigten Unterrichtsfach oder in einer dringend benötigten beruflichen Fachrichtung abgeschlossen haben.
Für das zweite Fach sind im Regelfall mindestens ein Drittel der fachwissenschaftlichen Studienleistungen nachzuweisen.
Teilnahme am berufsbegleitenden Vorbereitungsdienst gemäß § 7 Absatz 1BbgLeBiG (nähere Informationen).
Die Ausbildung als Quereinsteigerin / Quereinsteiger erfolgt im Rahmen eines achtzehnmonatigen Vorbereitungsdienstes im Beamtenverhältnis auf Widerruf (Referendariat) in einer Fachrichtung und in einem Unterrichtsfach.
Sie schließt mit der Staatsprüfung und dem Erwerb der Lehramtsbefähigung ab.
Mit Bestehen der Staatsprüfung werden diese Lehrkräfte in ein Dauerbeschäftigungsverhältnis, bei Vorliegen der persönlichen Voraussetzungen ins Beamtenverhältnis, übernommen.
Durch das erfolgreiche Ablegen der Staatsprüfung am Ende des Vorbereitungsdienstes wird die Lehrbefähigung erworben.
Lehramt an Haupt- und Realschulen Unter bestimmten Voraussetzungen kann ein fachlich passender universitärer Studienabschluss einer ersten Staatsprüfung für ein Lehramt gleichgestellt werden und die Bewerberin bzw. der Bewerber direkt in das Referendariat eintreten.
Universitärer Studienabschluss (Diplom II oder vergleichbar) in einem festgelegten Mangelfach.
Aufgrund der besonderen Bedarfs- und Bewerberlage für einige Unterrichtsfächer, berufliche und sonderpädagogische Fachrichtungen steht der Weg in den niedersächsischen Schuldienst nicht nur Lehrkräften mit einer grundständigen für die Unterrichtstätigkeit an Schulen in Niedersachsen vorgesehenen Lehramtsausbildung offen, sondern auch Bewerberinnen und Bewerbern, die ein anderes Hochschulstudium als ein Lehramtsstudium erfolgreich abgeschlossen haben oder über eine in Niedersachsen nicht als gleichwertig anerkannte Lehramtsausbildung verfügen.
Wenn Sie die Voraussetzungen für einen Quereinstieg nicht erfüllen, haben Sie die Möglichkeit, Studien- und Prüfungsleistungen eines vorangegangenen Studiums auf ein Lehramtsstudium anrechnen zu lassen.
Ein Seiteneinstieg in den Lehrerberuf ist nur möglich, wenn Laufbahnbewerberinnen oder Laufbahnbewerber nicht zur Verfügung stehen.
Bei direkter Bewerbung für den Schuldienst erfolgt eine Berücksichtigung im Bewerbungs- und Auswahlverfahren nur nachrangig, da es grundsätzliches Ziel der Landesregierung ist, Lehrkräfte mit grundständiger Lehramtsausbildung einzustellen.
Der Gesetzgeber hat mit dem Lehrerausbildungsgesetz vom 12. Mai 2009 (§ 13) die Eckpunkte einer berufsbegleitenden Ausbildung für Seiteneinsteigerinnen und Seiteneinsteiger festgelegt.
Bei dauerhafter Übernahme in den Schuldienst erfolgt eine Eingruppierung in die Entgeltgruppe, nach der auch voll ausgebildete Lehrkräfte vergütet werden.",0.7815,0.64236,0.4975,0,3,"Ausschreibungen Aktuelle Ausschreibungen zum berufsbegleitenden Vorbereitungsdienst Allgemeine Informationen zur Seiteneinsteigerqualifizierung Stehen zur Deckung eines unabweisbaren Unterrichtsbedarfs keine ausgebildeten Lehrkräfte zur Verfügung, können Personen, die kein lehramtsbezogenes Universitätsstudium nachweisen, jedoch über einen Diplom-, Magister- oder Masterabschluss verfügen, mit dem Ziel qualifiziert werden, die Befähigung insbesondere für eines der folgenden Lehrämter zu erwerben :.
Maßnahmen der Lehrkräftequalifizierung sind :.
Lehramt an Haupt- und Realschulen Unter bestimmten Voraussetzungen kann ein fachlich passender universitärer Studienabschluss einer ersten Staatsprüfung für ein Lehramt gleichgestellt werden und die Bewerberin bzw. der Bewerber direkt in das Referendariat eintreten.
Nach erfolgreichem Ablegen der Zweiten Staatsprüfung ist eine Bewerbung in den Schuldienst im Rahmen der üblichen Bewerbungsverfahren möglich.
Universitärer Studienabschluss (Diplom II oder vergleichbar) in einem festgelegten Mangelfach.
Ein Lebensalter von höchstens 40 Jahren.
Wenn Sie die Voraussetzungen für einen Quereinstieg nicht erfüllen, haben Sie die Möglichkeit, Studien- und Prüfungsleistungen eines vorangegangenen Studiums auf ein Lehramtsstudium anrechnen zu lassen.
Quereinstieg in den hessischen Schuldienst (QuiS) Die Möglichkeiten für einen direkten Einstieg in den hessischen Schuldienst sind sehr begrenzt.
Ein Quereinstieg ist nur in der Fachrichtung Metall- und Elektrotechnik für das Lehramt an beruflichen Schulenmöglich.
Der Gesetzgeber hat mit dem Lehrerausbildungsgesetz vom 12. Mai 2009 (§ 13) die Eckpunkte einer berufsbegleitenden Ausbildung für Seiteneinsteigerinnen und Seiteneinsteiger festgelegt.
Der Zugang zu diesem berufsbegleitenden Vorbereitungsdienst ist nicht wie bisher von der formalen Anerkennung eines Hochschulabschlusses als Erste Staatsprüfung für ein Lehramt abhängig.
Auf Vorschlag der Schule unter Beteiligung einer Vertreterin oder eines Vertreters der Lehrerausbildung wird im Rahmen des Einstellungsverfahrens über die Teilnahme an der berufsbegleitenden Ausbildung entschieden.
Voraussetzungen für die Teilnahme an der berufsbegleitenden Maßnahme : An der berufsbegleitenden Ausbildung kann teilnehmen, wer 1. einen an einer Universität erworbenen Hochschulabschluss nachweist, der auf einer Regelstudienzeit von insgesamt mindestens acht Semestern beruht, 2. eine mindestens zweijährige Berufstätigkeit oder eine mindestens zweijährige Betreuung eines minderjährigen Kindes nach Abschluss des Hochschulstudiums nachweisen kann, 3. die für die Unterrichts- und Erziehungstätigkeit erforderlichen deutschen Sprachkenntnisse besitzt und 4. im Rahmen eines Auswahlverfahrens mit positiver Prognose über den Ausbildungserfolg in den Schuldienst des Landes Nordrhein-Westfalen im Tarifbeschäftigungsverhältnis eingestellt wurde.
Die Entscheidung über den Zugang zur Ausbildung für den Lehrerberuf basiert auf der Einschätzung der Eignung der Bewerberin oder des Bewerbers im Rahmen einer Prognose über den zu diesem Zeitpunkt erwarteten Ausbildungserfolg in den beiden Fächern, die im Einstellungsverfahren getroffen wird.
Bei dieser Prognoseentscheidung sind insbesondere für das erste Fach vorgelegte Hochschulabschlüsse und fachwissenschaftliche Studieninhalte zu berücksichtigen.
Vergleichsmaßstab sind die Studienleistungen, die im Rahmen des jeweiligen Lehramtsstudiums für dieses Fach zu erbringen sind.
Zeitpunkt und Note des Abschlusses können in die Gesamtbewertung einfließen; einschlägige Berufserfahrungen sollen berücksichtigt werden.
Sie schließt mit der Staatsprüfung und dem Erwerb der Lehramtsbefähigung ab.
Mit Bestehen der Staatsprüfung werden diese Lehrkräfte in ein Dauerbeschäftigungsverhältnis, bei Vorliegen der persönlichen Voraussetzungen ins Beamtenverhältnis, übernommen.
Bewerberinnen und Bewerber, die die oben genannten Voraussetzungen für den Seiteneinstieg mit berufsbegleitender Ausbildung nicht erfüllen, können in den Schuldienst in Verbindung mit der Pädagogischen Einführung übernommen werden.
Für Fachhochschulabsolventinnen und -absolventen wird ein akkreditierter Masterabschluss vorausgesetzt.
Im Rahmen dieser Qualifizierungsmaßnahme sind von den Seiteneinsteigerinnen und Seiteneinsteigern im ersten Jahr 15 Stunden und im zweiten Jahr 16 Stunden eigenverantwortlicher Unterricht zu erteilen.
Darüber hinaus nehmen die Seiteneinsteigerinnen / Seiteneinsteiger an Ausbildungsveranstaltungen des Instituts für Qualitätsentwicklung an Schulen Schleswig-Holstein (IQSH) für Laufbahnbewerberinnen und Laufbahnbewerber teil.
Die Qualifizierung im Seiteneinstieg kann auch in Teilzeitbeschäftigung erfolgen.
Nach erfolgreichem Abschluss der Qualifizierungsphase, das heißt einem Prüfungsergebnis von 3,49, ist eine unbefristete Weiterbeschäftigung, gegebenenfalls auch im Beamtenverhältnis, beabsichtigt.
Lebensjahres, noch nicht überschritten ist.
Senden Sie bitte Ihre formlose Bewerbung mit einem tabellarischen Lebenslauf sowie unbeglaubigten Zeugniskopien und Arbeitsnachweisen an die dort angegebene E-Mail-Adresse.
Quereinstieg Bewerben können sich Absolventinnen und Absolventen von Universitäten und gleichgestellten Hochschulen, die einen Studiengang (Diplom/Magister/Master) in einem dringend benötigten Unterrichtsfach oder in einer dringend benötigten beruflichen Fachrichtung abgeschlossen haben.
Die Ausbildung als Quereinsteigerin / Quereinsteiger erfolgt im Rahmen eines achtzehnmonatigen Vorbereitungsdienstes im Beamtenverhältnis auf Widerruf (Referendariat) in einer Fachrichtung und in einem Unterrichtsfach.
Für die Ableistung dieses Vorbereitungsdienstes gelten die gleichen Vorschriften und Bedingungen, wie für die Bewerberinnen und Bewerber, die auf Lehramt studiert haben.
Informationen über deren Höhe finden Sie unter ``Stellenmarkt Schule- Einstellung in den Vorbereitungsdienst- Merkblatt''.
Die Ausbildung im Quereinstieg kann auch in Teilzeit erfolgen.
Beratung Ministerium für Schule und Berufsbildung des Landes Schleswig-Holstein Waldemar Maron / III 4211 Brunswiker Straße 16-22 24105 Kiel Tel.
Aufgrund der besonderen Bedarfs- und Bewerberlage für einige Unterrichtsfächer, berufliche und sonderpädagogische Fachrichtungen steht der Weg in den niedersächsischen Schuldienst nicht nur Lehrkräften mit einer grundständigen für die Unterrichtstätigkeit an Schulen in Niedersachsen vorgesehenen Lehramtsausbildung offen, sondern auch Bewerberinnen und Bewerbern, die ein anderes Hochschulstudium als ein Lehramtsstudium erfolgreich abgeschlossen haben oder über eine in Niedersachsen nicht als gleichwertig anerkannte Lehramtsausbildung verfügen.
Der Quereinstieg in den niedersächsischen Schuldienst ist auf zwei Wegenmöglich : Der favorisierte Weg über den Vorbereitungsdienst ist nur für bestimmte Fächer und Studienabschlüsse möglich.
Durch das erfolgreiche Ablegen der Staatsprüfung am Ende des Vorbereitungsdienstes wird die Lehrbefähigung erworben.
Hierdurch bestehen im anschließenden Bewerbungs- und Auswahlverfahren für den Schuldienst gleichrangige Einstellungschancen zu den Lehrkräften mit dem klassischen Weg der Lehramtsausbildung.
Die Möglichkeit der Bewerbung besteht bei allgemein bildenden Schulen für Stellen an Haupt- und Realschulen, Gesamtschulen, Gymnasien und an Förderschulen sowie an allen berufsbildenden Schulen.
Weitere Informationen über die Bewerbungsvoraussetzungen und Einstellungsmodalitäten für den direkten Quereinstieg finden Sie im Merkblatt für den direkten Quereinstieg.",0.70229,0.51724,0.34001,0,8,"Stellen schreiben Schulen für den Seiteneinstieg im Internet unter www.lois.nrw.de aus.
Quereinstieg Bewerben können sich Absolventinnen und Absolventen von Universitäten und gleichgestellten Hochschulen, die einen Studiengang (Diplom/Magister/Master) in einem dringend benötigten Unterrichtsfach oder in einer dringend benötigten beruflichen Fachrichtung abgeschlossen haben.
Für Fachhochschulabsolventinnen und -absolventen wird ein Masterabschluss vorausgesetzt.
Bewerberinnen und Bewerber für den Quereinstieg an den Berufsbildenden Schulen müssen außerdem eine mindestens einjährige förderliche berufspraktische Tätigkeit nachweisen.
Sie schließt mit der Staatsprüfung und dem Erwerb der Lehramtsbefähigung ab.
Lehramt an Haupt- und Realschulen Unter bestimmten Voraussetzungen kann ein fachlich passender universitärer Studienabschluss einer ersten Staatsprüfung für ein Lehramt gleichgestellt werden und die Bewerberin bzw. der Bewerber direkt in das Referendariat eintreten.
Nach erfolgreichem Ablegen der Zweiten Staatsprüfung ist eine Bewerbung in den Schuldienst im Rahmen der üblichen Bewerbungsverfahren möglich.
Universitärer Studienabschluss (Diplom II oder vergleichbar) in einem festgelegten Mangelfach.
Die Unterrichtsfächer sollten sich aus dem absolvierten Studium ergeben.
Daneben erfolgt die Ausbildung an den jeweiligen Schulen.
Neben dem Weg über den Vorbereitungsdienst, besteht auch die Möglichkeit, sich direkt für die Einstellung in den niedersächsischen Schuldienst zu bewerben.
Nach erfolgreichem Abschluss der Qualifizierungsphase, das heißt einem Prüfungsergebnis von 3,49, ist eine unbefristete Weiterbeschäftigung, gegebenenfalls auch im Beamtenverhältnis, beabsichtigt.
Der Gesetzgeber hat mit dem Lehrerausbildungsgesetz vom 12. Mai 2009 (§ 13) die Eckpunkte einer berufsbegleitenden Ausbildung für Seiteneinsteigerinnen und Seiteneinsteiger festgelegt."
