3,0.66425,0.47636,0.38203,22,48,"Ausschreibungen Aktuelle Ausschreibungen zum berufsbegleitenden Vorbereitungsdienst Allgemeine Informationen zur Seiteneinsteigerqualifizierung Stehen zur Deckung eines unabweisbaren Unterrichtsbedarfs keine ausgebildeten Lehrkräfte zur Verfügung, können Personen, die kein lehramtsbezogenes Universitätsstudium nachweisen, jedoch über einen Diplom-, Magister- oder Masterabschluss verfügen, mit dem Ziel qualifiziert werden, die Befähigung insbesondere für eines der folgenden Lehrämter zu erwerben :.
Die Lehramtsbefähigung für die Sekundarstufe II (berufliche Fächer) kann auch erworben werden, wenn der Diplom- oder Masterabschluss eines einschlägigen Fachhochschulstudiums nachgewiesen wird.
Teilnahme am berufsbegleitenden Vorbereitungsdienst gemäß § 7 Absatz 1BbgLeBiG (nähere Informationen).
besonderer Zugang (Einstellung) zum Vorbereitungsdienst gemäß § 7 Absatz 2BbgLeBiG (nähere Informationen).
Lehramt an Haupt- und Realschulen Unter bestimmten Voraussetzungen kann ein fachlich passender universitärer Studienabschluss einer ersten Staatsprüfung für ein Lehramt gleichgestellt werden und die Bewerberin bzw. der Bewerber direkt in das Referendariat eintreten.
Wenn Sie die Voraussetzungen für einen Quereinstieg nicht erfüllen, haben Sie die Möglichkeit, Studien- und Prüfungsleistungen eines vorangegangenen Studiums auf ein Lehramtsstudium anrechnen zu lassen.
Quereinstieg in den hessischen Schuldienst (QuiS) Die Möglichkeiten für einen direkten Einstieg in den hessischen Schuldienst sind sehr begrenzt.
Ein Quereinstieg ist nur in der Fachrichtung Metall- und Elektrotechnik für das Lehramt an beruflichen Schulenmöglich.
Stellen schreiben Schulen für den Seiteneinstieg im Internet unter www.lois.nrw.de aus.
Die Entscheidung über den Zugang zur Ausbildung für den Lehrerberuf basiert auf der Einschätzung der Eignung der Bewerberin oder des Bewerbers im Rahmen einer Prognose über den zu diesem Zeitpunkt erwarteten Ausbildungserfolg in den beiden Fächern, die im Einstellungsverfahren getroffen wird.
Bei dieser Prognoseentscheidung sind insbesondere für das erste Fach vorgelegte Hochschulabschlüsse und fachwissenschaftliche Studieninhalte zu berücksichtigen.
Für das zweite Fach sind im Regelfall mindestens ein Drittel der fachwissenschaftlichen Studienleistungen nachzuweisen.
Die Ausbildung umfasst 24 Monate.
Mit Bestehen der Staatsprüfung werden diese Lehrkräfte in ein Dauerbeschäftigungsverhältnis, bei Vorliegen der persönlichen Voraussetzungen ins Beamtenverhältnis, übernommen.
Bewerberinnen und Bewerber, die die oben genannten Voraussetzungen für den Seiteneinstieg mit berufsbegleitender Ausbildung nicht erfüllen, können in den Schuldienst in Verbindung mit der Pädagogischen Einführung übernommen werden.
Die Qualifizierung im Seiteneinstieg kann auch in Teilzeitbeschäftigung erfolgen.
Ein Seiteneinstieg in den Lehrerberuf ist nur möglich, wenn Laufbahnbewerberinnen oder Laufbahnbewerber nicht zur Verfügung stehen.
Quereinstieg Bewerben können sich Absolventinnen und Absolventen von Universitäten und gleichgestellten Hochschulen, die einen Studiengang (Diplom/Magister/Master) in einem dringend benötigten Unterrichtsfach oder in einer dringend benötigten beruflichen Fachrichtung abgeschlossen haben.
Die Ausbildung als Quereinsteigerin / Quereinsteiger erfolgt im Rahmen eines achtzehnmonatigen Vorbereitungsdienstes im Beamtenverhältnis auf Widerruf (Referendariat) in einer Fachrichtung und in einem Unterrichtsfach.
Der Quereinstieg in den niedersächsischen Schuldienst ist auf zwei Wegenmöglich : Der favorisierte Weg über den Vorbereitungsdienst ist nur für bestimmte Fächer und Studienabschlüsse möglich.
Bei direkter Bewerbung für den Schuldienst erfolgt eine Berücksichtigung im Bewerbungs- und Auswahlverfahren nur nachrangig, da es grundsätzliches Ziel der Landesregierung ist, Lehrkräfte mit grundständiger Lehramtsausbildung einzustellen.
Die Möglichkeit der Bewerbung besteht bei allgemein bildenden Schulen für Stellen an Haupt- und Realschulen, Gesamtschulen, Gymnasien und an Förderschulen sowie an allen berufsbildenden Schulen.",0.60797,0.34454,0.3242,15,44,"Ausschreibungen Aktuelle Ausschreibungen zum berufsbegleitenden Vorbereitungsdienst Allgemeine Informationen zur Seiteneinsteigerqualifizierung Stehen zur Deckung eines unabweisbaren Unterrichtsbedarfs keine ausgebildeten Lehrkräfte zur Verfügung, können Personen, die kein lehramtsbezogenes Universitätsstudium nachweisen, jedoch über einen Diplom-, Magister- oder Masterabschluss verfügen, mit dem Ziel qualifiziert werden, die Befähigung insbesondere für eines der folgenden Lehrämter zu erwerben :.
Stellen schreiben Schulen für den Seiteneinstieg im Internet unter www.lois.nrw.de aus.
Lehramt für die Sekundarstufe II (berufliche Fächer) oder.
Quereinstieg Bewerben können sich Absolventinnen und Absolventen von Universitäten und gleichgestellten Hochschulen, die einen Studiengang (Diplom/Magister/Master) in einem dringend benötigten Unterrichtsfach oder in einer dringend benötigten beruflichen Fachrichtung abgeschlossen haben.
Bei dieser Prognoseentscheidung sind insbesondere für das erste Fach vorgelegte Hochschulabschlüsse und fachwissenschaftliche Studieninhalte zu berücksichtigen.
Durch das erfolgreiche Ablegen der Staatsprüfung am Ende des Vorbereitungsdienstes wird die Lehrbefähigung erworben.
Teilnahme am berufsbegleitenden Vorbereitungsdienst gemäß § 7 Absatz 1BbgLeBiG (nähere Informationen).
Bei direkter Bewerbung für den Schuldienst erfolgt eine Berücksichtigung im Bewerbungs- und Auswahlverfahren nur nachrangig, da es grundsätzliches Ziel der Landesregierung ist, Lehrkräfte mit grundständiger Lehramtsausbildung einzustellen.
Die Ausbildung als Quereinsteigerin / Quereinsteiger erfolgt im Rahmen eines achtzehnmonatigen Vorbereitungsdienstes im Beamtenverhältnis auf Widerruf (Referendariat) in einer Fachrichtung und in einem Unterrichtsfach.
Lehramt an Haupt- und Realschulen Unter bestimmten Voraussetzungen kann ein fachlich passender universitärer Studienabschluss einer ersten Staatsprüfung für ein Lehramt gleichgestellt werden und die Bewerberin bzw. der Bewerber direkt in das Referendariat eintreten.
Universitärer Studienabschluss (Diplom II oder vergleichbar) in einem festgelegten Mangelfach.
Studien- und Prüfungsleistungen, aus denen ein zweites Fach als Unterrichtsfach abgeleitet und anerkannt werden kann.
Die Unterrichtsfächer sollten sich aus dem absolvierten Studium ergeben.
Der Quereinstieg in den niedersächsischen Schuldienst ist auf zwei Wegenmöglich : Der favorisierte Weg über den Vorbereitungsdienst ist nur für bestimmte Fächer und Studienabschlüsse möglich.
Wenn Sie die Voraussetzungen für einen Quereinstieg nicht erfüllen, haben Sie die Möglichkeit, Studien- und Prüfungsleistungen eines vorangegangenen Studiums auf ein Lehramtsstudium anrechnen zu lassen.
In beiden Fällen ist die erfolgreiche Teilnahme am entsprechenden Bewerbungs- und Auswahlverfahren erforderlich.
Eine Übernahme in das Beamtenverhältnis ist unter anderem nur möglich, wenn nach Beendigung der Qualifizierungsphase die Höchstaltersgrenze, das heißt die Vollendung des 45.
Der Gesetzgeber hat mit dem Lehrerausbildungsgesetz vom 12. Mai 2009 (§ 13) die Eckpunkte einer berufsbegleitenden Ausbildung für Seiteneinsteigerinnen und Seiteneinsteiger festgelegt.
Nähere Informationen zum Seiteneinstieg finden Sie im Erlass Einstellung von Bewerberinnen und Bewerbern ohne Lehrbefähigung (Sonderregelung Seiteneinstieg) in den Schuldienst des Landes Schleswig-Holstein vom 7. Dezember 2011 (siehe rechts als Download).
Bei dauerhafter Übernahme in den Schuldienst erfolgt eine Eingruppierung in die Entgeltgruppe, nach der auch voll ausgebildete Lehrkräfte vergütet werden.",0.7874,0.64236,0.49641,26,36,"Ausschreibungen Aktuelle Ausschreibungen zum berufsbegleitenden Vorbereitungsdienst Allgemeine Informationen zur Seiteneinsteigerqualifizierung Stehen zur Deckung eines unabweisbaren Unterrichtsbedarfs keine ausgebildeten Lehrkräfte zur Verfügung, können Personen, die kein lehramtsbezogenes Universitätsstudium nachweisen, jedoch über einen Diplom-, Magister- oder Masterabschluss verfügen, mit dem Ziel qualifiziert werden, die Befähigung insbesondere für eines der folgenden Lehrämter zu erwerben :.
Lehramt an Haupt- und Realschulen Unter bestimmten Voraussetzungen kann ein fachlich passender universitärer Studienabschluss einer ersten Staatsprüfung für ein Lehramt gleichgestellt werden und die Bewerberin bzw. der Bewerber direkt in das Referendariat eintreten.
Nach erfolgreichem Ablegen der Zweiten Staatsprüfung ist eine Bewerbung in den Schuldienst im Rahmen der üblichen Bewerbungsverfahren möglich.
Universitärer Studienabschluss (Diplom II oder vergleichbar) in einem festgelegten Mangelfach.
Ein Lebensalter von höchstens 40 Jahren.
Wenn Sie die Voraussetzungen für einen Quereinstieg nicht erfüllen, haben Sie die Möglichkeit, Studien- und Prüfungsleistungen eines vorangegangenen Studiums auf ein Lehramtsstudium anrechnen zu lassen.
Quereinstieg in den hessischen Schuldienst (QuiS) Die Möglichkeiten für einen direkten Einstieg in den hessischen Schuldienst sind sehr begrenzt.
Ein Quereinstieg ist nur in der Fachrichtung Metall- und Elektrotechnik für das Lehramt an beruflichen Schulenmöglich.
Der Gesetzgeber hat mit dem Lehrerausbildungsgesetz vom 12. Mai 2009 (§ 13) die Eckpunkte einer berufsbegleitenden Ausbildung für Seiteneinsteigerinnen und Seiteneinsteiger festgelegt.
Der Zugang zu diesem berufsbegleitenden Vorbereitungsdienst ist nicht wie bisher von der formalen Anerkennung eines Hochschulabschlusses als Erste Staatsprüfung für ein Lehramt abhängig.
Voraussetzungen für die Teilnahme an der berufsbegleitenden Maßnahme : An der berufsbegleitenden Ausbildung kann teilnehmen, wer 1. einen an einer Universität erworbenen Hochschulabschluss nachweist, der auf einer Regelstudienzeit von insgesamt mindestens acht Semestern beruht, 2. eine mindestens zweijährige Berufstätigkeit oder eine mindestens zweijährige Betreuung eines minderjährigen Kindes nach Abschluss des Hochschulstudiums nachweisen kann, 3. die für die Unterrichts- und Erziehungstätigkeit erforderlichen deutschen Sprachkenntnisse besitzt und 4. im Rahmen eines Auswahlverfahrens mit positiver Prognose über den Ausbildungserfolg in den Schuldienst des Landes Nordrhein-Westfalen im Tarifbeschäftigungsverhältnis eingestellt wurde.
Die Entscheidung über den Zugang zur Ausbildung für den Lehrerberuf basiert auf der Einschätzung der Eignung der Bewerberin oder des Bewerbers im Rahmen einer Prognose über den zu diesem Zeitpunkt erwarteten Ausbildungserfolg in den beiden Fächern, die im Einstellungsverfahren getroffen wird.
Bei dieser Prognoseentscheidung sind insbesondere für das erste Fach vorgelegte Hochschulabschlüsse und fachwissenschaftliche Studieninhalte zu berücksichtigen.
Vergleichsmaßstab sind die Studienleistungen, die im Rahmen des jeweiligen Lehramtsstudiums für dieses Fach zu erbringen sind.
Zeitpunkt und Note des Abschlusses können in die Gesamtbewertung einfließen; einschlägige Berufserfahrungen sollen berücksichtigt werden.
Sie schließt mit der Staatsprüfung und dem Erwerb der Lehramtsbefähigung ab.
Mit Bestehen der Staatsprüfung werden diese Lehrkräfte in ein Dauerbeschäftigungsverhältnis, bei Vorliegen der persönlichen Voraussetzungen ins Beamtenverhältnis, übernommen.
Bewerberinnen und Bewerber, die die oben genannten Voraussetzungen für den Seiteneinstieg mit berufsbegleitender Ausbildung nicht erfüllen, können in den Schuldienst in Verbindung mit der Pädagogischen Einführung übernommen werden.
Aus Wissenschaft und Wirtschaft in die Schule : die Wege in den Schuldienst Seiteneinstieg Für Absolventinnen und Absolventen von Universitäten und gleichgestellten Hochschulen, die einen Studiengang (Diplom/Magister/Master) in einem dringend benötigten Unterrichtsfach oder in einer dringend benötigten beruflichen Fachrichtung abgeschlossen haben und eine mehrjährige praktische Berufserfahrung nachweisen, besteht die Möglichkeit einer Einstellung in den Schuldienst im Wege des Seiteneinstiegs.
Für Fachhochschulabsolventinnen und -absolventen wird ein akkreditierter Masterabschluss vorausgesetzt.
Im Rahmen dieser Qualifizierungsmaßnahme sind von den Seiteneinsteigerinnen und Seiteneinsteigern im ersten Jahr 15 Stunden und im zweiten Jahr 16 Stunden eigenverantwortlicher Unterricht zu erteilen.
Darüber hinaus nehmen die Seiteneinsteigerinnen / Seiteneinsteiger an Ausbildungsveranstaltungen des Instituts für Qualitätsentwicklung an Schulen Schleswig-Holstein (IQSH) für Laufbahnbewerberinnen und Laufbahnbewerber teil.
Die Qualifizierung im Seiteneinstieg kann auch in Teilzeitbeschäftigung erfolgen.
Nach erfolgreichem Abschluss der Qualifizierungsphase, das heißt einem Prüfungsergebnis von 3,49, ist eine unbefristete Weiterbeschäftigung, gegebenenfalls auch im Beamtenverhältnis, beabsichtigt.
Lebensjahres, noch nicht überschritten ist.
Nähere Informationen zum Seiteneinstieg finden Sie im Erlass Einstellung von Bewerberinnen und Bewerbern ohne Lehrbefähigung (Sonderregelung Seiteneinstieg) in den Schuldienst des Landes Schleswig-Holstein vom 7. Dezember 2011 (siehe rechts als Download).
Senden Sie bitte Ihre formlose Bewerbung mit einem tabellarischen Lebenslauf sowie unbeglaubigten Zeugniskopien und Arbeitsnachweisen an die dort angegebene E-Mail-Adresse.
Zurzeit ist die Einstellung von Quereinsteigerinnen und Quereinsteigern nur an den Berufsbildenden Schulen und hier nur in den Fachrichtungen Bautechnik, Elektrotechnik, Metalltechnik, Fahrzeugtechnik, Informationstechnik, Sozialpädagogik, Agrarwissenschaften sowie Labortechnik/Prozesstechnik möglich.
Die Ausbildung als Quereinsteigerin / Quereinsteiger erfolgt im Rahmen eines achtzehnmonatigen Vorbereitungsdienstes im Beamtenverhältnis auf Widerruf (Referendariat) in einer Fachrichtung und in einem Unterrichtsfach.
Für die Ableistung dieses Vorbereitungsdienstes gelten die gleichen Vorschriften und Bedingungen, wie für die Bewerberinnen und Bewerber, die auf Lehramt studiert haben.
Informationen über deren Höhe finden Sie unter ``Stellenmarkt Schule- Einstellung in den Vorbereitungsdienst- Merkblatt''.
Beratung Ministerium für Schule und Berufsbildung des Landes Schleswig-Holstein Waldemar Maron / III 4211 Brunswiker Straße 16-22 24105 Kiel Tel.
Aufgrund der besonderen Bedarfs- und Bewerberlage für einige Unterrichtsfächer, berufliche und sonderpädagogische Fachrichtungen steht der Weg in den niedersächsischen Schuldienst nicht nur Lehrkräften mit einer grundständigen für die Unterrichtstätigkeit an Schulen in Niedersachsen vorgesehenen Lehramtsausbildung offen, sondern auch Bewerberinnen und Bewerbern, die ein anderes Hochschulstudium als ein Lehramtsstudium erfolgreich abgeschlossen haben oder über eine in Niedersachsen nicht als gleichwertig anerkannte Lehramtsausbildung verfügen.
Der Quereinstieg in den niedersächsischen Schuldienst ist auf zwei Wegenmöglich : Der favorisierte Weg über den Vorbereitungsdienst ist nur für bestimmte Fächer und Studienabschlüsse möglich.
Durch das erfolgreiche Ablegen der Staatsprüfung am Ende des Vorbereitungsdienstes wird die Lehrbefähigung erworben.
Weitere Informationen über die Bewerbungsvoraussetzungen und Einstellungsmodalitäten für den direkten Quereinstieg finden Sie im Merkblatt für den direkten Quereinstieg.",0.69084,0.49425,0.31174,19,29,"Stellen schreiben Schulen für den Seiteneinstieg im Internet unter www.lois.nrw.de aus.
Für Fachhochschulabsolventinnen und -absolventen wird ein Masterabschluss vorausgesetzt.
Sie schließt mit der Staatsprüfung und dem Erwerb der Lehramtsbefähigung ab.
Eine Gleichstellung mit der Ersten Staatsprüfung für das Lehramt erfolgt jedoch nicht.
Während der Ausbildung im Vorbereitungsdienst werden Anwärterbezüge gewährt.
Die Handreichung zur Pädagogischen Einführung dienst als Unterstützung für Schulleitungen und Lehrkräfte bei der Bewältigung der besonderen Anforderungen an die Einarbeitung und leistet konkrete Hilfestellungen hinsichtlich der Gewährleistung unterstützender schulinterner Maßnahmen für diese Lehrkräfte Aktuell sind die Bewerbungschancen mit Ausnahme der MINT-Fächer, Elektrotechnik, Kfz-Technik und Maschinenbautechnik sehr gering.
Aus Wissenschaft und Wirtschaft in die Schule : die Wege in den Schuldienst Seiteneinstieg Für Absolventinnen und Absolventen von Universitäten und gleichgestellten Hochschulen, die einen Studiengang (Diplom/Magister/Master) in einem dringend benötigten Unterrichtsfach oder in einer dringend benötigten beruflichen Fachrichtung abgeschlossen haben und eine mehrjährige praktische Berufserfahrung nachweisen, besteht die Möglichkeit einer Einstellung in den Schuldienst im Wege des Seiteneinstiegs.
Universitärer Studienabschluss (Diplom II oder vergleichbar) in einem festgelegten Mangelfach.
Die Unterrichtsfächer sollten sich aus dem absolvierten Studium ergeben.
Bewerberinnen und Bewerber mit Behinderungen gem.
Nach erfolgreichem Abschluss der Qualifizierungsphase, das heißt einem Prüfungsergebnis von 3,49, ist eine unbefristete Weiterbeschäftigung, gegebenenfalls auch im Beamtenverhältnis, beabsichtigt.
Der Gesetzgeber hat mit dem Lehrerausbildungsgesetz vom 12. Mai 2009 (§ 13) die Eckpunkte einer berufsbegleitenden Ausbildung für Seiteneinsteigerinnen und Seiteneinsteiger festgelegt."
