0,0.85463,0.75055,0.52528,0,0,"An 44 Modellschulen können Schülerinnen und Schüler im Rahmen eines Schulversuchs das Abitur nach neun statt nach acht Jahren erwerben.
Die Schulen können somit das Angebot des Schulversuchs jeweils sieben Jahre lang aufrechterhalten.
Der erste beginnt mit dem Eintritt in das Gymnasium, in Brandenburg im Regelfall nach sechs Schulbesuchsjahren, in die Jahrgangsstufe 7.
Der zweite Weg kann am Ende der Jahrgangsstufe 10 eingeschlagen werden, wenn dazu an Oberschulen bzw. Gesamtschulen die entsprechende Berechtigungzum Besuch der gymnasialen Oberstufe erworben worden ist..
taz : Herr Weishaupt, in Bayern dürfen Schüler, wenn sie wollen, bald wieder länger zur Schule gehen bis zum Abitur.
Wir haben beobachtet, dass die Schüler durch G8 in den letzten Schuljahren weniger jobben und sich mehr auf ihr Abitur konzentrieren.
In Bayern sind jetzt fast vier Prozent der Abiturienten durchgefallen.
Als erstes deutsches Bundesland kehrt Niedersachsen zum gymnasialen Abitur nach 13 Jahren zurück.
Moderation : Markus Dichmann Hessen hat zum Beispiel die Wahlfreiheit für Schulen zwischen G8 und G9 eingeführt.
In Baden-Württemberg sind über 40 Modell-Gymnasien wieder auf G9 umgestellt worden.
Viele Gymnasien haben pädagogische Schwerpunkte, z.
B. in naturwissenschaftlicher, musischer, sportlicher und sprachlicher Hinsicht.
Die Versetzung am Gymnasium Am Gymnasium ist die Versetzung in die nächsthöhere Klasse von den Leistungen der Schüler abhängig.
Ziel der gymnasialen Ausbildung Das Gymnasium vermittelt eine vertiefte allgemeine Bildung, die für ein Hochschulstudium vorausgesetzt wird oder auf eine sonstige berufliche Ausbildung vorbereitet.
Zum Abschluss des Dialogforums Gymnasien gemeinsam stärken'' hat sich Kultusministerin Frauke Heiligenstadt wie folgt geäußert : Das Abitur nach zwölf Jahren wurde in Niedersachsen überhastet eingeführt und hat nicht nur an den Schulen zu vielen Problemen geführt.
Wir gehen nicht zurück zu den alten Lehrplänen, die vor zehn Jahren gegolten haben.
Unter den 708 Einsendungen waren auch 93 Stellungnahmen von schulischen Gremien von Grundschulen, Stadtteilschulen und Gymnasien, darunter Schulkonferenzen, Elternräte, Kreiselternräte, Lehrerkollegien, Schulleiterkonferenzen und Kammern.
Dennoch ist in fast allen Bundesländern die Verkürzung der Schulzeit auf dem Gymnasium auf acht Jahre beschlossene Sache.
Das bayerische Gymnasium hat einen Stoffumfang von acht Jahren.
Zur Online-Version des überarbeiteten Lehrplans für die Gymnasien in Bayern Lehrplanevaluation : 15.000 Rückmeldungen wurden ausgewertet Kürzungen in allen Fächern und Schuljahren Kürzungen gibt es in insgesamt 11 von 25 Fachlehrplänen – mit einem Schwerpunkt in der Oberstufe.
Wahlfreiheit zwischen G8 und G9 schueler001.jpg © HKM/Alexander von Michalewsky Die hessischen Regierungsparteien CDU und BÜNDNIS 90/DIE GRÜNEN haben in ihrem Koalitionsvertrag festgelegt, dass sie die Wahlfreiheit der Schulen zwischen G8 und G9 an den kooperativen Gesamtschulen und den Gymnasien weiter stärken wollen.",0.75294,0.56932,0.44898,0,0,"Horst Weishaupt : Nein.
Wir haben beobachtet, dass die Schüler durch G8 in den letzten Schuljahren weniger jobben und sich mehr auf ihr Abitur konzentrieren.
Es ist gut belegt, dass das 13.
Schuljahr den Gymnasiasten bisher nicht wirklich viel gebracht hat.
Die Leistungen in Mathematik und den Fremdsprachen haben sich im letzten Schuljahr nicht mehr bedeutsam gesteigert.
Ist es richtig, neben dem achtjährigen Gymnasium auch das neunjährige anzubieten?
Absolut, solange man nicht grundsätzlich am G8 rüttelt.
Wer auf das Gymasium geht, kann nach 12 Schuljahren das Abitur erwerben und hat damit die Berechtigung, an einer Universität oder Hochschule zu studieren.
Seit der Einführung des Abiturs nach zwölf Jahren in Niedersachsen ist aus Kreisen der Lehrkräfte, Eltern und Schülerinnen und Schüler immer wieder zu vernehmen gewesen, der Stress insbesondere an der gymnasialen Oberstufe habe zugenommen.
Auf der Basis des Abschlussberichtes der Expertinnen und Experten hat Kultusministerin Heiligenstadt am 19. März 2014 ein Konzept vorgelegt, wonach in Niedersachsen ein modernes und zeitgemäßes Abitur nach 13 Jahren eingeführt werden soll.
Das gilt vor allem für die aktiven Eltern, Schüler und Schulgremien die zu 85 % gegen G9 an den Gymnasien sind.
Dennoch ist in fast allen Bundesländern die Verkürzung der Schulzeit auf dem Gymnasium auf acht Jahre beschlossene Sache.
Auch in ihren jüngsten Beschlüssen rücken die Kultusminister von G8 nicht ab.
Ihr Ziel ist es, dass die Absolventen der Gymnasien jünger in das Berufsleben einsteigen können als bisher.
Wahlfreiheit zwischen G8 und G9 schueler001.jpg © HKM/Alexander von Michalewsky Die hessischen Regierungsparteien CDU und BÜNDNIS 90/DIE GRÜNEN haben in ihrem Koalitionsvertrag festgelegt, dass sie die Wahlfreiheit der Schulen zwischen G8 und G9 an den kooperativen Gesamtschulen und den Gymnasien weiter stärken wollen.
Damit soll das schulische Angebot noch besser auf den Elternwillen und somit auf die Bedürfnisse der Schülerinnen und Schüler abgestimmt werden können.",0.85167,0.75229,0.56357,0,0,"Zum Abitur führen im Land Brandenburg mehrere Wege :.
Der Schülerjahrgang, der im Schuljahr 2008/2009 die neunte Klasse erreiche, hatte als erster Jahrgang das Abitur bereits nach 12 (statt bisher 13) Jahren ablegen können.
Horst Weishaupt : Nein.
Auch da wurde die Frage diskutiert, ob man wieder zum neunjährigen Gymnasium wechseln sollte.
Es spricht nichts dafür.
Wir haben beobachtet, dass die Schüler durch G8 in den letzten Schuljahren weniger jobben und sich mehr auf ihr Abitur konzentrieren.
Andererseits : In unserer Untersuchung in Thüringen konnten wir nicht feststellen, dass die Freizeitaktivitäten der Mittelstufenschüler unter der höheren Stundenzahl gelitten hätten.
Es ist gut belegt, dass das 13.
Schuljahr den Gymnasiasten bisher nicht wirklich viel gebracht hat.
Rational gibt es keine Argumente gegen G8.
Es gibt einen Punkt, den ich psychologisch für außerordentlich wichtig halte : Durch G8 schließen Gymnasiasten in der Regel mit ihrer Volljährigkeit die Schule ab, beides passt zusammen.
In Bayern sind jetzt fast vier Prozent der Abiturienten durchgefallen.
Wer seinem Kind neben der Schule mehr Zeit für Hobbys lassen möchte, soll die Möglichkeit dazu haben.
Bekommen wir so kein Zwei-Klassen-Abi : Die guten Akademikerkinder schaffen’s in acht, der Rest in neun Jahren?
Es kann gut sein, dass leistungsfähige Schüler das neunjährige Abitur leisten, um zum Beispiel Zeit für ein Auslandsjahr zu haben.
Als erstes deutsches Bundesland kehrt Niedersachsen zum gymnasialen Abitur nach 13 Jahren zurück.
In dieser Konsequenz ist das bisher einmalig, aber auch in anderen Bundesländern gerät G8 ins Wanken.
Moderation : Markus Dichmann Hessen hat zum Beispiel die Wahlfreiheit für Schulen zwischen G8 und G9 eingeführt.
In Baden-Württemberg sind über 40 Modell-Gymnasien wieder auf G9 umgestellt worden.
In Hamburg und Bayern drängen Bürgerinitiativen auf Volksentscheide über das Turbo-Abi.
Eltern, Lehrer und Schüler formieren sich in Bündnissen gegen G8 und haben sich jetzt sogar zu einer bundesweiten Bewegung zusammengeschlossen.
Das Gymnasium umfasst die Klassenstufen 5 bis 12 Ein Kind kann das Gymnasium besuchen.
Seit der Einführung des Abiturs nach zwölf Jahren in Niedersachsen ist aus Kreisen der Lehrkräfte, Eltern und Schülerinnen und Schüler immer wieder zu vernehmen gewesen, der Stress insbesondere an der gymnasialen Oberstufe habe zugenommen.
Auf der Basis des Abschlussberichtes der Expertinnen und Experten hat Kultusministerin Heiligenstadt am 19. März 2014 ein Konzept vorgelegt, wonach in Niedersachsen ein modernes und zeitgemäßes Abitur nach 13 Jahren eingeführt werden soll.
Zum Abschluss des Dialogforums Gymnasien gemeinsam stärken'' hat sich Kultusministerin Frauke Heiligenstadt wie folgt geäußert : Das Abitur nach zwölf Jahren wurde in Niedersachsen überhastet eingeführt und hat nicht nur an den Schulen zu vielen Problemen geführt.
Auf der Basis ihres Abschlussberichtes mache ich für ein modernes Abitur nach 13 Jahren folgenden Vorschlag : Gymnasien und nach Schulzweigen gegliederte KGSen in Niedersachsen sollen künftig generell die Möglichkeit eines Abiturs nach 13 Jahren bieten.. Leistungsstarke Schülerinnen und Schüler sollen individuell die Schulzeit verkürzen können, indem sie ein Jahr überspringen.
Die Umstellung auf G9 beginnt mit dem Schuljahr 2015/2016.
Der erste Schuljahrgang wird dann voraussichtlich im Schuljahr 2020/21 sein Abitur nach 13 Jahren ablegen können.. Anforderungen in der Oberstufe und der Abiturprüfung, die die Vorgängerregierung verschärft hat, werden so schnell wie möglich korrigiert.
Wir werden deutliche Entlastungen umsetzen, beispielsweise in Hinblick auf die Anzahl der Klausuren und der verpflichtenden Kurse in der Qualifikationsphase.
Mir ist eines ganz wichtig : Wir steuern um auf ein Abitur nach 13 Jahren und strecken damit die Schulzeit, aber die Kerncurricula werden nicht ausgeweitet.
Wir geben Schülerinnen und Schülern künftig mehr Zeit zum Lernen und zum Leben.
Ich werde in Niedersachsen ein modernes Abitur nach 13 Jahren einführen, das sowohl Schülerinnen und Schüler als auch Lehrkräfte entlastet und das mehr Möglichkeiten zur Förderung bietet.
58 Prozent aller Einsendungen und sogar 85 Prozent der schulischen Gremien haben sich klar für die Beibehaltung des Abiturs nach acht Jahren am Gymnasium (G8) ausgesprochen.
Sie wünschen sich Ruhe an den Gymnasien und lehnen eine Rückkehr zu G9 mit übergroßer Mehrheit ab.
Für G8 sprachen sich dabei 408 Einsender (58 %), für G9 262 Einsender (37 %) und für G8 und G9 an einer Schule 13 Einsender (2 %) aus.
23 Einsender gaben kein eindeutiges Votum ab und 2 Einsendungen waren ungültig, da es sich um Doppelungen handelte.
Unter den 708 Einsendungen waren auch 93 Stellungnahmen von schulischen Gremien von Grundschulen, Stadtteilschulen und Gymnasien, darunter Schulkonferenzen, Elternräte, Kreiselternräte, Lehrerkollegien, Schulleiterkonferenzen und Kammern.
Davon sprachen sich 79 für G8 aus (85 %), 5 für G9 (5 %) und 9 blieben ohne Votum (10 %).
Im Einzelnen waren darunter 25 Schulkonferenzbeschlüsse aus Stadtteilschulen, die alle für die Beibehaltung der jetzigen Struktur plädierten sowie 13 Schulkonferenzbeschlüsse aus Grundschulen, von denen 9 gegen und 3 für die Einführung von G9 an den Gymnasien plädierten, eine vermied ein klares Votum.
Schulsenator Ties Rabe : Ich freue mich über so zahlreiche Zuschriften.
Das Meinungsbild ist eindeutig.
Die Mehrheit wünscht sich einen Schulfrieden und keine neue Schulreform an den Gymnasien.
Die eigentlich Betroffenen sind besonders klar und eindeutig mit ihrer Ablehnung.
Das gilt vor allem für die aktiven Eltern, Schüler und Schulgremien die zu 85 % gegen G9 an den Gymnasien sind.
Auch die anderen Einsendungen sind gegen die Wiedereinführung von G9 an den Gymnasien, doch hier liegen Gegner und Befürworter etwas näher zusammen (329 (56 %) zu 257 (44 %).
Offensichtlich ist die Zustimmung für das jetzige G8-Abitur bei den direkt Betroffenen größer als bei denen, die gar nicht mehr zur Schule gehen oder mit der Schule nur noch wenig zu tun haben.
Zuvor waren bereits die Schulkonferenzen der Gymnasien befragt worden.
Deren Meinungsbild war sehr eindeutig ausgefallen : 87 Prozent der Gymnasien hatten sich gegen Rückkehr zu G9 ausgesprochen, nur 11 Prozent dafür.
Parallel zu den Entscheidungen der Gymnasial-Schulkonferenzen hatten viele weitere schulische Gremien und Verbände die Frage aufgegriffen und sich positioniert.
Unter anderem lehnten Hamburgs Elternkammer, Hamburgs Schülerkammer und Hamburgs Lehrerkammer sowie der Landesschulbeirat und beide Lehrergewerkschaften eine Rückkehr zu G9 an den Gymnasien ab.
In einer Expertenanhörung im Schulausschuss der Bürgerschaft sprachen sich alle geladenen Experten für eine Beibehaltung des G8 an Hamburgs Gymnasien aus, da G9 bereits flächendeckend an den Stadtteilschulen angeboten wird.
Zuletzt hatte sich auch die Konferenz der Schulleitungen der Stadtteilschulen dafür ausgesprochen den Schulfrieden einzuhalten und das Wahlangebot zwischen G8 an Gymnasien und G9 an Stadtteilschulen beizubehalten.
In rbb Inforadio, 06.03.2008 Bundeselternrat will Turbo-Abi nur an Ganztags-Gymnasien.
Wahlfreiheit zwischen G8 und G9 schueler001.jpg © HKM/Alexander von Michalewsky Die hessischen Regierungsparteien CDU und BÜNDNIS 90/DIE GRÜNEN haben in ihrem Koalitionsvertrag festgelegt, dass sie die Wahlfreiheit der Schulen zwischen G8 und G9 an den kooperativen Gesamtschulen und den Gymnasien weiter stärken wollen."
1,0.36344,0.04415,0.11495,0,0,"G9-Modellschulen erproben eine Dehnung der Bildungsstandards um ein Jahr.
Unterricht in Klassen in festen sozialen Gruppen.
Möglichkeiten der Schwerpunktbildung nach Leistung und Neigung durch zahlreiche Wahlmöglichkeiten in den Sprachen, Naturwissenschaften und den ästhetischen Fächern.
Förderangebote für Schülerinnen und Schüler und Exzellenzförderung Das Leitbild der Hamburger Gymnasien zum Herunterladen (PDF, 33 KB) Lesen Sie weiter
Sicherstellung der Hochwertigkeit der Lehrerbildung auch in Zukunft durch.
Das Ziel war es, eine fundierte Basis zu schaffen, auf der Entscheidungen getroffen werden können, jedoch kein politisches Votum abzugeben.
Näheres finden Sie in der Gymnasiale-Oberstufe-Verordnung..
Daher habe ich im Rahmen des Dialogforums Gymnasien gemeinsam stärken'' die Expertenkommission eingesetzt, die verschiedene Szenarien sorgfältig geprüft und wertvolle Hinweise gegeben hat.
Alle Fächer, alle Jahrgangsstufen in Evaluation mit einbezogen Nach dem ersten vollständigen Durchgang des achtjährigen Gymnasiums war im Herbst 2011 das Monitoring des Lehrplans für das Gymnasium wieder aufgenommen worden.
Dabei konnten pro Schule und Fach mindestens zwei, in den Fächern Deutsch, Mathematik und Englisch drei Lehrkräfte die Zufriedenheit mit dem bestehenden Lehrplan bewerten und Hinweise und Anregungen zu dessen Weiterentwicklung geben.
Aber das ist eine Frage der Umsetzung.
Der neue Flyer ``Mehr Zeit zum Leben und Lernen'' kann auf dieser Seitebestellt werden.
Rational gibt es keine Argumente gegen G8.
Da dies niemand wahrgenommen hat, veröffentlicht die Schulbehörde alle Rückmeldung auf Ihrer Homepage.
Die genauere Auswertung bestätigt aber auch unterschiedliche Akzente.
Das Problem sehe ich nicht.
In Hamburg und Bayern drängen Bürgerinitiativen auf Volksentscheide über das Turbo-Abi.
6. Juni 2014 13:30 Uhr
Interview mit Jens Goebel, Kultusminister in Thüringen.
Alexander Lorz, Kultusminister Hessen Als Beiträge dazu : Carolin Schierwater Erleichterung oder Stress?
Umfrage unter Schülern in Niedersachsen zur Rückkehr zu G9.
Wer auf das Gymasium geht, kann nach 12 Schuljahren das Abitur erwerben und hat damit die Berechtigung, an einer Universität oder Hochschule zu studieren.
Der Wegweiser für die gymnasiale Oberstufe bietet Wissenswertes zur Einführungs- und zur Qualifikationsphase, zur Fächerwahl und zur Abiturprüfung.
In : Deutschlandfunk, 06.03.2008 Kein Abi light.
Diese Grundlagen des bayerischen Gymnasiums sollen erhalten bleiben.
Die Überarbeitungen wurden bereits in den Lehrplan eingearbeitet.
Eine Empfehlung für den Besuch des Gymnasiums oder der Regelschule erteilt die Klassenkonferenz auf Antrag der Eltern.
starke Stellung der Fachlichkeit im Studium sowie Dauer und Struktur des Vorbereitungsdienstes.
Verankerung bzw. Vertiefung aktueller pädagogischer Herausforderungen im Studium : u.a. Inklusion, Ganztag, Umgang mit Heterogenität.
Individuelle Lernzeit a) Mittelstufe plus.
Für diese Gymnasien stehen vor Ort Internate zur Verfügung.
Für Kinder mit entsprechenden Begabungen vermitteln die Schulleiter der Grundschulen auf Wunsch der Eltern Ansprechpartner.",0.35,0.07965,0.10419,0,0,"G9-Modellschulen erproben eine Dehnung der Bildungsstandards um ein Jahr.
Unterricht in Klassen in festen sozialen Gruppen.
Möglichkeiten der Schwerpunktbildung nach Leistung und Neigung durch zahlreiche Wahlmöglichkeiten in den Sprachen, Naturwissenschaften und den ästhetischen Fächern.
Im Rahmen dieses Dialogs hat die Niedersächsische Kultusministerin Frauke Heiligenstadt eine Expertenkommission einberufen.
Der Lehrplan des Gymnasiums erfährt in fachlicher Hinsicht insgesamt hohe Zustimmungswerte..
Über 15.000 Rückmeldungen ausgewertet An insgesamt 370 Gymnasien wurden konkrete Unterrichtserfahrungen der Lehrkräfte über alle Fächer und Jahrgangsstufen hinweg eingeholt.
Wir geben Schülerinnen und Schülern künftig mehr Zeit zum Lernen und zum Leben.
Aber das ist eine Frage der Umsetzung.
Rational gibt es keine Argumente gegen G8.
Die genauere Auswertung bestätigt aber auch unterschiedliche Akzente.
Das Problem sehe ich nicht.
Zuvor waren bereits die Schulkonferenzen der Gymnasien befragt worden.
In Hamburg und Bayern drängen Bürgerinitiativen auf Volksentscheide über das Turbo-Abi.
Ist der Widerstand von Lehrern, Eltern und Schülern berechtigt?
Interview mit Jens Goebel, Kultusminister in Thüringen.
Alexander Lorz, Kultusminister Hessen Als Beiträge dazu : Carolin Schierwater Erleichterung oder Stress?
Umfrage unter Schülern in Niedersachsen zur Rückkehr zu G9.
Wer auf das Gymasium geht, kann nach 12 Schuljahren das Abitur erwerben und hat damit die Berechtigung, an einer Universität oder Hochschule zu studieren.
Der Wegweiser für die gymnasiale Oberstufe bietet Wissenswertes zur Einführungs- und zur Qualifikationsphase, zur Fächerwahl und zur Abiturprüfung.
Diese Grundlagen des bayerischen Gymnasiums sollen erhalten bleiben.
Ziel der gymnasialen Ausbildung ist mit Bestehen der Abiturprüfung die allgemeine Hochschulreife.
Als Notenvoraussetzungen sind mindestens gute Leistungen in den Fächern Deutsch, Mathematik sowie Heimat- und Sachkunde (Grundschule) bzw. erste Fremdsprache (Regelschule) notwendig.
starke Stellung der Fachlichkeit im Studium sowie Dauer und Struktur des Vorbereitungsdienstes.
Individuelle Lernzeit a) Mittelstufe plus.
Für diese Gymnasien stehen vor Ort Internate zur Verfügung.
Für Kinder mit entsprechenden Begabungen vermitteln die Schulleiter der Grundschulen auf Wunsch der Eltern Ansprechpartner.",0.45083,0.14595,0.18538,0,0,"Komplettierung mit der Einführung des organisch aufwachsenden Lehrplan PLUS im Schuljahr 2017/18.
G9-Modellschulen erproben eine Dehnung der Bildungsstandards um ein Jahr.
Aus zahlreichen Rückmeldungen an das Kultusministerium wird deutlich, dass die Gymnasien des Landes die flächendeckende Einführung des achtjährigen Gymnasiums mit viel Engagement, pädagogischer Innovationsbereitschaft und Qualitätsbewusstsein umgesetzt haben.
Unter den 708 Einsendungen waren auch 93 Stellungnahmen von schulischen Gremien von Grundschulen, Stadtteilschulen und Gymnasien, darunter Schulkonferenzen, Elternräte, Kreiselternräte, Lehrerkollegien, Schulleiterkonferenzen und Kammern.
einen einheitlichen Bildungsgang zur allgemeinen Hochschulreife.
Das heißt, der Schulversuch läuft erst – jeweils unter Einbeziehung der Kursstufe – 2026/2027 (1.
Möglichkeiten der Schwerpunktbildung nach Leistung und Neigung durch zahlreiche Wahlmöglichkeiten in den Sprachen, Naturwissenschaften und den ästhetischen Fächern.
Zum Abitur führen im Land Brandenburg mehrere Wege :.
G8 : Der überarbeitete Lehrplan und die Ergebnisse der Evaluation stehen online An insgesamt 370 Gymnasien in Bayern wurden seit Herbst 2011 Lehrkräfte zum G8-Lehrplan befragt.
Der zweite Weg kann am Ende der Jahrgangsstufe 10 eingeschlagen werden, wenn dazu an Oberschulen bzw. Gesamtschulen die entsprechende Berechtigungzum Besuch der gymnasialen Oberstufe erworben worden ist..
Der Auftrag an die Expertenkommission lautete, u.a. verschiedene Szenarien der Dauer der Schulzeit an den Gymnasien fachlich zu diskutieren und mögliche Auswirkungen von Veränderungen darzulegen.
Die Abiturprüfung findet aber in den drei Schulformen nach einer Prüfungsordnung statt.
Näheres finden Sie in der Gymnasiale-Oberstufe-Verordnung..
Stand : 1. August 2012
Daher habe ich im Rahmen des Dialogforums Gymnasien gemeinsam stärken'' die Expertenkommission eingesetzt, die verschiedene Szenarien sorgfältig geprüft und wertvolle Hinweise gegeben hat.
Zudem werden in der Oberstufe in allen modernen Fremdsprachen bei den bisherigen Pflichtlektüren Einschränkungen vorgenommen.
Auch da wurde die Frage diskutiert, ob man wieder zum neunjährigen Gymnasium wechseln sollte.
Wir werden deutliche Entlastungen umsetzen, beispielsweise in Hinblick auf die Anzahl der Klausuren und der verpflichtenden Kurse in der Qualifikationsphase.
Ich weiß nicht, ob das ein Grund zur Klage ist.
Auf diese Weise kann auf die spezifischen Anforderungen vor Ort eingegangen werden.
Zeitgemäße Gymnasialpädagogik : Herausforderungen pädagogisch beantworten !.
Andererseits : In unserer Untersuchung in Thüringen konnten wir nicht feststellen, dass die Freizeitaktivitäten der Mittelstufenschüler unter der höheren Stundenzahl gelitten hätten.
B. mehr Möglichkeiten für die Berufs- und Studienorientierung geben.
Der neue Flyer ``Mehr Zeit zum Leben und Lernen'' kann auf dieser Seitebestellt werden.
Schuljahr den Gymnasiasten bisher nicht wirklich viel gebracht hat.
Wir gehen nicht zurück zu den alten Lehrplänen, die vor zehn Jahren gegolten haben.
Sicherstellung der Hochwertigkeit der Lehrerbildung auch in Zukunft durch.
Rational gäbe es aber auch keine dafür.
Die Überarbeitungen wurden bereits in den Lehrplan eingearbeitet.
In Bayern sind jetzt fast vier Prozent der Abiturienten durchgefallen.
Zentrale Grundlage des bayerischen Bildungserfolgs : hochwertige Ausbildung der bayerischen Lehrkräfte.
In der Übergangszeit sind solche Vergleiche ohnehin mit Vorsicht zu genießen.
Da dies niemand wahrgenommen hat, veröffentlicht die Schulbehörde alle Rückmeldung auf Ihrer Homepage.
So haben alle Interessierten die Möglichkeit, die eingesandten Argumente und Anregungen nachzulesen.
Förderangebote für Schülerinnen und Schüler und Exzellenzförderung Das Leitbild der Hamburger Gymnasien zum Herunterladen (PDF, 33 KB) Lesen Sie weiter
6. Juni 2014 13:30 Uhr
Die genauere Auswertung bestätigt aber auch unterschiedliche Akzente.
Das Problem sehe ich nicht.
Individuelle Lernzeit a) Mittelstufe plus.
Moderation : Markus Dichmann Hessen hat zum Beispiel die Wahlfreiheit für Schulen zwischen G8 und G9 eingeführt.
In Hamburg und Bayern drängen Bürgerinitiativen auf Volksentscheide über das Turbo-Abi.
Unterricht in Klassen in festen sozialen Gruppen.
Durch ganz Deutschland geht ein öffentlicher Aufschrei nach einem langsameren schulischen Werdegang.
PISAplus fragte : Scheitert eine der größten deutschen Bildungsreformen?
Ist der Widerstand von Lehrern, Eltern und Schülern berechtigt?
Entwickelt sich eine deutsche Schullandschaft der zwei Geschwindigkeiten?
Marko Neumann, Erziehungswissenschaftler am Deutschen Institut für Internationale Pädagogische Forschung.
Alexander Lorz, Kultusminister Hessen Als Beiträge dazu : Carolin Schierwater Erleichterung oder Stress?
Umfrage unter Schülern in Niedersachsen zur Rückkehr zu G9.
Interview mit Professor Wilfried Bos vom Institut für Schulentwicklungsforschung in Dortmund.
In : WDR, 06.03.2008 Forscher fordert straffere Lehrpläne.
Als Gesamtergebnis der Lehrplanevaluation kann festgehalten werden :.
Für Sie bietet sich aber die Möglichkeit, die letzte Zeit bis zum Abitur entsprechend Ihren eigenen Stärken und Interessen individuell zu gestalten und Schwerpunkte mit Blick auf einen Studien- oder Berufswunsch zu setzen.
Interview mit dem Vorsitzenden des Bundeselternrats, Dieter Dornbusch.
Die Checkliste unterstützt Sie bei der Wahl Ihrer Kurse und Prüfungsfächer in der gymnasialen Oberstufe.
In : Deutschlandfunk, 06.03.2008 Kein Abi light.
Das Ziel war es, eine fundierte Basis zu schaffen, auf der Entscheidungen getroffen werden können, jedoch kein politisches Votum abzugeben.
dradio, 06.03.2008 Mehr Flexibilität beim ``Turbo-Abi'' SWR, 08.03.2008 Landeselternbeirat kritisiert G8-Beschlüsse ZDF, 06.03.2008 Turbo-Abi : Stundenzahl bleibt trotz Kritik.
Ihr Kommentar zu diesem Beitrag.
Kernfächer sind Deutsch, Mathematik und die 1. und 2.
Fremdsprache, im altsprachlichen Bildungsgang auch die 3.
Kultusminister begrüßt Resolution der Regierungsfraktion Die Regierungsfraktion des Bayerischen Landtags hat eine Resolution zur Weiterentwicklung des bayerischen Gymnasiums beschlossen.
B. anhand des Halbjahreszeugnisses herausstellt, dass die Versetzung gefährdet ist, wird die Schule eine individuelle Förderung festlegen, um eine Versetzung zu erreichen.
ein Viertel auf rund 40 % eines Jahrgangs.
Studierfähigkeit, vertiefte Allgemeinbildung, Reflexionsfähigkeit und Persönlichkeitsentwicklung sind die zentralen Bildungsziele des bayerischen Gymnasiums.
Es werden unterschiedliche Aspekte berücksichtigt.
Diese Grundlagen des bayerischen Gymnasiums sollen erhalten bleiben.
wachsende Heterogenität der Schülerschaft : Anstieg der Übertrittsquote bayernweit um ca.
Damit dieser Prozess in allen Fällen erfolgreich durchlaufen werden kann, wird den Schulen zur Unterstützung ein Leitfaden sowie Formulare für die Diagnose, den Förderplan und die Zielvereinbarung zur Verfügung gestellt.
Eckpfeiler des pädagogischen Gesamtkonzepts 1.
Abitur darf nicht durch Unterrichtsabstriche entwertet werden FDP Patrick Meinhardt : G8- Inhalte nicht Mindeststunden zählen Bündnis/90 Die Grünen Priska Hinz : Schavan bei Ganztagsschulen und G-8 auf Schlingerkurs Interviews Bildungsministerin Schavan verteidigt ``Turbo-Abitur''.
Die Persönlichkeitsbildung ist vor allem auf die Entwicklung des Wollens und auf verantwortungsbewusstes Handeln ausgerichtet.
Beim Übertritt mit Realschulabschluss wird auch das Wahlpflichtfach in die Notenvoraussetzungen einbezogen.
Eine Empfehlung für den Besuch des Gymnasiums oder der Regelschule erteilt die Klassenkonferenz auf Antrag der Eltern.
starke Stellung der Fachlichkeit im Studium sowie Dauer und Struktur des Vorbereitungsdienstes.
Intensivierung und Optimierung der Schulpraktika während des Studiums.
Verankerung bzw. Vertiefung aktueller pädagogischer Herausforderungen im Studium : u.a. Inklusion, Ganztag, Umgang mit Heterogenität.
Dabei legen die Jugendlichen in einem festgelegten Wahlverfahren ihre Fächer fest; die Halbjahresergebnisse werden zum größten Teil in das Abiturzeugnis eingebracht.
Spezialgymnasien Im Freistaat Thüringen gibt es auch Spezialgymnasien und Spezialklassen mit vertiefter mathematisch-naturwissenschaftlicher (Erfurt, Jena, Ilmenau), musikalischer (Weimar, Gera), sportlicher (Erfurt, Jena, Oberhof) und sprachlicher (Schnepfenthal bei Gotha) Ausrichtung.
Für Kinder mit entsprechenden Begabungen vermitteln die Schulleiter der Grundschulen auf Wunsch der Eltern Ansprechpartner.
Weitere Gymnasien sind eingeladen, sich an dieser Ideenbörse mit eigenen Umsetzungsbeispielen zu beteiligen."
