3,0.53965,0.28256,0.24297,8,91,"Die Gymnasien und kooperativen Gesamtschulen, die ab dem Schuljahr 2014/2015 von G8 zu G9 wechseln wollen, können die jeweils bestehenden Jahrgänge 5, 6 und 7 in diesen Wechsel einbeziehen, sofern sie dies beschlossen haben.
Dennoch ist in fast allen Bundesländern die Verkürzung der Schulzeit auf dem Gymnasium auf acht Jahre beschlossene Sache.
Unter den 708 Einsendungen waren auch 93 Stellungnahmen von schulischen Gremien von Grundschulen, Stadtteilschulen und Gymnasien, darunter Schulkonferenzen, Elternräte, Kreiselternräte, Lehrerkollegien, Schulleiterkonferenzen und Kammern.
Plenarsitzung der Kultusministerkonferenz am 6. März 2008 in Berlin Möglichkeiten der Flexibilisierung beim Abitur nach zwölf Jahren Pressemitteilungen und Stellungnahmen Baden-Württemberg Betreute Hausaufgabenzeiten und selbst organisiertes Lernen im Rahmen von G 8 an der Schule Bayern Kultusminister Siegfried Schneider im Gespräch mit der Landes-Eltern-Vereinigung der Gymnasien in Bayern Hamburg Stadtteilschule und Gymnasium Hessen Kultusministerin Wolff : Änderungen werden zu deutlicher Entlastung von Schülerinnen und Schülern führen – Erste Verbesserungen sind wesentliche Schritte in die richtige Richtung Niedersachsen Busemann : ``Schüler, Eltern, Lehrkräfte und Studierende können optimistisch in die Zukunft schauen'' Nordrhein-Westfalen Zu den Beschlüssen der Kultusministerkonferenz erklärt Schulministerin Barbara Sommer : Nordrhein-Westfalen KMK bestätigt Schulzeitverkürzung- Schulen erhalten mehr Flexibilität Rheinland-Pfalz Ahnen : Achtjähriges Gymnasium klappt nur mit Ganztagsschule Schleswig-Holstein Bildungsministerin Ute Erdsiek-Rave : Lehrpläne in Schleswig-Holstein erlauben Abitur nach zwölf Jahren ohne Überlastung der Schülerinnen und Schüler GEW Öffentlichkeit soll mit Zahlenspielchen hinters Licht geführt werden Deutscher Lehrerverband ``Der neue G8-Beschluss ist eine Mogelpackung'' Deutscher Philologenverband Flexibilisierung bedeutet weiteren Qualitätsverlust beim G8!
Grit Thümmel Das Turbo-Abi im Ländervergleich Wie halten es die einzelnen Bundesländer mit G8 und G9?
Das bayerische Gymnasium hat einen Stoffumfang von acht Jahren.
Die Niedersächsische Landesregierung hat diese Sorgen sehr ernst genommen und im Juni 2013 das Dialogforum Gymnasien gemeinsam stärken'' und damit einen Diskussionsprozess um die Dauer der Schulzeit bis zum Abitur in Niedersachsen gestartet.
Der zweite Weg kann am Ende der Jahrgangsstufe 10 eingeschlagen werden, wenn dazu an Oberschulen bzw. Gesamtschulen die entsprechende Berechtigungzum Besuch der gymnasialen Oberstufe erworben worden ist..
starke Stellung der Fachlichkeit im Studium sowie Dauer und Struktur des Vorbereitungsdienstes.
Das Problem sehe ich nicht.
Als erstes deutsches Bundesland kehrt Niedersachsen zum gymnasialen Abitur nach 13 Jahren zurück.
Kernfächer sind Deutsch, Mathematik und die 1. und 2.
Zur Online-Version des überarbeiteten Lehrplans für die Gymnasien in Bayern Lehrplanevaluation : 15.000 Rückmeldungen wurden ausgewertet Kürzungen in allen Fächern und Schuljahren Kürzungen gibt es in insgesamt 11 von 25 Fachlehrplänen – mit einem Schwerpunkt in der Oberstufe.
Durch ganz Deutschland geht ein öffentlicher Aufschrei nach einem langsameren schulischen Werdegang.",0.45882,0.21829,0.19662,5,76,"Studierfähigkeit, vertiefte Allgemeinbildung, Reflexionsfähigkeit und Persönlichkeitsentwicklung sind die zentralen Bildungsziele des bayerischen Gymnasiums.
Jede unterrichtende Lehrkraft muss hierfür zunächst die Leistungsrückstände des Schülers konkret beschreiben und eine Diagnose der Ursachen erstellen.
Dennoch ist in fast allen Bundesländern die Verkürzung der Schulzeit auf dem Gymnasium auf acht Jahre beschlossene Sache.
Die Leistungen in Mathematik und den Fremdsprachen haben sich im letzten Schuljahr nicht mehr bedeutsam gesteigert.
Zudem werden in der Oberstufe in allen modernen Fremdsprachen bei den bisherigen Pflichtlektüren Einschränkungen vorgenommen.
Alexander Lorz, Kultusminister Hessen Als Beiträge dazu : Carolin Schierwater Erleichterung oder Stress?
Für Kinder mit entsprechenden Begabungen vermitteln die Schulleiter der Grundschulen auf Wunsch der Eltern Ansprechpartner.
Wer auf das Gymasium geht, kann nach 12 Schuljahren das Abitur erwerben und hat damit die Berechtigung, an einer Universität oder Hochschule zu studieren.
Vor G8 waren das ein Prozent.
Das Ziel war es, eine fundierte Basis zu schaffen, auf der Entscheidungen getroffen werden können, jedoch kein politisches Votum abzugeben.
Ist es richtig, neben dem achtjährigen Gymnasium auch das neunjährige anzubieten?
Als Notenvoraussetzungen sind mindestens gute Leistungen in den Fächern Deutsch, Mathematik sowie Heimat- und Sachkunde (Grundschule) bzw. erste Fremdsprache (Regelschule) notwendig.
Im Rahmen dieses Dialogs hat die Niedersächsische Kultusministerin Frauke Heiligenstadt eine Expertenkommission einberufen.
Auf der Basis ihres Abschlussberichtes mache ich für ein modernes Abitur nach 13 Jahren folgenden Vorschlag : Gymnasien und nach Schulzweigen gegliederte KGSen in Niedersachsen sollen künftig generell die Möglichkeit eines Abiturs nach 13 Jahren bieten.. Leistungsstarke Schülerinnen und Schüler sollen individuell die Schulzeit verkürzen können, indem sie ein Jahr überspringen.
Das gilt vor allem für die aktiven Eltern, Schüler und Schulgremien die zu 85 % gegen G9 an den Gymnasien sind.
Und : Der ab nächstem Schuljahr gültige Lehrplan steht mit den entsprechenden Überarbeitungen ebenfalls online!
Mancherorts haben Teenager einen volleres Arbeitspensum als ihre Eltern.",0.60333,0.37281,0.31019,36,196,"Aus zahlreichen Rückmeldungen an das Kultusministerium wird deutlich, dass die Gymnasien des Landes die flächendeckende Einführung des achtjährigen Gymnasiums mit viel Engagement, pädagogischer Innovationsbereitschaft und Qualitätsbewusstsein umgesetzt haben.
Gymnasien mit gelungenen pädagogischen Konzepten können anderen Schulen als Orientierung dienen.
Weitere Gymnasien sind eingeladen, sich an dieser Ideenbörse mit eigenen Umsetzungsbeispielen zu beteiligen.
Davon sprachen sich 79 für G8 aus (85 %), 5 für G9 (5 %) und 9 blieben ohne Votum (10 %).
Der Schülerjahrgang, der im Schuljahr 2008/2009 die neunte Klasse erreiche, hatte als erster Jahrgang das Abitur bereits nach 12 (statt bisher 13) Jahren ablegen können.
Der Auftrag an die Expertenkommission lautete, u.a. verschiedene Szenarien der Dauer der Schulzeit an den Gymnasien fachlich zu diskutieren und mögliche Auswirkungen von Veränderungen darzulegen.
Das Ziel war es, eine fundierte Basis zu schaffen, auf der Entscheidungen getroffen werden können, jedoch kein politisches Votum abzugeben.
Auf der Basis des Abschlussberichtes der Expertinnen und Experten hat Kultusministerin Heiligenstadt am 19. März 2014 ein Konzept vorgelegt, wonach in Niedersachsen ein modernes und zeitgemäßes Abitur nach 13 Jahren eingeführt werden soll.
Zum Abschluss des Dialogforums Gymnasien gemeinsam stärken'' hat sich Kultusministerin Frauke Heiligenstadt wie folgt geäußert : Das Abitur nach zwölf Jahren wurde in Niedersachsen überhastet eingeführt und hat nicht nur an den Schulen zu vielen Problemen geführt.
Auf der Basis ihres Abschlussberichtes mache ich für ein modernes Abitur nach 13 Jahren folgenden Vorschlag : Gymnasien und nach Schulzweigen gegliederte KGSen in Niedersachsen sollen künftig generell die Möglichkeit eines Abiturs nach 13 Jahren bieten.. Leistungsstarke Schülerinnen und Schüler sollen individuell die Schulzeit verkürzen können, indem sie ein Jahr überspringen.
Wir werden deutliche Entlastungen umsetzen, beispielsweise in Hinblick auf die Anzahl der Klausuren und der verpflichtenden Kurse in der Qualifikationsphase.
Auch da wurde die Frage diskutiert, ob man wieder zum neunjährigen Gymnasium wechseln sollte.
Was ist mit dem Stress durch die vollgestopften Stundenpläne?
Wir haben beobachtet, dass die Schüler durch G8 in den letzten Schuljahren weniger jobben und sich mehr auf ihr Abitur konzentrieren.
Wir gehen nicht zurück zu den alten Lehrplänen, die vor zehn Jahren gegolten haben.
Mancherorts haben Teenager einen volleres Arbeitspensum als ihre Eltern.
Andererseits : In unserer Untersuchung in Thüringen konnten wir nicht feststellen, dass die Freizeitaktivitäten der Mittelstufenschüler unter der höheren Stundenzahl gelitten hätten.
Rabe : Ich freue mich, dass sich in so kurzer Zeit über 700 Hamburgerinnen und Hamburger sowie schulische Gremien beteiligt und ein eindeutiges Votum abgegeben haben.
Rational gäbe es aber auch keine dafür.
Wir geben Schülerinnen und Schülern künftig mehr Zeit zum Lernen und zum Leben.
In den neuen Bundesländern, wo zwölf Jahre bis zum Abi in der DDR die Regel waren, hört man diese Klagen nicht.
Unter den 708 Einsendungen waren auch 93 Stellungnahmen von schulischen Gremien von Grundschulen, Stadtteilschulen und Gymnasien, darunter Schulkonferenzen, Elternräte, Kreiselternräte, Lehrerkollegien, Schulleiterkonferenzen und Kammern.
Vor G8 waren das ein Prozent.
starke Stellung der Fachlichkeit im Studium sowie Dauer und Struktur des Vorbereitungsdienstes.
Schulsenator Ties Rabe : Ich freue mich über so zahlreiche Zuschriften.
Das gilt vor allem für die aktiven Eltern, Schüler und Schulgremien die zu 85 % gegen G9 an den Gymnasien sind.
Es kann gut sein, dass leistungsfähige Schüler das neunjährige Abitur leisten, um zum Beispiel Zeit für ein Auslandsjahr zu haben.
Das von der Schulbehörde eingerichtet E-Mail-Postfach ist Teil einer umfangreichen Beteiligung der Öffentlichkeit, die Schulsenator Rabe auf den Weg gebracht hatte.
Als erstes deutsches Bundesland kehrt Niedersachsen zum gymnasialen Abitur nach 13 Jahren zurück.
In dieser Konsequenz ist das bisher einmalig, aber auch in anderen Bundesländern gerät G8 ins Wanken.
Moderation : Markus Dichmann Hessen hat zum Beispiel die Wahlfreiheit für Schulen zwischen G8 und G9 eingeführt.
Unter anderem lehnten Hamburgs Elternkammer, Hamburgs Schülerkammer und Hamburgs Lehrerkammer sowie der Landesschulbeirat und beide Lehrergewerkschaften eine Rückkehr zu G9 an den Gymnasien ab.
In Hamburg und Bayern drängen Bürgerinitiativen auf Volksentscheide über das Turbo-Abi.
Ist der Widerstand von Lehrern, Eltern und Schülern berechtigt?
Umfrage unter Schülern in Niedersachsen zur Rückkehr zu G9.
Grit Thümmel Das Turbo-Abi im Ländervergleich Wie halten es die einzelnen Bundesländer mit G8 und G9?
Für Sie bietet sich aber die Möglichkeit, die letzte Zeit bis zum Abitur entsprechend Ihren eigenen Stärken und Interessen individuell zu gestalten und Schwerpunkte mit Blick auf einen Studien- oder Berufswunsch zu setzen.
Spiegel Online, 06.03.2008 Kultusminister bessern beim Turbo-Abi nach Spiegel Online, 06.03.2008 Gymnasiasten ächzen unter der Stundenlast stern, 06.03.2008 Kinder als Versuchskaninchen stern, 04.02.2008 Wir brauchen echte Ganztagsschulen Süddeutsche Zeitung, 10.03.2008 Wenn Wissenslücken Schule machen Süddeutsche Zeitung, 10.03.2008 ``Mathematik und Deutsch sind tabu'' Süddeutsche Zeitung, 07.03.2008 Darf's ein bisschen weniger sein?
Zuvor waren bereits die Schulkonferenzen der Gymnasien befragt worden.
dradio, 06.03.2008 Mehr Flexibilität beim ``Turbo-Abi'' SWR, 08.03.2008 Landeselternbeirat kritisiert G8-Beschlüsse ZDF, 06.03.2008 Turbo-Abi : Stundenzahl bleibt trotz Kritik.
Kernfächer sind Deutsch, Mathematik und die 1. und 2.
In rbb Inforadio, 06.03.2008 Bundeselternrat will Turbo-Abi nur an Ganztags-Gymnasien.
Parallel zu den Entscheidungen der Gymnasial-Schulkonferenzen hatten viele weitere schulische Gremien und Verbände die Frage aufgegriffen und sich positioniert.
gesellschaftliche Entwicklungen : Ganztag, Inklusion, Demographie Angesichts dieser veränderten Rahmenbedingungen sieht die Bayerische Staatsregierung eine pädagogische Notwendigkeit für die Weiterentwicklung des bayerischen Gymnasiums.
Die Sicherstellung der Umsetzbarkeit auch an kleineren Gymnasien erfolgt u.a. durch etablierte Formen einer Kombination verschiedener Ausbildungsrichtungen in einer Klasse und eine Gestaltung der Budgetformel, die auch künftig an kleinen Gymnasien ein Zweig- und Wahlangebot sichert.. Entscheidung der Einzelschule vor Ort über das Ob und Wann der Einführung der Mittelstufe plus unter Einbindung der gesamten Schulfamilie einschließlich des Sachaufwandsträgers.
In einer Expertenanhörung im Schulausschuss der Bürgerschaft sprachen sich alle geladenen Experten für eine Beibehaltung des G8 an Hamburgs Gymnasien aus, da G9 bereits flächendeckend an den Stadtteilschulen angeboten wird.
Grundlinien für die Lehrplanentwicklung : o Gymnasiale Lernkultur : Verzicht auf kleinteiliges und isoliertes Detail- und Abfragewissen, statt dessen Konzentration auf relevantes Fachwissen, kreative Anwendung von Wissen, vernetztes Denken, selbständiges Problemlösen und Erschließen neuen Wissens o Angemessener Stoffumfang mit Blick auf die gelingende Vermittlung, Einübung und Anwendung von Wissen und Kompetenzen o Sicherstellung der gelingenden Implementierung des neuen Lehrplans durch eine umfassende strukturierte Fortbildungskampagne auf allen Ebenen o Etablierung von geeigneten Unterstützungsstrukturen für die konkrete Umsetzung des Lernplans im Unterrichtsalltag 2.
Zentrale Grundlage des bayerischen Bildungserfolgs : hochwertige Ausbildung der bayerischen Lehrkräfte.
Mit Versetzung in die Klassenstufe 10 wird ein dem Hauptschulabschluss gleichwertiger Bildungsstand bestätigt.
Für Kinder mit entsprechenden Begabungen vermitteln die Schulleiter der Grundschulen auf Wunsch der Eltern Ansprechpartner.
Thüringens zweiter Weg zum Abitur Das Kolleg- Institut zur Erlangung der Hochschulreife Im Kolleg haben Erwachsene ab 19 Jahren die Möglichkeit, auf dem zweiten Bildungsweg die allgemeine Hochschulreife zu erwerben."
