6,0.59471,0.39956,0.25167,15,101,"An 44 Modellschulen können Schülerinnen und Schüler im Rahmen eines Schulversuchs das Abitur nach neun statt nach acht Jahren erwerben.
Der erste beginnt mit dem Eintritt in das Gymnasium, in Brandenburg im Regelfall nach sechs Schulbesuchsjahren, in die Jahrgangsstufe 7.
Die gymnasiale Oberstufe gibt es an Gymnasien, Gesamtschulen und beruflichen Gymnasien.
Auf der Basis des Abschlussberichtes der Expertinnen und Experten hat Kultusministerin Heiligenstadt am 19. März 2014 ein Konzept vorgelegt, wonach in Niedersachsen ein modernes und zeitgemäßes Abitur nach 13 Jahren eingeführt werden soll.
Die Rückmeldungen zeigen auch, dass in einigen Fachlehrplänen noch nachgesteuert werden sollte.
Daher habe ich im Rahmen des Dialogforums Gymnasien gemeinsam stärken'' die Expertenkommission eingesetzt, die verschiedene Szenarien sorgfältig geprüft und wertvolle Hinweise gegeben hat.
Wir gehen nicht zurück zu den alten Lehrplänen, die vor zehn Jahren gegolten haben.
Wahlfreiheit zwischen G8 und G9 schueler001.jpg © HKM/Alexander von Michalewsky Die hessischen Regierungsparteien CDU und BÜNDNIS 90/DIE GRÜNEN haben in ihrem Koalitionsvertrag festgelegt, dass sie die Wahlfreiheit der Schulen zwischen G8 und G9 an den kooperativen Gesamtschulen und den Gymnasien weiter stärken wollen.
B. mehr Möglichkeiten für die Berufs- und Studienorientierung geben.
starke Stellung der Fachlichkeit im Studium sowie Dauer und Struktur des Vorbereitungsdienstes.
Vor G8 waren das ein Prozent.
Ist es richtig, neben dem achtjährigen Gymnasium auch das neunjährige anzubieten?
Das Problem sehe ich nicht.
Zuvor waren bereits die Schulkonferenzen der Gymnasien befragt worden.
Sogar ein Wissenschaftler, der von der Initiative zur Rückkehr zu G9 an den Gymnasien als Kronzeuge benannt wird, lehnte eine Rückkehr zu G9 an den Hamburg Gymnasien ab.
Durch ganz Deutschland geht ein öffentlicher Aufschrei nach einem langsameren schulischen Werdegang.
Dennoch ist in fast allen Bundesländern die Verkürzung der Schulzeit auf dem Gymnasium auf acht Jahre beschlossene Sache.
Viele Gymnasien haben pädagogische Schwerpunkte, z.
B. in naturwissenschaftlicher, musischer, sportlicher und sprachlicher Hinsicht.
Als erstes deutsches Bundesland kehrt Niedersachsen zum gymnasialen Abitur nach 13 Jahren zurück.
Kultusminister begrüßt Resolution der Regierungsfraktion Die Regierungsfraktion des Bayerischen Landtags hat eine Resolution zur Weiterentwicklung des bayerischen Gymnasiums beschlossen.
Ziel der gymnasialen Ausbildung Das Gymnasium vermittelt eine vertiefte allgemeine Bildung, die für ein Hochschulstudium vorausgesetzt wird oder auf eine sonstige berufliche Ausbildung vorbereitet.
Diese allgemeine Bildung beinhaltet einen hohen Grad an theoretischem, praktischem und abstraktem Wissen und die Vermittlung der Grundlagen wissenschaftlicher Arbeitmethoden.
Die Überarbeitungen wurden bereits in den Lehrplan eingearbeitet.
Mit Versetzung in die Klassenstufe 10 wird ein dem Hauptschulabschluss gleichwertiger Bildungsstand bestätigt.
Für Kinder mit entsprechenden Begabungen vermitteln die Schulleiter der Grundschulen auf Wunsch der Eltern Ansprechpartner.",0.48235,0.25959,0.21694,2,26,"Schuljahr den Gymnasiasten bisher nicht wirklich viel gebracht hat.
Die Leistungen in Mathematik und den Fremdsprachen haben sich im letzten Schuljahr nicht mehr bedeutsam gesteigert.
Alexander Lorz, Kultusminister Hessen Als Beiträge dazu : Carolin Schierwater Erleichterung oder Stress?
Im Rahmen dieses Dialogs hat die Niedersächsische Kultusministerin Frauke Heiligenstadt eine Expertenkommission einberufen.
Das bayerische Gymnasium hat einen Stoffumfang von acht Jahren.
Wer auf das Gymasium geht, kann nach 12 Schuljahren das Abitur erwerben und hat damit die Berechtigung, an einer Universität oder Hochschule zu studieren.
Vor G8 waren das ein Prozent.
Dennoch ist in fast allen Bundesländern die Verkürzung der Schulzeit auf dem Gymnasium auf acht Jahre beschlossene Sache.
Das Ziel war es, eine fundierte Basis zu schaffen, auf der Entscheidungen getroffen werden können, jedoch kein politisches Votum abzugeben.
Auf der Basis des Abschlussberichtes der Expertinnen und Experten hat Kultusministerin Heiligenstadt am 19. März 2014 ein Konzept vorgelegt, wonach in Niedersachsen ein modernes und zeitgemäßes Abitur nach 13 Jahren eingeführt werden soll.
Ist es richtig, neben dem achtjährigen Gymnasium auch das neunjährige anzubieten?
Als Notenvoraussetzungen sind mindestens gute Leistungen in den Fächern Deutsch, Mathematik sowie Heimat- und Sachkunde (Grundschule) bzw. erste Fremdsprache (Regelschule) notwendig.
Eine Empfehlung für den Besuch des Gymnasiums oder der Regelschule erteilt die Klassenkonferenz auf Antrag der Eltern.
Das gilt vor allem für die aktiven Eltern, Schüler und Schulgremien die zu 85 % gegen G9 an den Gymnasien sind.
Als erstes deutsches Bundesland kehrt Niedersachsen zum gymnasialen Abitur nach 13 Jahren zurück.
Für Kinder mit entsprechenden Begabungen vermitteln die Schulleiter der Grundschulen auf Wunsch der Eltern Ansprechpartner.
Ich werde in Niedersachsen ein modernes Abitur nach 13 Jahren einführen, das sowohl Schülerinnen und Schüler als auch Lehrkräfte entlastet und das mehr Möglichkeiten zur Förderung bietet.
Deutscher Philologenverband Schluss mit überstürzten Schulreformen ohne Einbeziehung der Betroffenen Philologenverband Baden-Württemberg e.V.",0.79917,0.66972,0.45905,10,101,"Aus zahlreichen Rückmeldungen an das Kultusministerium wird deutlich, dass die Gymnasien des Landes die flächendeckende Einführung des achtjährigen Gymnasiums mit viel Engagement, pädagogischer Innovationsbereitschaft und Qualitätsbewusstsein umgesetzt haben.
Auf diese Weise kann auf die spezifischen Anforderungen vor Ort eingegangen werden.
Unterricht in Klassen in festen sozialen Gruppen.
Weitere Gymnasien sind eingeladen, sich an dieser Ideenbörse mit eigenen Umsetzungsbeispielen zu beteiligen.
Seit der Einführung des Abiturs nach zwölf Jahren in Niedersachsen ist aus Kreisen der Lehrkräfte, Eltern und Schülerinnen und Schüler immer wieder zu vernehmen gewesen, der Stress insbesondere an der gymnasialen Oberstufe habe zugenommen.
Der Schülerjahrgang, der im Schuljahr 2008/2009 die neunte Klasse erreiche, hatte als erster Jahrgang das Abitur bereits nach 12 (statt bisher 13) Jahren ablegen können.
Im Rahmen dieses Dialogs hat die Niedersächsische Kultusministerin Frauke Heiligenstadt eine Expertenkommission einberufen.
Die gymnasiale Oberstufe gibt es an Gymnasien, Gesamtschulen und beruflichen Gymnasien.
Das Ziel war es, eine fundierte Basis zu schaffen, auf der Entscheidungen getroffen werden können, jedoch kein politisches Votum abzugeben.
Auf der Basis des Abschlussberichtes der Expertinnen und Experten hat Kultusministerin Heiligenstadt am 19. März 2014 ein Konzept vorgelegt, wonach in Niedersachsen ein modernes und zeitgemäßes Abitur nach 13 Jahren eingeführt werden soll.
Der erste Schuljahrgang wird dann voraussichtlich im Schuljahr 2020/21 sein Abitur nach 13 Jahren ablegen können.. Anforderungen in der Oberstufe und der Abiturprüfung, die die Vorgängerregierung verschärft hat, werden so schnell wie möglich korrigiert.
Auf der Basis ihres Abschlussberichtes mache ich für ein modernes Abitur nach 13 Jahren folgenden Vorschlag : Gymnasien und nach Schulzweigen gegliederte KGSen in Niedersachsen sollen künftig generell die Möglichkeit eines Abiturs nach 13 Jahren bieten.. Leistungsstarke Schülerinnen und Schüler sollen individuell die Schulzeit verkürzen können, indem sie ein Jahr überspringen.
Die Umstellung auf G9 beginnt mit dem Schuljahr 2015/2016.
Auch da wurde die Frage diskutiert, ob man wieder zum neunjährigen Gymnasium wechseln sollte.
Wir werden deutliche Entlastungen umsetzen, beispielsweise in Hinblick auf die Anzahl der Klausuren und der verpflichtenden Kurse in der Qualifikationsphase.
Wir haben beobachtet, dass die Schüler durch G8 in den letzten Schuljahren weniger jobben und sich mehr auf ihr Abitur konzentrieren.
Wir geben Schülerinnen und Schülern künftig mehr Zeit zum Lernen und zum Leben.
Mir ist eines ganz wichtig : Wir steuern um auf ein Abitur nach 13 Jahren und strecken damit die Schulzeit, aber die Kerncurricula werden nicht ausgeweitet.
Wahlfreiheit zwischen G8 und G9 schueler001.jpg © HKM/Alexander von Michalewsky Die hessischen Regierungsparteien CDU und BÜNDNIS 90/DIE GRÜNEN haben in ihrem Koalitionsvertrag festgelegt, dass sie die Wahlfreiheit der Schulen zwischen G8 und G9 an den kooperativen Gesamtschulen und den Gymnasien weiter stärken wollen.
Andererseits : In unserer Untersuchung in Thüringen konnten wir nicht feststellen, dass die Freizeitaktivitäten der Mittelstufenschüler unter der höheren Stundenzahl gelitten hätten.
Es ist gut belegt, dass das 13.
Die eigentlich Betroffenen sind besonders klar und eindeutig mit ihrer Ablehnung.
Rational gäbe es aber auch keine dafür.
Es gibt einen Punkt, den ich psychologisch für außerordentlich wichtig halte : Durch G8 schließen Gymnasiasten in der Regel mit ihrer Volljährigkeit die Schule ab, beides passt zusammen.
23 Einsender gaben kein eindeutiges Votum ab und 2 Einsendungen waren ungültig, da es sich um Doppelungen handelte.
Unter den 708 Einsendungen waren auch 93 Stellungnahmen von schulischen Gremien von Grundschulen, Stadtteilschulen und Gymnasien, darunter Schulkonferenzen, Elternräte, Kreiselternräte, Lehrerkollegien, Schulleiterkonferenzen und Kammern.
Davon sprachen sich 79 für G8 aus (85 %), 5 für G9 (5 %) und 9 blieben ohne Votum (10 %).
Im Einzelnen waren darunter 25 Schulkonferenzbeschlüsse aus Stadtteilschulen, die alle für die Beibehaltung der jetzigen Struktur plädierten sowie 13 Schulkonferenzbeschlüsse aus Grundschulen, von denen 9 gegen und 3 für die Einführung von G9 an den Gymnasien plädierten, eine vermied ein klares Votum.
Ich werde in Niedersachsen ein modernes Abitur nach 13 Jahren einführen, das sowohl Schülerinnen und Schüler als auch Lehrkräfte entlastet und das mehr Möglichkeiten zur Förderung bietet.
starke Stellung der Fachlichkeit im Studium sowie Dauer und Struktur des Vorbereitungsdienstes.
Schulsenator Ties Rabe : Ich freue mich über so zahlreiche Zuschriften.
Wer seinem Kind neben der Schule mehr Zeit für Hobbys lassen möchte, soll die Möglichkeit dazu haben.
Bekommen wir so kein Zwei-Klassen-Abi : Die guten Akademikerkinder schaffen’s in acht, der Rest in neun Jahren?
Das Problem sehe ich nicht.
Es kann gut sein, dass leistungsfähige Schüler das neunjährige Abitur leisten, um zum Beispiel Zeit für ein Auslandsjahr zu haben.
Offensichtlich ist die Zustimmung für das jetzige G8-Abitur bei den direkt Betroffenen größer als bei denen, die gar nicht mehr zur Schule gehen oder mit der Schule nur noch wenig zu tun haben.
Als erstes deutsches Bundesland kehrt Niedersachsen zum gymnasialen Abitur nach 13 Jahren zurück.
In dieser Konsequenz ist das bisher einmalig, aber auch in anderen Bundesländern gerät G8 ins Wanken.
Parallel zu den Entscheidungen der Gymnasial-Schulkonferenzen hatten viele weitere schulische Gremien und Verbände die Frage aufgegriffen und sich positioniert.
In Baden-Württemberg sind über 40 Modell-Gymnasien wieder auf G9 umgestellt worden.
In Hamburg und Bayern drängen Bürgerinitiativen auf Volksentscheide über das Turbo-Abi.
Eltern, Lehrer und Schüler formieren sich in Bündnissen gegen G8 und haben sich jetzt sogar zu einer bundesweiten Bewegung zusammengeschlossen.
Das gilt vor allem für die aktiven Eltern, Schüler und Schulgremien die zu 85 % gegen G9 an den Gymnasien sind.
Auch die anderen Einsendungen sind gegen die Wiedereinführung von G9 an den Gymnasien, doch hier liegen Gegner und Befürworter etwas näher zusammen (329 (56 %) zu 257 (44 %).
Umfrage unter Schülern in Niedersachsen zur Rückkehr zu G9.
In rbb Inforadio, 06.03.2008 Bundeselternrat will Turbo-Abi nur an Ganztags-Gymnasien.
Zuvor waren bereits die Schulkonferenzen der Gymnasien befragt worden.
Deren Meinungsbild war sehr eindeutig ausgefallen : 87 Prozent der Gymnasien hatten sich gegen Rückkehr zu G9 ausgesprochen, nur 11 Prozent dafür.
Sie wünschen sich Ruhe an den Gymnasien und lehnen eine Rückkehr zu G9 mit übergroßer Mehrheit ab.
Diese Grundlagen des bayerischen Gymnasiums sollen erhalten bleiben.
Die Mehrheit wünscht sich einen Schulfrieden und keine neue Schulreform an den Gymnasien.
Unter anderem lehnten Hamburgs Elternkammer, Hamburgs Schülerkammer und Hamburgs Lehrerkammer sowie der Landesschulbeirat und beide Lehrergewerkschaften eine Rückkehr zu G9 an den Gymnasien ab.
In einer Expertenanhörung im Schulausschuss der Bürgerschaft sprachen sich alle geladenen Experten für eine Beibehaltung des G8 an Hamburgs Gymnasien aus, da G9 bereits flächendeckend an den Stadtteilschulen angeboten wird.
Zentrale Grundlage des bayerischen Bildungserfolgs : hochwertige Ausbildung der bayerischen Lehrkräfte.
Mit Versetzung in die Klassenstufe 10 wird ein dem Hauptschulabschluss gleichwertiger Bildungsstand bestätigt.
Zuletzt hatte sich auch die Konferenz der Schulleitungen der Stadtteilschulen dafür ausgesprochen den Schulfrieden einzuhalten und das Wahlangebot zwischen G8 an Gymnasien und G9 an Stadtteilschulen beizubehalten."
