5,0.44512,0.24771,0.14938,2,235,"Die Filme können auch bei allen Landesbildstellen und Landesfilmdiensten ausgeliehen werden.. Kinder stark machen- für ein suchtfreies Leben Themen-Website der Bundeszentrale für gesundheitliche Aufklärung (BZgA) mit zahlreichen kostenlosen Angeboten zur Suchtprävention wie Elternabend-Boxen, Materialien zu Nichtrauchen, Fernsehen, Naschen und Arzneimitteln sowie Schulungen für Trainer/innen
Neben persönlichem Mut gehört zur Zivilcourage der Einsatz für Humanität und Demokratie sowie die Bereitschaft zur friedlichen Konfliktaustragung.
kennen unterschiedliche Formen und Dimensionen von Zivilcourage.
Sie sollen aber zeigen, dass man Gewalt durchaus nicht hilflos gegenüberstehen muss.
sind in der Lage, Situationen ab- und Risiken einzuschätzen.
Das Fehlen von Regeln begünstigt die Entstehung von Gewalt, schon bestehende Regeln werden oft als aufgezwungen empfunden.
Kinder und Jugendliche für das Thema Gewalt sensibilisieren, 2. die konstruktive Konfliktfähigkeit von Jugendlichen fördern, 3.
Manchmal fehlt das Wissen, wie sinnvoll geholfen werden kann.
( Umgang mit Tätern, Opfern, Presse) Wie verhalten sich Betroffene und Beteiligte?
Teilnehmer erhalten das Lehrerhandbuch ``Erwachsen werden'' mit Unterrichtsmaterialien zur Stärkung der Schülerpersönlichkeit.
Auch die Arbeit mit Lehrkräften und anderen Betroffenen wie Polizei und Ärzten sind hier zu nennen.
Zivilcourage lernen Analysen- Modelle- Arbeitshilfen; Hrsg.
Wie können Gewalttaten und Übergriffe verhindert oder beendet werden und welche Hilfe brauchen die Opfer?
Kooperation und Kommunikation Der kleinste Teil der Gewalt an Schulen ist ``hausgemacht'' und deswegen müssen sich Erfolg versprechende Präventiv-maßnahmen auch auf den außerschulischen Bereich, etwa im Rahmen von Projektwochen erstrecken.
Versuche nicht, ihn einzuschüchtern, ihm zu drohen oder Angst zu machen.
Aktives gewaltfreies Verhalten ist erlernbar.
erfahren, dass Opfer ein Recht auf Schutz und Hilfe haben Methodenkompetenz Die Schülerinnen und Schüler.
Den Teilnehmern wird die notwendige Kompetenz vermittelt, angemessen auf Probleme von Schülern und Eltern zu reagieren und besser mit Disziplinschwierigkeiten umzugehen.",0.69211,0.53248,0.37108,11,574,"Eine verbesserte Kommunikation wird möglich über das Erlernen bestimmter Techniken.
Zur Zeit sind viele Schulen dabei, über gezielte Trainingsprogramme Schülerinnen und Schüler, insbesondere der Klassen neun und zehn, zu befähigen, Streitigkeiten unter sich selbstverantwortlich zu regeln.
Erprobt verschiedene Verhaltensweisen im Rollenspiel und beobachtet die jeweiligen Reaktionen.
entwickeln eine positive Streitkultur Didaktisch-methodischer Kommentar Ob klassische Prügelei auf dem Schulhof, Drangsalieren an der Bushaltestelle oder fiese Kommentare im Klassenzimmer- aggressives Verhalten ist auch in der Schule allgegenwärtig.
Und deshalb steht für die Vermittler, die Mediatoren, am Anfang das Training : Aktives Zuhören, sicheres Auftreten, Gerechtigkeitssinn, Erkennen von Stimmungen, Eingehen auf Gefühle der Streithähne, Gesprächsführung.
Jede Konfliktsituation ist von konkreten und situativen Faktoren geprägt; sie ist – trotz ähnlicher Grundmuster – einmaliger Natur.
Mittlerweile existieren gezielte Trainingsprogramme, mit denen solche Situationen, vor allem in den Klassen neun bis zehn, bewältigt werden können.
( Ergänzend lässt sich sagen, dass weltweit 500 000 kinderpornographische Darstellungen im Internet (§ 184/III StGB) im Umlauf sind – eine besondere Form der Gewalt der heutigen Gesellschaft gegenüber Minderjährigen. )
Für die Sekundarstufe I (zehn- bis 16-Jährige) ist es sicherlich günstig mit einem Fallbeispiel zu beginnen, wenn es sich anbietet, auch aus dem eigenen (schulischen) Umfeld.
Aber das Programm strahlt vieles aus : Engagement und Zivilcourage ``machen Schule'' und das Verhältnis Schüler-Lehrer entwickelt sich.
Dabei sind Konflikte grundsätzlich nichts Negatives, schließlich sind sie Anlass und Möglichkeit, andere Meinungen wahrzunehmen, Anschauungen zu überdenken und das eigene Tun zu verändern.
Aber immer häufiger werden sie unterdrückt oder mit Gewalt beantwortet, statt offen ausgesprochen.
Kinder und Jugendliche für das Thema Gewalt sensibilisieren, 2. die konstruktive Konfliktfähigkeit von Jugendlichen fördern, 3.
Handlungsmöglichkeiten entwickeln, die eine Alternative zu Gewalt darstellen, 4. die Bildung von Netzwerken fördern, die Hilfen für Betroffene anbieten.
Grundsätzlich lassen sich präventive und intervenierende Handlungsmöglichkeiten unterscheiden.
Oktober 2001 Hartmut Engler, Sänger der Band PUR, kürt zusammen mit JRK-Bundesleiterin Ulrike Würth die Gewinner des Mal- und Fotowettbewerbs.
Mit Beteiligten Sonderveranstaltungen vorbereiten Aussprache mit Lehrern, Präfekten und Pädagogen, Aussprache mit Klassen und Heimgruppen, Veranstaltungen für Lehrer, Eltern, Schüler und Öffentlichkeit, Leitfaden zum Gesprächsverlauf, Aufgabenverteilung, Rituale als Ausdruck von Trauer, Erinnerung, Hoffnung, Solidarität und Gedenken initiieren, Übergang zum Alltag sobald wie möglich ebnen.
( Umgang mit Tätern, Opfern, Presse) Wie verhalten sich Betroffene und Beteiligte?
September 2002 Die Unterrichtseinheit ``Bleib' COOL ohne Gewalt!
sind in der Lage, Situationen ab- und Risiken einzuschätzen.
Im schulischen Bereich werden dazu einzelne Schüler zu Konfliktlotsen ausgebildet, man spricht in diesem Falle von einer Peermediation.
Dafür werden meist beliebte Schüler wie Schüler- oder Klassensprecher ausgewählt.
Diese erhalten eine Sprechzeit während einer Unterrichtsstunde und einen eigenen Mediationsraum.
In der Pause gibt es bestimmte Plätze, wo man Mediatoren als Ansprechpartner finden kann.
Zivilcourage lernen Analysen- Modelle- Arbeitshilfen; Hrsg.
Die Betroffenen sollen beide als Sieger aus dem Konflikt herausgehen.
Die Übertragung von Verantwortung an SchülerInnen und deren Beteiligung im Sinne der inneren Schulentwicklung ist eine tragende Säule der Gewaltprävention.
Im Moment umfasst die Arbeit von Kisko drei Bereiche : Trainings für ganze Schulklassen, Lehrerfortbildung zum „Umgang mit Konflikten“ und die Ausbildung von Schülern als Streitschlichter an einer Schule.
Das Fehlen von Regeln begünstigt die Entstehung von Gewalt, schon bestehende Regeln werden oft als aufgezwungen empfunden.
Die Schülerinnen können an der Festlegung von Sozialnormen beteiligt werden und z.
Die Regeln sind nicht mehr nur auferlegt, werden durch die Unterschrift verbindlicher erlebt und besser mitgetragen.
Darauf reagierten die Lehrkräfte natürlich bereits seit Mittwoch, den 12. September 2001 auf unterschiedliche Weise pädagogisch.
Kooperation und Kommunikation Der kleinste Teil der Gewalt an Schulen ist ``hausgemacht'' und deswegen müssen sich Erfolg versprechende Präventiv-maßnahmen auch auf den außerschulischen Bereich, etwa im Rahmen von Projektwochen erstrecken.
Das Buch „Gewalt in der Schule“ von Dan Olweus sollte als Standardwerk in jeder Schule verfügbar sein.
Sonstige Hilfsmöglichkeiten 5.1 Lions Quest- ein Life-Skills-Programm zur Gewaltprävention für verschiedene Jahrgangsstufen Lions Quest Ein vielfältiges Materialangebot erlaubt es Lehrkräften, langfristig im Unterricht verschiedener Fachrichtungen präventiv zu arbeiten.
Stichwörter sind hier Mediation, Streitschlichtung (peers) und interkulturelle Sensibilisierung.
An vielen Arbeitsplätzen sind Übergriffe und Drohungen bis hin zur körperlichen und sogar Waffengewalt eine reale Gefahr.
Nach wiederholten Aufforderungen des Lehrers, die Klasse sofort zu verlassen, dreht sich der Schüler um, geht nach vorne und schlägt den Lehrer wortlos nieder.",0.81216,0.68308,0.45184,115,703,"Kinder, die sich mit der Ideologie ihrer Eltern identifizieren, verarbeiten politische Gewalt besser als andere (Punamaki, 1996).
Krise kommt aus dem Griechischem Krisis und bedeutet Entscheidung bzw. entscheidende Wendung.
Unter Krise versteht man eine vorübergehende Instabilität eines Individuums oder eines sozialen Systems.
IMAGINATION Der Leugnungsmechanismus hilft Kinder sich zu distanzieren und somit mit der Situation fertig zu werden (Itzkowitz, 1994).
Typische Symptome sind : Stress, Labilität, Desorganisation, Angst, Lähmung, Chaos, Hilflosigkeit, drohender Kollaps.
Rough and tumble play sind Raufereien an der Grenze zwischen Spaß und Ernst z.
Diese gelten jedoch als prosoziales Verhalten (Oswald), wo nur bestimmte Grenzen ausgetestet werden.
Elemente der Streitschlichtung haben sowohl in der Schule als auch in der außerschulischen Jugendarbeit, im Bereich kleinerer Straftaten, der Schiedsgerichtbarkeit und im Berufsleben ihren Platz.
Nach der Shell-Studie Jugend '97 sehen 45,3 % der Jugendlichen Arbeitslosigkeit als Hauptproblem.
Die Häufung von Tätern an Schulformen, die schlechte berufliche Chancen wahrscheinlich machen, bestätigt diese Ergebnisse.
Deshalb ist es besonders wichtig, diese Thematik offen anzusprechen und gemeinsam zu überlegen, wie die Schulkultur verbessert werden kann.
Er führte aus, dass das Fernsehen zu „ einer weltweiten Kultur der Gewalt beiträgt.“ Ein Phänomen liege darin, dass junge Menschen, die Möglichkeit sehen als „Massenmörder berühmt zu werden“ (Fall Mehmet).
Über Risikobereiche der neuen Medien äußert sich Groebel folgendermaßen : Es finde eine Kultivierung von extremster Gewalt statt.
Das wäre ein Grund, das Viergespann der Kardinaltugenden einzuführen und mit Beispielen zu belegen, um zu verdeutlichen, dass Tugenden nicht isoliert, sondern nur im Verbund zur Anwendung kommen können.
Es ist daher notwendig, dass sich die Pädagogen selbst, besser noch das Kollegium als Ganzes, mit der eigenen „Befindlichkeit“ bezüglich der miterlebten Katastrophe beschäftigten.
Es darf keine Gewinner und Verlierer geben.
Zur Zeit sind viele Schulen dabei, über gezielte Trainingsprogramme Schülerinnen und Schüler, insbesondere der Klassen neun und zehn, zu befähigen, Streitigkeiten unter sich selbstverantwortlich zu regeln.
B. die Staatliche Schulberatung) stehen bereit, um in Einzelfällen für Lehrkräfte, Schüler und Eltern Hilfestellung zu geben.
Die wichtigere Lektion für die Zivilcourage ist das Übungshandeln, um im Ernstfall auf Handlungskategorien und Verhaltensmöglichkeiten zurückgreifen zu können.
Dabei sind Konflikte grundsätzlich nichts Negatives, schließlich sind sie Anlass und Möglichkeit, andere Meinungen wahrzunehmen, Anschauungen zu überdenken und das eigene Tun zu verändern.
Aber immer häufiger werden sie unterdrückt oder mit Gewalt beantwortet, statt offen ausgesprochen.
Lehrkräfte, die ihre Schüler im Unterricht motivieren können, zeichnen sich durch eine erhöhte Aufmerksamkeit und Präsenz aus.
Sie schaffen es das Interesse der gesamten Klasse auf sich zu konzentrieren und verfügen über ein Bewegungsmanagement, das heißt, Dynamik und nicht Statik beherrschen den Unterrichtsstil.
Grundsätzlich lassen sich präventive und intervenierende Handlungsmöglichkeiten unterscheiden.
Konkret bedeutet Primärprävention hier Friedenserziehung, Erziehung zu Toleranz und Rücksichtnahme, die Stärkung kommunikativer und sozialer Kompetenzen sowie Interesse für die individuellen Bedürfnisse anderer.
Unter Tertiärprävention versteht man in diesem Zusammenhang Hilfe für die Betroffenen, aus der traumatischen Situation wieder zum Alltag zurückzufinden.
Oft sind es leider die Eltern, die Kindern und Jugendlichen raten, dass es immer besser ist, sich herauszuhalten.
Mit Beteiligten Sonderveranstaltungen vorbereiten Aussprache mit Lehrern, Präfekten und Pädagogen, Aussprache mit Klassen und Heimgruppen, Veranstaltungen für Lehrer, Eltern, Schüler und Öffentlichkeit, Leitfaden zum Gesprächsverlauf, Aufgabenverteilung, Rituale als Ausdruck von Trauer, Erinnerung, Hoffnung, Solidarität und Gedenken initiieren, Übergang zum Alltag sobald wie möglich ebnen.
Neben persönlichem Mut gehört zur Zivilcourage der Einsatz für Humanität und Demokratie sowie die Bereitschaft zur friedlichen Konfliktaustragung.
Nicht falsch verstandenes Heldentum, sondern zivilgesellschaftlicher Einsatz mit kalkulierbarem Risiko, sollte dabei die Handlungsmaxime sein.
Streitschlichtungs-Programm Streitschlichten will gelernt sein.
4.4 Supervision Supervision heißt über berufsbezogene Probleme nachzudenken.
Auch wenn ein Täter recht ``cool'' in eine solche Auseinandersetzung geht, führt die Begegnung mit dem Opfer zur Betroffenheit; es wächst das Bewusstsein, einem anderen Schlimmes angetan zu haben.
Die Strafe handeln Täter und Opfer aus; das geht mehr unter die Haut als ein Gerichtsurteil.
Nach einem bedrohenden oder schockierenden Ereignis müssen jene Menschen besonders betreut werden, bei denen dieser Vorfall akute seelische Belastungen hervorgerufen hat.
Es bedarf Mitmenschen, die ruhig bleiben und die Übersicht wahren und gleichzeitig fähig sind, die individuellen Bedürfnisse der Betroffenen wahr zu nehmen und gegebenenfalls auch zu erfüllen.
Man unterscheidet zwischen Gruppen- und Einzelsupervision.
Pubertäre Rachephantasien als Reaktion auf ständige Demütigungen durch andere Schüler in Verbindung mit waffengeilen Bedürfnissen, neonazistischen Ideen und aufputschender Musik der Neonaziband Ramstein, an deren Texten sie sich berauschten, machten aus Opfern brutale Täter.“ (Weiß S.88) Auch bei uns lassen sie derartige Fälle finden wie die Beispielliste nach Weiß (S. 92) zeigt : 28.
Das Fehlen von Regeln begünstigt die Entstehung von Gewalt, schon bestehende Regeln werden oft als aufgezwungen empfunden.
Einführung Das unfassbare Massaker am 26. April 2002 in Erfurt und die Terroranschläge vom 11.
2001 auf die Vereinigten Staaten von Amerika haben unvorhergesehene Auswirkungen auf die gesamte Welt und bedrohen für alle schmerzlich den Frieden und unsere Zukunft.
Im September gibt das Netzwerk ``Gewaltprävention und Verantwortungsübernahme'' einen Videofilm ``Der Gewalt auf der Spur'' heraus, in dem die wirksamsten Teilprojekte des Modellversuchs zusammengefasst werden.
Krisen können sich auch aus einer Zuspitzung längerer konflikthafter Prozesse ergeben, brechen aber in ihrer traumatisch-massiven Eindrücklichkeit unerwartet und unvorbereitet auf die Betroffenen herein : Sie schlagen ein wie der Blitz aus heiterem Himmel.
Der Begriff Krisenmanagement bezeichnet das bewusste, aktive sich Kümmern um Menschen und um Einrichtungen und deren Mitglieder.
Wie reagieren Kinder und Jugendliche auf Krisensituationen Je kleiner Kinder sind, desto weniger reagieren sie emotional auf Vorkommnisse, die sie nicht selbst erlebt haben.
Nach wiederholten Aufforderungen des Lehrers, die Klasse sofort zu verlassen, dreht sich der Schüler um, geht nach vorne und schlägt den Lehrer wortlos nieder.
B. eine fiktive Anmache in der Straßenbahn : Nehmen sie sofort die Hand von meinem Hintern!
Die Beispiele von Gewalt an Schulen oder von Schülern sind zahlreich, diese hier jedoch stammen aus dem Text ``Schulen- Brutstätten der Gewalt'', der zur Abschlussprüfung an Realschulen in Bayern im Jahr 2000 den Schülern vorgelegt wurde.
Ablaufmodell zur Krisenverarbeitung Wenn aus dem gewohnten Alltag heraus das dramatische und erschütternde Ereignis passiert, lassen sich immer wieder folgende, spiralförmig ablaufende Muster der Krisenverarbeitung erkennen : 5.
Und sie haben bessere Chancen, die traumatische Erfahrung zu bewältigen und gesunde, motivierte Mitarbeiterinnen und Mitarbeiter zu bleiben."
