0,0.70732,0.53823,0.34892,0,0,"werden für das Thema Gewalt sensibilisiert.
Neben persönlichem Mut gehört zur Zivilcourage der Einsatz für Humanität und Demokratie sowie die Bereitschaft zur friedlichen Konfliktaustragung.
kennen unterschiedliche Formen und Dimensionen von Zivilcourage.
Manchmal fehlt das Wissen, wie sinnvoll geholfen werden kann.
Besonders Schulen spüren diese Erschütterung des Friedens.
( findet man bereits bei Dreijährigen, die sich z.
Er führte aus, dass das Fernsehen zu „ einer weltweiten Kultur der Gewalt beiträgt.“ Ein Phänomen liege darin, dass junge Menschen, die Möglichkeit sehen als „Massenmörder berühmt zu werden“ (Fall Mehmet).
Sie sollen aber zeigen, dass man Gewalt durchaus nicht hilflos gegenüberstehen muss.
Klassengespräche sollen regelmäßig stattfinden.
Gewalttätigkeit soll vorgebeugt werden, indem man z.
B. das Klassenklima verbessert oder die Kommunikationsfähigkeit von Schülern und Lehrkräften trainiert.
AUSGANGSSITUATION Die zunehmende Gewaltbereitschaft ist zu einem großen Problem unserer Gesellschaft geworden.
Immer weniger Kinder und Jugendliche sind in der Lage, Konflikte gewaltfrei auszutragen.
März 2003 Der Bundesdelegiertentag beschließt einen Maßnahmenkatalog zur Verankerung des Themas Gewaltprävention im Jugendrotkreuz.
Verantwortung übernehmen Gewaltbereitschaft entsteht auf dem Boden von übermäßiger Frustration und einem Ohnmachtsgefühl.
Das Fehlen von Regeln begünstigt die Entstehung von Gewalt, schon bestehende Regeln werden oft als aufgezwungen empfunden.
Wie können Gewalttaten und Übergriffe verhindert oder beendet werden und welche Hilfe brauchen die Opfer?
erarbeiten mögliche präventive Maßnahmen.
12.2.2003 Unter Schülerinnen und Schülern kommt es oftmals zu Konflikten.
Aktives gewaltfreies Verhalten ist erlernbar.
Der Erziehungswissenschaftler Dieter Lenzen definiert etwa folgendermaßen : ``Zivilcourage heißt, einem Unrecht nicht tatenlos zuschauen, welches andere Dritten zufügen, auch dann, wenn einem selbst aus der Intervention (Einmischung) kein unmittelbarer Vorteil erwächst.''
Verhaltenstraining bietet uns die Chance, bisher ungewohntes Verhalten auszuprobieren, einzuüben und zu reflektieren'' (Eric Posselt, Handbuch ``Schule ohne Rassismus'').",0.90712,0.81529,0.54758,0,0,"Gewalt in der Schule, die von den Medien gerne auf das Versagen der Lehrerschaft zurückgeführt wird, ist nach Meinung des Bildungsforschers Klaus Hurrelmann ``Teil der sozialen Krankheit unserer Gesellschaft''.
Gewalt hat viele Gesichter.
Ausgewählte Ursachen Grundsätzlich lässt sich feststellen, dass multifaktorielle Ursachen zur Entstehung von Gewalt beitragen.
Inzwischen existieren bereits eine Reihe von Maßnahmen, die sich anbieten, sowohl präventiv als auch im nachhinein damit umzugehen.
Hemmung eines unerwünschten Verhaltens 2.
Verminderung unerwünschter Anreger 3.
Angebot von positiven Anregern 4.
Förderung eines alternativen Verhaltens.“ Im schulischen Rahmen nimmt dabei die Bedeutung des proaktiven Klassenmanagements (Heller/Ziegler) zu.
Grundsätzlich lassen sich präventive und intervenierende Handlungsmöglichkeiten unterscheiden.
Außerdem sollen die bereits vorhandenen Methoden der Gesprächsführung erweitert werden und bei der Durchsetzung wichtiger Anliegen Fairness geübt werden.
Es sollen Störungen, die im Unterricht auftreten, sowie extreme Unterrichtsstile vermindert werden.
Bei der Mediation handelt es sich um eine Vermittlung in Konflikten durch unparteiische Dritte.
Im schulischen Bereich werden dazu einzelne Schüler zu Konfliktlotsen ausgebildet, man spricht in diesem Falle von einer Peermediation.
Dafür werden meist beliebte Schüler wie Schüler- oder Klassensprecher ausgewählt.
Diese erhalten eine Sprechzeit während einer Unterrichtsstunde und einen eigenen Mediationsraum.
In der Pause gibt es bestimmte Plätze, wo man Mediatoren als Ansprechpartner finden kann.
Der Mediationsprozess lässt sich in drei verschiedene Phasen einteilen : Die Vorphase : Die Konfliktparteien sollen an einen Tisch kommen.
Das Mediationsgespräch unterteilt sich wiederum in 5 Phasen : 1.
Die Betroffenen sollen beide als Sieger aus dem Konflikt herausgehen.
Die Programme sind als schnelle Intervention für akute Konflikte in Schulklassen gedacht.
Doch mit Gewalt löst man keine Probleme.
Immer weniger Kinder und Jugendliche sind in der Lage, Konflikte gewaltfrei auszutragen.
Dabei sind Konflikte grundsätzlich nichts Negatives, schließlich sind sie Anlass und Möglichkeit, andere Meinungen wahrzunehmen, Anschauungen zu überdenken und das eigene Tun zu verändern.
Kinder und Jugendliche für das Thema Gewalt sensibilisieren, 2. die konstruktive Konfliktfähigkeit von Jugendlichen fördern, 3.
Handlungsmöglichkeiten entwickeln, die eine Alternative zu Gewalt darstellen, 4. die Bildung von Netzwerken fördern, die Hilfen für Betroffene anbieten.
Schüler/-innen können sich dort zu Streitschlichtern ausbilden lassen und vermitteln dann bei Konflikten zwischen Mitschülern.
September 2002 Die Unterrichtseinheit ``Bleib' COOL ohne Gewalt!
Verantwortung übernehmen Gewaltbereitschaft entsteht auf dem Boden von übermäßiger Frustration und einem Ohnmachtsgefühl.
Die Übertragung von Verantwortung an SchülerInnen und deren Beteiligung im Sinne der inneren Schulentwicklung ist eine tragende Säule der Gewaltprävention.
Der Wille zur Mitgestaltung des Lernumfelds ist häufiger anzutreffen, als vermutet.
Das Fehlen von Regeln begünstigt die Entstehung von Gewalt, schon bestehende Regeln werden oft als aufgezwungen empfunden.
Die Schülerinnen können an der Festlegung von Sozialnormen beteiligt werden und z.
Die Regeln sind nicht mehr nur auferlegt, werden durch die Unterschrift verbindlicher erlebt und besser mitgetragen.
Kooperation und Kommunikation Der kleinste Teil der Gewalt an Schulen ist ``hausgemacht'' und deswegen müssen sich Erfolg versprechende Präventiv-maßnahmen auch auf den außerschulischen Bereich, etwa im Rahmen von Projektwochen erstrecken.
Eine verbesserte Kommunikation wird möglich über das Erlernen bestimmter Techniken.
Stichwörter sind hier Mediation, Streitschlichtung (peers) und interkulturelle Sensibilisierung.
An vielen Arbeitsplätzen sind Übergriffe und Drohungen bis hin zur körperlichen und sogar Waffengewalt eine reale Gefahr.
Mittlerweile existieren gezielte Trainingsprogramme, mit denen solche Situationen, vor allem in den Klassen neun bis zehn, bewältigt werden können.
Zur Zeit sind viele Schulen dabei, über gezielte Trainingsprogramme Schülerinnen und Schüler, insbesondere der Klassen neun und zehn, zu befähigen, Streitigkeiten unter sich selbstverantwortlich zu regeln.
Und deshalb steht für die Vermittler, die Mediatoren, am Anfang das Training : Aktives Zuhören, sicheres Auftreten, Gerechtigkeitssinn, Erkennen von Stimmungen, Eingehen auf Gefühle der Streithähne, Gesprächsführung.
Nach : PZ-Information 14/97, Streitschlichtung durch Schülerinnen und Schüler, Pädagogisches Zentrum, Bad Kreuznach.Link http : //www.bildungrp.de/PZ/p3info/2000.htm Will man ein solches Programm in einer Schule fest implantieren, so bedarf es eines gezielten einführenden Trainings für die Mediatoren und einer begleitenden Betreuung durch einen Lehrer oder Sozialarbeiter.
Aber das Programm strahlt vieles aus : Engagement und Zivilcourage ``machen Schule'' und das Verhältnis Schüler-Lehrer entwickelt sich.
Jede Konfliktsituation ist von konkreten und situativen Faktoren geprägt; sie ist – trotz ähnlicher Grundmuster – einmaliger Natur.
Für die Sekundarstufe I (zehn- bis 16-Jährige) ist es sicherlich günstig mit einem Fallbeispiel zu beginnen, wenn es sich anbietet, auch aus dem eigenen (schulischen) Umfeld.",0.93023,0.87556,0.57907,0,0,"Neben persönlichem Mut gehört zur Zivilcourage der Einsatz für Humanität und Demokratie sowie die Bereitschaft zur friedlichen Konfliktaustragung.
Nicht falsch verstandenes Heldentum, sondern zivilgesellschaftlicher Einsatz mit kalkulierbarem Risiko, sollte dabei die Handlungsmaxime sein.
Einführung Das unfassbare Massaker am 26. April 2002 in Erfurt und die Terroranschläge vom 11.
2001 auf die Vereinigten Staaten von Amerika haben unvorhergesehene Auswirkungen auf die gesamte Welt und bedrohen für alle schmerzlich den Frieden und unsere Zukunft.
Krisen können sich auch aus einer Zuspitzung längerer konflikthafter Prozesse ergeben, brechen aber in ihrer traumatisch-massiven Eindrücklichkeit unerwartet und unvorbereitet auf die Betroffenen herein : Sie schlagen ein wie der Blitz aus heiterem Himmel.
Menschen und auch Institutionen brauchen in Krisensituationen Unterstützung.
Der Begriff Krisenmanagement bezeichnet das bewusste, aktive sich Kümmern um Menschen und um Einrichtungen und deren Mitglieder.
Wie reagieren Kinder und Jugendliche auf Krisensituationen Je kleiner Kinder sind, desto weniger reagieren sie emotional auf Vorkommnisse, die sie nicht selbst erlebt haben.
Ablaufmodell zur Krisenverarbeitung Wenn aus dem gewohnten Alltag heraus das dramatische und erschütternde Ereignis passiert, lassen sich immer wieder folgende, spiralförmig ablaufende Muster der Krisenverarbeitung erkennen : 5.
Kinder, die sich mit der Ideologie ihrer Eltern identifizieren, verarbeiten politische Gewalt besser als andere (Punamaki, 1996).
IMAGINATION Der Leugnungsmechanismus hilft Kinder sich zu distanzieren und somit mit der Situation fertig zu werden (Itzkowitz, 1994).
Es ist daher notwendig, dass sich die Pädagogen selbst, besser noch das Kollegium als Ganzes, mit der eigenen „Befindlichkeit“ bezüglich der miterlebten Katastrophe beschäftigten.
Erst im Anschluss an eine solche „Selbstklärung“ sollten die mit den Schülern vertrauten Lehrkräfte pädagogisch mit den Klassen arbeiten – und zwar auf gleiche Weise wie sie es selbst praktiziert haben.
Damit an Schulen bei Krisenereignissen professionell – pädagogisch gehandelt werden kann, ist es erforderlich, bereits weit im Vorfeld entsprechende Planungen zu treffen, um im Ernstfall nur noch Checklisten abfragen zu müssen, wie man zu handeln hat.
Konkret bedeutet Primärprävention hier Friedenserziehung, Erziehung zu Toleranz und Rücksichtnahme, die Stärkung kommunikativer und sozialer Kompetenzen sowie Interesse für die individuellen Bedürfnisse anderer.
Unter Tertiärprävention versteht man in diesem Zusammenhang Hilfe für die Betroffenen, aus der traumatischen Situation wieder zum Alltag zurückzufinden.
Nach einem bedrohenden oder schockierenden Ereignis müssen jene Menschen besonders betreut werden, bei denen dieser Vorfall akute seelische Belastungen hervorgerufen hat.
Es bedarf Mitmenschen, die ruhig bleiben und die Übersicht wahren und gleichzeitig fähig sind, die individuellen Bedürfnisse der Betroffenen wahr zu nehmen und gegebenenfalls auch zu erfüllen.
Es wird davon ausgegangen, das Jungen physisch aggressiver sind und Mädchen relational aggressiver.
Rough and tumble play sind Raufereien an der Grenze zwischen Spaß und Ernst z.
Diese gelten jedoch als prosoziales Verhalten (Oswald), wo nur bestimmte Grenzen ausgetestet werden.
Nach der Shell-Studie Jugend '97 sehen 45,3 % der Jugendlichen Arbeitslosigkeit als Hauptproblem.
Die Häufung von Tätern an Schulformen, die schlechte berufliche Chancen wahrscheinlich machen, bestätigt diese Ergebnisse.
Er führte aus, dass das Fernsehen zu „ einer weltweiten Kultur der Gewalt beiträgt.“ Ein Phänomen liege darin, dass junge Menschen, die Möglichkeit sehen als „Massenmörder berühmt zu werden“ (Fall Mehmet).
Lehrkräfte, die ihre Schüler im Unterricht motivieren können, zeichnen sich durch eine erhöhte Aufmerksamkeit und Präsenz aus.
Sie schaffen es das Interesse der gesamten Klasse auf sich zu konzentrieren und verfügen über ein Bewegungsmanagement, das heißt, Dynamik und nicht Statik beherrschen den Unterrichtsstil.
Grundsätzlich lassen sich präventive und intervenierende Handlungsmöglichkeiten unterscheiden.
Bei der Mediation handelt es sich um eine Vermittlung in Konflikten durch unparteiische Dritte.
4.4 Supervision Supervision heißt über berufsbezogene Probleme nachzudenken.
Man unterscheidet zwischen Gruppen- und Einzelsupervision.
Pubertäre Rachephantasien als Reaktion auf ständige Demütigungen durch andere Schüler in Verbindung mit waffengeilen Bedürfnissen, neonazistischen Ideen und aufputschender Musik der Neonaziband Ramstein, an deren Texten sie sich berauschten, machten aus Opfern brutale Täter.“ (Weiß S.88) Auch bei uns lassen sie derartige Fälle finden wie die Beispielliste nach Weiß (S. 92) zeigt : 28.
Krise kommt aus dem Griechischem Krisis und bedeutet Entscheidung bzw. entscheidende Wendung.
Unter Krise versteht man eine vorübergehende Instabilität eines Individuums oder eines sozialen Systems.
Typische Symptome sind : Stress, Labilität, Desorganisation, Angst, Lähmung, Chaos, Hilflosigkeit, drohender Kollaps.
Krisenintervention hat weniger therapeutische Ambitionen, sie trachtet also nicht nach einer Modifizierung der Persönlichkeit.
Doch mit Gewalt löst man keine Probleme.
Dabei sind Konflikte grundsätzlich nichts Negatives, schließlich sind sie Anlass und Möglichkeit, andere Meinungen wahrzunehmen, Anschauungen zu überdenken und das eigene Tun zu verändern.
In der aktuellen Debatte zum Rechtsextremismus taucht auch die Forderung nach Maßnahmen in der Schule auf.
Das Fehlen von Regeln begünstigt die Entstehung von Gewalt, schon bestehende Regeln werden oft als aufgezwungen empfunden.
Junge Leute, die um die Gefahr wissen und auf etwaige Übergriffe vorbereitet sind, haben bessere Chancen, Gewalttaten vorzubeugen oder sie zu stoppen.
Zur Zeit sind viele Schulen dabei, über gezielte Trainingsprogramme Schülerinnen und Schüler, insbesondere der Klassen neun und zehn, zu befähigen, Streitigkeiten unter sich selbstverantwortlich zu regeln.
Elemente der Streitschlichtung haben sowohl in der Schule als auch in der außerschulischen Jugendarbeit, im Bereich kleinerer Straftaten, der Schiedsgerichtbarkeit und im Berufsleben ihren Platz.
Streitschlichtungs-Programm Streitschlichten will gelernt sein.
Es darf keine Gewinner und Verlierer geben.
In Ansätzen wird dabei auch ``Körpersprache'' einbezogen und in Übungshandeln erprobt, wie man auch auf diese Weise locker bleibt oder erfolgreich schlichten kann.
Der gesamte Rahmen wird nicht von den Regularien und formalisierten Verfahren eines Prozesses, sondern von einer Gesprächssituation geprägt.
Die Begegnung mit dem Opfer macht dem Täter drastisch klar, was er angerichtet hat.
Die Strafe handeln Täter und Opfer aus; das geht mehr unter die Haut als ein Gerichtsurteil.
Und wenn keine Regelung zustande kommt, führt kein Weg an einem gerichtlichen Verfahren vorbei.
Der Schwerpunkt liegt auf der Handlungskomponente – womit die Zivilcourage in den Vordergrund rückt – für die allerdings Übungen und Reflexionen unabdingbar und auch Grundkenntnisse und Sensibilisierungen erforderlich sind.
Das wäre ein Grund, das Viergespann der Kardinaltugenden einzuführen und mit Beispielen zu belegen, um zu verdeutlichen, dass Tugenden nicht isoliert, sondern nur im Verbund zur Anwendung kommen können.
Die wichtigere Lektion für die Zivilcourage ist das Übungshandeln, um im Ernstfall auf Handlungskategorien und Verhaltensmöglichkeiten zurückgreifen zu können.
Oft sind es leider die Eltern, die Kindern und Jugendlichen raten, dass es immer besser ist, sich herauszuhalten."
1,0.32317,0.0948,0.09228,0,0,"Der komplette didaktisch-methodische Kommentar zum Herunterladen : Aktiv gegen Gewalt (Didaktik / Methodik) Hintergrundinformationen für die Lehrkraft.
Kompetenzen Fachkompetenz Die Schülerinnen und Schüler.
setzen sich mit unterschiedlichen Formen von Gewalt und verschiedenen Begriffsdefinitionen auseinander.
reflektieren eigene Erfahrungen mit Aggressionen und Gewalt.
Wie können Gewalttaten und Übergriffe verhindert oder beendet werden und welche Hilfe brauchen die Opfer?
Handlungsmöglichkeiten entwickeln, die eine Alternative zu Gewalt darstellen, 4. die Bildung von Netzwerken fördern, die Hilfen für Betroffene anbieten.
Den Schüler und Schülerinnen muss dabei die Freiheit gelassen werden, sich zurückzuziehen bzw. das Thema später wieder aufzugreifen.
lernen sich selbst und andere besser kennen.
Grundsätzlich lassen sich präventive und intervenierende Handlungsmöglichkeiten unterscheiden.
Non-helping-bystander-Effekt Die kompletten Hintergrundinformationen zum Herunterladen : Umgang mit Gewalt (Hintergrundinformationen) Lehrmaterialien Zivilcourage Alle Unterrichtsmaterialien, Format : ZIP Dateigröße : 2093 KB Folie 1 : Zivilcourage- was ist das?
Arbeitsblatt für Schülerinnen und Schüler, Format : PDF Dateigröße : 50 KB Arbeitsblatt 3 : Jetzt reicht's!
Folgen : Krankenhaus für das Opfer, Schulverweise für den Täter.
Wer ist betroffen, wer könnte wem helfen?
Viel häufiger als die Schüler sind Lehrer damit befasst, bei Streitigkeiten und Konfliktsituationen von Schülern zu ``schlichten'' bzw. zu intervenieren.
Gewalt zum Thema machen Publikation der Bundeszentrale für politische Bildung, Bereitstellungspauschale 3 Euro.
Handbuch Gewaltprävention II Autor : Günther Gugel; mit Grundlagen, Lernfelder und Handlungsmöglichkeiten der Gewaltprävention für die Sekundarstufen, kostenloser Download Das Buch ist für 38,80 EUR über den Shop des Instituts für Friedenspädagogik erhältlich.
Der Mal- und Fotowettbewerb „Gesichter der Gewalt“ startet.
Nur Mut- Zivilcourage lernen kostenlose Unterrichtsmaterialien zum richtigen Verhalten in mit Konflikt- und Gefahrensituationen.
Wie reagieren Kinder und Jugendliche psychisch auf Krisensituationen 4.
Der Schüler heult vor Schmerz und Wut.",0.46056,0.18726,0.18572,0,0,"Der komplette didaktisch-methodische Kommentar zum Herunterladen : Aktiv gegen Gewalt (Didaktik / Methodik) Hintergrundinformationen für die Lehrkraft.
Kompetenzen Fachkompetenz Die Schülerinnen und Schüler.
werden für das Thema Gewalt sensibilisiert.
setzen sich mit unterschiedlichen Formen von Gewalt und verschiedenen Begriffsdefinitionen auseinander.
reflektieren eigene Erfahrungen mit Aggressionen und Gewalt.
Eine Kleinigkeit zu tun ist besser, als über große Heldentaten nachzudenken.
Und deshalb steht für die Vermittler, die Mediatoren, am Anfang das Training : Aktives Zuhören, sicheres Auftreten, Gerechtigkeitssinn, Erkennen von Stimmungen, Eingehen auf Gefühle der Streithähne, Gesprächsführung.
Oft sind es leider die Eltern, die Kindern und Jugendlichen raten, dass es immer besser ist, sich herauszuhalten.
Arbeitsblatt für Schülerinnen und Schüler, Format : PDF Dateigröße : 25 KB Arbeitsblatt 2 : Vorsicht, Gewalt!
Denn „Es gibt keine normale Reaktion auf Unnormales“ Im Gespräch stehen Akzeptanz, Zuhören und kleine Gesten an erster Stelle.
- Strategien zur Konfliktlösung Diese Datei im PDF-Format liefert Anschauungsmaterial Dateigröße : 4189 KB Mediensammlung.
Wer ist betroffen, wer könnte wem helfen?
Grundsätzlich lassen sich präventive und intervenierende Handlungsmöglichkeiten unterscheiden.
Handbuch Gewaltprävention II Autor : Günther Gugel; mit Grundlagen, Lernfelder und Handlungsmöglichkeiten der Gewaltprävention für die Sekundarstufen, kostenloser Download Das Buch ist für 38,80 EUR über den Shop des Instituts für Friedenspädagogik erhältlich.
Zudem lässt sich ergänzen, dass 50 % der Kinder mittlerweile einen eigenen Fernseher besitzen.
einen daraus resultierenden Konflikt mit anderen;.
lernen sich selbst und andere besser kennen.
eine bundesweite Kampagne zum Thema Gewaltprävention gestartet.
Dies gilt auch für kleine Kinder.
Handlungsmöglichkeiten entwickeln, die eine Alternative zu Gewalt darstellen, 4. die Bildung von Netzwerken fördern, die Hilfen für Betroffene anbieten.
Sie können gleichzeitig mehreren Aufgaben nachkommen und lassen Langeweile im Unterricht erst gar nicht entstehen.
Heranwachsende sollten in der Lage sein Nein zu sagen, wenn Verführungen lauern.
Konkret bedeutet Primärprävention hier Friedenserziehung, Erziehung zu Toleranz und Rücksichtnahme, die Stärkung kommunikativer und sozialer Kompetenzen sowie Interesse für die individuellen Bedürfnisse anderer.
Informationen über die Krise austauschen, mögliche und nötige Interventionen zusammentragen, Angebote an Beteiligte vor Ort machen 2.
Daran erkennen die Schüler : Es entscheidet immer das Opfer, was Gewalt ist.
Den Teilnehmern wird die notwendige Kompetenz vermittelt, angemessen auf Probleme von Schülern und Eltern zu reagieren und besser mit Disziplinschwierigkeiten umzugehen.
Die Filme können auch bei allen Landesbildstellen und Landesfilmdiensten ausgeliehen werden.. Kinder stark machen- für ein suchtfreies Leben Themen-Website der Bundeszentrale für gesundheitliche Aufklärung (BZgA) mit zahlreichen kostenlosen Angeboten zur Suchtprävention wie Elternabend-Boxen, Materialien zu Nichtrauchen, Fernsehen, Naschen und Arzneimitteln sowie Schulungen für Trainer/innen
Nicht falsch verstandenes Heldentum, sondern zivilgesellschaftlicher Einsatz mit kalkulierbarem Risiko, sollte dabei die Handlungsmaxime sein.
Im Sinne der Sekundärprävention muss insbesondere auch daran gedacht werden, den Lehrkräften an den Schulen konkrete Anregungen und Hilfestellungen für den Ernstfall an die Hand zu geben.
Manchmal fehlt das Wissen, wie sinnvoll geholfen werden kann.
Vor allem Politiker fordern eine intensivere Behandlung der Thematik.
Im schulischen Bereich werden dazu einzelne Schüler zu Konfliktlotsen ausgebildet, man spricht in diesem Falle von einer Peermediation.
Non-helping-bystander-Effekt Die kompletten Hintergrundinformationen zum Herunterladen : Umgang mit Gewalt (Hintergrundinformationen) Lehrmaterialien Zivilcourage Alle Unterrichtsmaterialien, Format : ZIP Dateigröße : 2093 KB Folie 1 : Zivilcourage- was ist das?
Vorurteile Rassismus und Fremdenfeindlichkeit basieren auf Vorurteilen, die rein rational nur schwer abzubauen sind.
Die Vorgaben für die jeweiligen Gruppen bieten Anregungen für ähnliche Szenarien.
Couragiert Magazin für demokratisches Handeln und Zivilcourage.
Nur Mut- Zivilcourage lernen kostenlose Unterrichtsmaterialien zum richtigen Verhalten in mit Konflikt- und Gefahrensituationen.
Ein Ziel ist es, berufliche Belastungen besser zu bewältigen und Konflikten vorzubeugen.
Die Menschen im System Schule sind betroffen und handeln aus diesem Gefühl heraus.
Insbesondere junge Menschen werden durch solche Krisen bewegt.
Kooperation und Kommunikation Der kleinste Teil der Gewalt an Schulen ist ``hausgemacht'' und deswegen müssen sich Erfolg versprechende Präventiv-maßnahmen auch auf den außerschulischen Bereich, etwa im Rahmen von Projektwochen erstrecken.
Beispiele für mögliche Krisensituationen in der Schule : Im unmittelbaren beruflichen Umfeld auftretende plötzliche Konfrontation mit Tod, lebensgefährlichen Krankheiten, sexueller und körperlicher Gewalt, Katastrophen, Unfallszenarien etc. wie z.
Wie können Gewalttaten und Übergriffe verhindert oder beendet werden und welche Hilfe brauchen die Opfer?
eignen sich mit Hilfe von Textarbeit selbstständig Wissen an.
Sie sind bereit zu helfen, wenn jemand anderes den ersten Schritt macht oder sie persönlich angesprochen werden.",0.48748,0.16383,0.21476,0,0,"Der komplette didaktisch-methodische Kommentar zum Herunterladen : Aktiv gegen Gewalt (Didaktik / Methodik) Hintergrundinformationen für die Lehrkraft.
Kompetenzen Fachkompetenz Die Schülerinnen und Schüler.
werden für das Thema Gewalt sensibilisiert.
reflektieren eigene Erfahrungen mit Aggressionen und Gewalt.
Eine Kleinigkeit zu tun ist besser, als über große Heldentaten nachzudenken.
Die Vorgaben für die jeweiligen Gruppen bieten Anregungen für ähnliche Szenarien.
Und deshalb steht für die Vermittler, die Mediatoren, am Anfang das Training : Aktives Zuhören, sicheres Auftreten, Gerechtigkeitssinn, Erkennen von Stimmungen, Eingehen auf Gefühle der Streithähne, Gesprächsführung.
Oft sind es leider die Eltern, die Kindern und Jugendlichen raten, dass es immer besser ist, sich herauszuhalten.
Er führte aus, dass das Fernsehen zu „ einer weltweiten Kultur der Gewalt beiträgt.“ Ein Phänomen liege darin, dass junge Menschen, die Möglichkeit sehen als „Massenmörder berühmt zu werden“ (Fall Mehmet).
Sie können gleichzeitig mehreren Aufgaben nachkommen und lassen Langeweile im Unterricht erst gar nicht entstehen.
Arbeitsblatt für Schülerinnen und Schüler, Format : PDF Dateigröße : 50 KB Arbeitsblatt 3 : Jetzt reicht's!
Der Vermittler sorgt dafür, dass die Streithähne ihre unterschiedliche Auffassung und Wahrnehmung klar und deutlich formulieren.
- Strategien zur Konfliktlösung Diese Datei im PDF-Format liefert Anschauungsmaterial Dateigröße : 4189 KB Mediensammlung.
Wer ist betroffen, wer könnte wem helfen?
Zivilcourage lernen Analysen, Modelle und Arbeitshilfen zum Thema Zivilcourage.
Handbuch Gewaltprävention II Autor : Günther Gugel; mit Grundlagen, Lernfelder und Handlungsmöglichkeiten der Gewaltprävention für die Sekundarstufen, kostenloser Download Das Buch ist für 38,80 EUR über den Shop des Instituts für Friedenspädagogik erhältlich.
Handeln in Gewalt- und Gefahrensituationen Grundwissen und Materialien im Umgang mit Bedrohungs- und Gewaltsituationen.
Zudem lässt sich ergänzen, dass 50 % der Kinder mittlerweile einen eigenen Fernseher besitzen.
A Affect Affekte, Gefühle teilen und mitteilen (jemanden anrufen, schreiben, malen) direkter oder indirekter Ausdruck von Gefühlen „Gefühle, ob bewusst oder unbewusst, bilden den Boden für unsere Erfahrungen in der Begegnung mit der Welt.“ S Social sozialer Aspekt Unterstützer nutzen Familien- und Peergruppenzusammenhalt, Kontakt zu den Eltern herstellen Teil eines Ganzen sein „Der Mensch ist zuerst und vor allem ein soziales Tier“.
Aufgrund dessen führte Lösel verhaltenstherapeutische Elterntrainingsprogramme zur Förderung der Erziehungskompetenz durch (10 Sitzungen an je einem Abend) mit dem Ziel Eltern zu stärken, das sogenannte Empowerment.
Es lohnt sich auch, Elemente eines solchen Programms zum Inhalt von Unterricht zu machen, um mit Hilfe von Fällen und Rollenspielen einige bedeutsame Lernziele ins Blickfeld zu rücken; so können zum Beispiel verbale Reaktionen in einem Konflikt analysiert und erprobt und in ihren Wirkungen und Folgen untersucht werden.
Mit Hilfe konkreter Kriseninterventionspläne kann die notwendige Handlungsfähigkeit von einzelnen Personen, Führungskräften und der gesamten Organisation aufrecht erhalten werden.
lernen sich selbst und andere besser kennen.
Dies gilt auch für kleine Kinder.
Handlungsmöglichkeiten entwickeln, die eine Alternative zu Gewalt darstellen, 4. die Bildung von Netzwerken fördern, die Hilfen für Betroffene anbieten.
Sie sollen lernen, Probleme und belastende Lebenssituationen anders zu bewältigen als mit Suchtmitteln und Drogen.
Heranwachsende sollten in der Lage sein Nein zu sagen, wenn Verführungen lauern.
Konkret bedeutet Primärprävention hier Friedenserziehung, Erziehung zu Toleranz und Rücksichtnahme, die Stärkung kommunikativer und sozialer Kompetenzen sowie Interesse für die individuellen Bedürfnisse anderer.
Informationen über die Krise austauschen, mögliche und nötige Interventionen zusammentragen, Angebote an Beteiligte vor Ort machen 2.
Daran erkennen die Schüler : Es entscheidet immer das Opfer, was Gewalt ist.
Anna zähmt die Monster Therapeutische Geschichten für Kinder von Doris Brett, Iskopress 2010.
Die Filme können auch bei allen Landesbildstellen und Landesfilmdiensten ausgeliehen werden.. Kinder stark machen- für ein suchtfreies Leben Themen-Website der Bundeszentrale für gesundheitliche Aufklärung (BZgA) mit zahlreichen kostenlosen Angeboten zur Suchtprävention wie Elternabend-Boxen, Materialien zu Nichtrauchen, Fernsehen, Naschen und Arzneimitteln sowie Schulungen für Trainer/innen
Neben persönlichem Mut gehört zur Zivilcourage der Einsatz für Humanität und Demokratie sowie die Bereitschaft zur friedlichen Konfliktaustragung.
Nicht falsch verstandenes Heldentum, sondern zivilgesellschaftlicher Einsatz mit kalkulierbarem Risiko, sollte dabei die Handlungsmaxime sein.
kennen unterschiedliche Formen und Dimensionen von Zivilcourage.
Im Sinne der Sekundärprävention muss insbesondere auch daran gedacht werden, den Lehrkräften an den Schulen konkrete Anregungen und Hilfestellungen für den Ernstfall an die Hand zu geben.
Manchmal fehlt das Wissen, wie sinnvoll geholfen werden kann.
Im schulischen Bereich werden dazu einzelne Schüler zu Konfliktlotsen ausgebildet, man spricht in diesem Falle von einer Peermediation.
Non-helping-bystander-Effekt Die kompletten Hintergrundinformationen zum Herunterladen : Umgang mit Gewalt (Hintergrundinformationen) Lehrmaterialien Zivilcourage Alle Unterrichtsmaterialien, Format : ZIP Dateigröße : 2093 KB Folie 1 : Zivilcourage- was ist das?
Vorurteile Rassismus und Fremdenfeindlichkeit basieren auf Vorurteilen, die rein rational nur schwer abzubauen sind.
Würzburger Bündnis für Zivilcourage Gegen Diskriminierung und persönliche Angriffe im Alltag, Website mit Tipps zum richtigen Verhalten in Bedrohungssituationen.
Couragiert Magazin für demokratisches Handeln und Zivilcourage.
einen daraus resultierenden Konflikt mit anderen;.
Im Moment umfasst die Arbeit von Kisko drei Bereiche : Trainings für ganze Schulklassen, Lehrerfortbildung zum „Umgang mit Konflikten“ und die Ausbildung von Schülern als Streitschlichter an einer Schule.
Das Fehlen von Regeln begünstigt die Entstehung von Gewalt, schon bestehende Regeln werden oft als aufgezwungen empfunden.
Die Regeln sind nicht mehr nur auferlegt, werden durch die Unterschrift verbindlicher erlebt und besser mitgetragen.
Die Menschen im System Schule sind betroffen und handeln aus diesem Gefühl heraus.
Denn „Es gibt keine normale Reaktion auf Unnormales“ Im Gespräch stehen Akzeptanz, Zuhören und kleine Gesten an erster Stelle.
Kooperation und Kommunikation Der kleinste Teil der Gewalt an Schulen ist ``hausgemacht'' und deswegen müssen sich Erfolg versprechende Präventiv-maßnahmen auch auf den außerschulischen Bereich, etwa im Rahmen von Projektwochen erstrecken.
Beispiele für mögliche Krisensituationen in der Schule : Im unmittelbaren beruflichen Umfeld auftretende plötzliche Konfrontation mit Tod, lebensgefährlichen Krankheiten, sexueller und körperlicher Gewalt, Katastrophen, Unfallszenarien etc. wie z.
B. bei Ansteckungsbefürchtung (vgl. die Meningitis -Panik in Niederbayem) Sexualmördern (Epfach, Wilhermsdorf), Amokläufen (Freising) Gewalteskalationen gegen Lehrer (Metten, Erfurt) Suicidversuche bei Schülern und Lehrern Nicht alle Krisensituationen sind deckungsgleich mit mehr oder weniger gewaltsamen Akten, Konflikten oder Streitgeschehnissen bzw. deren Folgen.
Teilnehmer erhalten das Lehrerhandbuch ``Erwachsen werden'' mit Unterrichtsmaterialien zur Stärkung der Schülerpersönlichkeit.
Grundsätzlich lassen sich präventive und intervenierende Handlungsmöglichkeiten unterscheiden.
Wie können Gewalttaten und Übergriffe verhindert oder beendet werden und welche Hilfe brauchen die Opfer?
Sie sind bereit zu helfen, wenn jemand anderes den ersten Schritt macht oder sie persönlich angesprochen werden."
