11,,,,,,,0.83969,0.72229,0.55318,23,467,"Gewalt in der Schule, die von den Medien gerne auf das Versagen der Lehrerschaft zurückgeführt wird, ist nach Meinung des Bildungsforschers Klaus Hurrelmann ``Teil der sozialen Krankheit unserer Gesellschaft''.
Mittlerweile existieren gezielte Trainingsprogramme, mit denen solche Situationen, vor allem in den Klassen neun bis zehn, bewältigt werden können.
Zur Zeit sind viele Schulen dabei, über gezielte Trainingsprogramme Schülerinnen und Schüler, insbesondere der Klassen neun und zehn, zu befähigen, Streitigkeiten unter sich selbstverantwortlich zu regeln.
entwickeln eine positive Streitkultur Didaktisch-methodischer Kommentar Ob klassische Prügelei auf dem Schulhof, Drangsalieren an der Bushaltestelle oder fiese Kommentare im Klassenzimmer- aggressives Verhalten ist auch in der Schule allgegenwärtig.
Und deshalb steht für die Vermittler, die Mediatoren, am Anfang das Training : Aktives Zuhören, sicheres Auftreten, Gerechtigkeitssinn, Erkennen von Stimmungen, Eingehen auf Gefühle der Streithähne, Gesprächsführung.
Jede Konfliktsituation ist von konkreten und situativen Faktoren geprägt; sie ist – trotz ähnlicher Grundmuster – einmaliger Natur.
Für die Sekundarstufe I (zehn- bis 16-Jährige) ist es sicherlich günstig mit einem Fallbeispiel zu beginnen, wenn es sich anbietet, auch aus dem eigenen (schulischen) Umfeld.
Aber das Programm strahlt vieles aus : Engagement und Zivilcourage ``machen Schule'' und das Verhältnis Schüler-Lehrer entwickelt sich.
Dabei sind Konflikte grundsätzlich nichts Negatives, schließlich sind sie Anlass und Möglichkeit, andere Meinungen wahrzunehmen, Anschauungen zu überdenken und das eigene Tun zu verändern.
Aber immer häufiger werden sie unterdrückt oder mit Gewalt beantwortet, statt offen ausgesprochen.
Nolting/Paulus (Pädagogische Psychologie,1993, S. 319- 330) schlagen als Vorgehensweise bei aggressiven Handlungen im schulischen Kontext vor : 1.
Hemmung eines unerwünschten Verhaltens 2.
Angebot von positiven Anregern 4.
Handlungsmöglichkeiten entwickeln, die eine Alternative zu Gewalt darstellen, 4. die Bildung von Netzwerken fördern, die Hilfen für Betroffene anbieten.
Schüler/-innen können sich dort zu Streitschlichtern ausbilden lassen und vermitteln dann bei Konflikten zwischen Mitschülern.
Grundsätzlich lassen sich präventive und intervenierende Handlungsmöglichkeiten unterscheiden.
Erprobt verschiedene Verhaltensweisen im Rollenspiel und beobachtet die jeweiligen Reaktionen.
Außerdem sollen die bereits vorhandenen Methoden der Gesprächsführung erweitert werden und bei der Durchsetzung wichtiger Anliegen Fairness geübt werden.
September 2002 Die Unterrichtseinheit ``Bleib' COOL ohne Gewalt!
Streitschlichtungs-Programm Streitschlichten will gelernt sein.
sind in der Lage, Situationen ab- und Risiken einzuschätzen.
April 2003 Präsentation der Kampagne bei der Bildungsmesse in Nürnberg.
Es sollen Störungen, die im Unterricht auftreten, sowie extreme Unterrichtsstile vermindert werden.
Bei der Mediation handelt es sich um eine Vermittlung in Konflikten durch unparteiische Dritte.
Im schulischen Bereich werden dazu einzelne Schüler zu Konfliktlotsen ausgebildet, man spricht in diesem Falle von einer Peermediation.
Dafür werden meist beliebte Schüler wie Schüler- oder Klassensprecher ausgewählt.
Diese erhalten eine Sprechzeit während einer Unterrichtsstunde und einen eigenen Mediationsraum.
In der Pause gibt es bestimmte Plätze, wo man Mediatoren als Ansprechpartner finden kann.
Der Mediationsprozess lässt sich in drei verschiedene Phasen einteilen : Die Vorphase : Die Konfliktparteien sollen an einen Tisch kommen.
Das Mediationsgespräch unterteilt sich wiederum in 5 Phasen : 1.
Die Betroffenen sollen beide als Sieger aus dem Konflikt herausgehen.
Verantwortung übernehmen Gewaltbereitschaft entsteht auf dem Boden von übermäßiger Frustration und einem Ohnmachtsgefühl.
Die Übertragung von Verantwortung an SchülerInnen und deren Beteiligung im Sinne der inneren Schulentwicklung ist eine tragende Säule der Gewaltprävention.
Der Wille zur Mitgestaltung des Lernumfelds ist häufiger anzutreffen, als vermutet.
Die Programme sind als schnelle Intervention für akute Konflikte in Schulklassen gedacht.
Die Finanzierung muss durch die besagte Schule erfolgen.
Das Fehlen von Regeln begünstigt die Entstehung von Gewalt, schon bestehende Regeln werden oft als aufgezwungen empfunden.
Die Regeln sind nicht mehr nur auferlegt, werden durch die Unterschrift verbindlicher erlebt und besser mitgetragen.
Eine Schülerin wird von einem Lehrer ungerecht behandelt.
Kooperation und Kommunikation Der kleinste Teil der Gewalt an Schulen ist ``hausgemacht'' und deswegen müssen sich Erfolg versprechende Präventiv-maßnahmen auch auf den außerschulischen Bereich, etwa im Rahmen von Projektwochen erstrecken.
Eine verbesserte Kommunikation wird möglich über das Erlernen bestimmter Techniken.
Stichwörter sind hier Mediation, Streitschlichtung (peers) und interkulturelle Sensibilisierung.
An vielen Arbeitsplätzen sind Übergriffe und Drohungen bis hin zur körperlichen und sogar Waffengewalt eine reale Gefahr.
Kinder und Jugendliche für das Thema Gewalt sensibilisieren, 2. die konstruktive Konfliktfähigkeit von Jugendlichen fördern, 3.
erfahren, dass Opfer ein Recht auf Schutz und Hilfe haben Methodenkompetenz Die Schülerinnen und Schüler.
Ein Schüler wird Mobbing-Opfer einer Clique in der Klasse..",0.89535,0.82005,0.48929,55,549,"Kinder, die sich mit der Ideologie ihrer Eltern identifizieren, verarbeiten politische Gewalt besser als andere (Punamaki, 1996).
Krise kommt aus dem Griechischem Krisis und bedeutet Entscheidung bzw. entscheidende Wendung.
Unter Krise versteht man eine vorübergehende Instabilität eines Individuums oder eines sozialen Systems.
Es wird davon ausgegangen, das Jungen physisch aggressiver sind und Mädchen relational aggressiver.
Typische Symptome sind : Stress, Labilität, Desorganisation, Angst, Lähmung, Chaos, Hilflosigkeit, drohender Kollaps.
Rough and tumble play sind Raufereien an der Grenze zwischen Spaß und Ernst z.
Diese gelten jedoch als prosoziales Verhalten (Oswald), wo nur bestimmte Grenzen ausgetestet werden.
Nach der Shell-Studie Jugend '97 sehen 45,3 % der Jugendlichen Arbeitslosigkeit als Hauptproblem.
Die Häufung von Tätern an Schulformen, die schlechte berufliche Chancen wahrscheinlich machen, bestätigt diese Ergebnisse.
Oft sind es leider die Eltern, die Kindern und Jugendlichen raten, dass es immer besser ist, sich herauszuhalten.
Er führte aus, dass das Fernsehen zu „ einer weltweiten Kultur der Gewalt beiträgt.“ Ein Phänomen liege darin, dass junge Menschen, die Möglichkeit sehen als „Massenmörder berühmt zu werden“ (Fall Mehmet).
Über Risikobereiche der neuen Medien äußert sich Groebel folgendermaßen : Es finde eine Kultivierung von extremster Gewalt statt.
Zivilcourage ist kein abhakbares, überprüfbares Lernziel.
IMAGINATION Der Leugnungsmechanismus hilft Kinder sich zu distanzieren und somit mit der Situation fertig zu werden (Itzkowitz, 1994).
Es ist daher notwendig, dass sich die Pädagogen selbst, besser noch das Kollegium als Ganzes, mit der eigenen „Befindlichkeit“ bezüglich der miterlebten Katastrophe beschäftigten.
Erst im Anschluss an eine solche „Selbstklärung“ sollten die mit den Schülern vertrauten Lehrkräfte pädagogisch mit den Klassen arbeiten – und zwar auf gleiche Weise wie sie es selbst praktiziert haben.
Es darf keine Gewinner und Verlierer geben.
Zur Zeit sind viele Schulen dabei, über gezielte Trainingsprogramme Schülerinnen und Schüler, insbesondere der Klassen neun und zehn, zu befähigen, Streitigkeiten unter sich selbstverantwortlich zu regeln.
Anregungen für Schulen zur fachlich-professionellen Vorbereitung auf künftige Katastrophenfälle : KRISEN-MANAGEMENT Präventionsmaßnahmen für mögliche Ereignisse Jede Katastrophe, ob global oder individuell, löst Schock und Versteinerung aus.
Damit an Schulen bei Krisenereignissen professionell – pädagogisch gehandelt werden kann, ist es erforderlich, bereits weit im Vorfeld entsprechende Planungen zu treffen, um im Ernstfall nur noch Checklisten abfragen zu müssen, wie man zu handeln hat.
Dabei sind Konflikte grundsätzlich nichts Negatives, schließlich sind sie Anlass und Möglichkeit, andere Meinungen wahrzunehmen, Anschauungen zu überdenken und das eigene Tun zu verändern.
Man unterscheidet zwischen Gruppen- und Einzelsupervision.
Sie schaffen es das Interesse der gesamten Klasse auf sich zu konzentrieren und verfügen über ein Bewegungsmanagement, das heißt, Dynamik und nicht Statik beherrschen den Unterrichtsstil.
In Ansätzen wird dabei auch ``Körpersprache'' einbezogen und in Übungshandeln erprobt, wie man auch auf diese Weise locker bleibt oder erfolgreich schlichten kann.
Grundsätzlich lassen sich präventive und intervenierende Handlungsmöglichkeiten unterscheiden.
Harald ACKERSCHOTT AZ-Interview am 14.9.01 Präventions-Maßnahmen für mögliche Ereignisse Prävention gliedert sich in Primär-, Sekundär- und Tertiärprävention.
Konkret bedeutet Primärprävention hier Friedenserziehung, Erziehung zu Toleranz und Rücksichtnahme, die Stärkung kommunikativer und sozialer Kompetenzen sowie Interesse für die individuellen Bedürfnisse anderer.
Neben persönlichem Mut gehört zur Zivilcourage der Einsatz für Humanität und Demokratie sowie die Bereitschaft zur friedlichen Konfliktaustragung.
Nicht falsch verstandenes Heldentum, sondern zivilgesellschaftlicher Einsatz mit kalkulierbarem Risiko, sollte dabei die Handlungsmaxime sein.
Streitschlichtungs-Programm Streitschlichten will gelernt sein.
Der gesamte Rahmen wird nicht von den Regularien und formalisierten Verfahren eines Prozesses, sondern von einer Gesprächssituation geprägt.
Die Begegnung mit dem Opfer macht dem Täter drastisch klar, was er angerichtet hat.
4.4 Supervision Supervision heißt über berufsbezogene Probleme nachzudenken.
Bei der Mediation handelt es sich um eine Vermittlung in Konflikten durch unparteiische Dritte.
In der aktuellen Debatte zum Rechtsextremismus taucht auch die Forderung nach Maßnahmen in der Schule auf.
Die Strafe handeln Täter und Opfer aus; das geht mehr unter die Haut als ein Gerichtsurteil.
Nach einem bedrohenden oder schockierenden Ereignis müssen jene Menschen besonders betreut werden, bei denen dieser Vorfall akute seelische Belastungen hervorgerufen hat.
Es bedarf Mitmenschen, die ruhig bleiben und die Übersicht wahren und gleichzeitig fähig sind, die individuellen Bedürfnisse der Betroffenen wahr zu nehmen und gegebenenfalls auch zu erfüllen.
Krisenintervention hat weniger therapeutische Ambitionen, sie trachtet also nicht nach einer Modifizierung der Persönlichkeit.
Und wenn keine Regelung zustande kommt, führt kein Weg an einem gerichtlichen Verfahren vorbei.
Der Schwerpunkt liegt auf der Handlungskomponente – womit die Zivilcourage in den Vordergrund rückt – für die allerdings Übungen und Reflexionen unabdingbar und auch Grundkenntnisse und Sensibilisierungen erforderlich sind.
Das Fehlen von Regeln begünstigt die Entstehung von Gewalt, schon bestehende Regeln werden oft als aufgezwungen empfunden.
Einführung Das unfassbare Massaker am 26. April 2002 in Erfurt und die Terroranschläge vom 11.
2001 auf die Vereinigten Staaten von Amerika haben unvorhergesehene Auswirkungen auf die gesamte Welt und bedrohen für alle schmerzlich den Frieden und unsere Zukunft.
Dass es funktioniert, zeigen Erfolgsberichte von Schulen, wie z.
Krisen können sich auch aus einer Zuspitzung längerer konflikthafter Prozesse ergeben, brechen aber in ihrer traumatisch-massiven Eindrücklichkeit unerwartet und unvorbereitet auf die Betroffenen herein : Sie schlagen ein wie der Blitz aus heiterem Himmel.
Menschen und auch Institutionen brauchen in Krisensituationen Unterstützung.
Der Begriff Krisenmanagement bezeichnet das bewusste, aktive sich Kümmern um Menschen und um Einrichtungen und deren Mitglieder.
Das wäre ein Grund, das Viergespann der Kardinaltugenden einzuführen und mit Beispielen zu belegen, um zu verdeutlichen, dass Tugenden nicht isoliert, sondern nur im Verbund zur Anwendung kommen können.
Wie reagieren Kinder und Jugendliche auf Krisensituationen Je kleiner Kinder sind, desto weniger reagieren sie emotional auf Vorkommnisse, die sie nicht selbst erlebt haben.
Zudem basiert Zivilcourage auf persönlichen Entscheidungen und kann nicht vorgeschrieben werden.
Pubertäre Rachephantasien als Reaktion auf ständige Demütigungen durch andere Schüler in Verbindung mit waffengeilen Bedürfnissen, neonazistischen Ideen und aufputschender Musik der Neonaziband Ramstein, an deren Texten sie sich berauschten, machten aus Opfern brutale Täter.“ (Weiß S.88) Auch bei uns lassen sie derartige Fälle finden wie die Beispielliste nach Weiß (S. 92) zeigt : 28.
Ablaufmodell zur Krisenverarbeitung Wenn aus dem gewohnten Alltag heraus das dramatische und erschütternde Ereignis passiert, lassen sich immer wieder folgende, spiralförmig ablaufende Muster der Krisenverarbeitung erkennen : 5.
Junge Leute, die um die Gefahr wissen und auf etwaige Übergriffe vorbereitet sind, haben bessere Chancen, Gewalttaten vorzubeugen oder sie zu stoppen."
