8,0.85045,0.75794,0.4822,62,363,"Die Analysen zeigen, dass im Zusammenspiel mit der regionalen Bevölkerungsentwicklung und der dortigen Wirtschaftsstruktur die Arbeitsmarktsituation von hohen Arbeitskräfteengpässen bis zu hohen Überhängen an Arbeitskräften reichen kann.
Mit dem neuen Berufsbildungsgesetz werden Zusatzqualifikationen, die über das in Ausbildungsordnungen Festgelegte hinaus vermittelt werden, als eigenständige, gesondert zu prüfende und zu zertifizierende Qualifikationen eingeführt.
Damit wird es auch möglich, Teile einer Aufstiegsfortbildung bereits während der Erstausbildung zu absolvieren.
Ergebnisse des BIBB-Expertenmonitors Mit der zunehmenden Anzahl unbesetzter Ausbildungsplätze hat sich die Forderung nach mehr Durchlässigkeit im Bildungssystem auf die Frage ausgeweitet, wie sich Studienaussteiger/-innen für eine duale Ausbildung gewinnen lassen.
Abstract anzeigen Abstract ausblenden Hemkes, Barbara; Wilbers, Karl; Zinke, Gert Brücken zwischen Hochschule und Berufsbildung durch bereichsübergreifende Bildungsgänge (aus) bauen Am Beispiel der IT-Berufe wird deutlich, dass einem steigenden Fachkräftebedarf nicht allein durch mehr hochschulische Bildungsabschlüsse begegnet werden kann, sondern differenzierte Kompetenzprofile erforderlich sind.
Gefragt sind zusätzliche Optionen, die Elemente akademischer und beruflicher Bildung integrieren und dabei reziproke Übergänge zwischen den Bildungsbereichen ermöglichen.
Das Aufstiegsstipendium soll es jungen Frauen und Männer, die sich in ihrem Beruf ganz besonders engagieren, finanziell ermöglichen, ein Studium an einer Hochschule zu beginnen.
INFO Für Studierende im Vollzeitstudium beträgt das Stipendium monatlich 750 Euro.
Zusätzlich wird eine Betreuungspauschale für Kinder gewährt.
Die Förderung erfolgt einkommensunabhängig und für die gesamte Dauer des Studiums.
Studierende in einem berufsbegleitenden Studiengang erhalten jährlich 2.000 Euro.
Mit dem Aufstiegsstipendium wird ein Erststudium in Vollzeit oder berufsbegleitend an einer staatlichen oder staatlich anerkannten Hochschule gefördert.
Das Aufstiegsstipendium ist das einzige akademische Begabtenförderungsprogramm für Menschen mit Berufserfahrung.
Es wurde vom Bundesministerium für Bildung und Forschung im Jahr 2008 eingeführt.
Fast 7.000 Menschen haben inzwischen ein Aufstiegsstipendium erhalten.
Durch gezielte Innovationen wird das System der beruflichen Bildung auch in Zukunft seinen Beitrag zum nachhaltigen Wandel der Arbeitswelten wie auch der Gesellschaft insgesamt leisten.
Hauptmenü Reform der Berufsbildung Das zum 1. April 2005 in Kraft getretene Berufsbildungsreformgesetz zielt darauf ab, die Ausbildungschancen zu sichern und zu verbessern und eine hohe Qualität der beruflichen Ausbildung für alle jungen Menschen zu gewährleisten- unabhängig von ihrer sozialen oder regionalen Herkunft.
Die modernisierte Ausbildungsordnung, die erhöhte Qualitäts- und Umweltanforderungen berücksichtigt, tritt am 1. August in Kraft.
Das mit dem Berufsbildungsreformgesetz im Jahr 2005 vollständig novellierte Berufsbildungsgesetz (BBiG) schafft hierfür den rechtlichen Rahmen.
Dieses Ziel in ganz Deutschland zu erreichen, ist Aufgabe des Bundes, nicht zuletzt, um Innovations- und Wettbewerbsfähigkeit der Wirtschaft mit gut ausgebildeten Nachwuchskräften zu sichern.
Die ``anerkannten Ausbildungsberufe'' bilden die Grundlage für die Berufsausbildung im Dualen System.
Ein Teil der Jugendlichen nimmt nach der Schule eine der Maßnahmen der Bundesagentur für Arbeit oder aus anderen Sonderprogrammen wahr.
Mit dem neuen Berufsbildungsrecht wird nun die Anrechnung der in diesen Maßnahmen erworbenen Qualifikationen auf eine sich anschließende Ausbildungszeit erleichtert.
Dazu gibt das neue Berufsbildungsrecht den Verantwortlichen im Bund, in den Ländern und in den Regionen mehr Handlungsspielräume.
Editorial Berufsbildung in Zahlen Wenzelmann, Felix; Schönfeld, Gudrun Betriebliche Ausbildungskosten und -organisation im Verlauf der Ausbildung (PDF) Die meisten Betriebe, die Jugendliche ausbilden, tragen zunächst Kosten und sehen die Ausbildung vor allem als Investition in die Qualifizierung zukünftiger Fachkräfte.
Durch diese neuen Kombinationen von Betrieb und beruflicher Schule kann ein regionaler Mangel an betrieblichen Ausbildungsplätzen ausgeglichen werden; Betrieben, die bisher nicht ausbilden, der Einstieg in die Berufsausbildung erleichtert werden; neuer Qualifizierungsbedarf, zum Beispiel in neu entstehenden Branchen und für neue Berufstätigkeiten, auch dann gedeckt werden, wenn die betrieblichen Ausbildungskapazitäten noch nicht ausreichen; auf den in vielen Ausbildungsberufen steigenden Theorieanteil angemessener reagiert werden.
Im Jahr 2014 entschieden sich zudem erstmalig mehr Schulabsolventinnen und -absolventen für ein Studium als für eine Berufsausbildung.",0.61233,0.4646,0.31402,9,139,"Die Neuregelung tritt zum 1. August in Kraft.
Die Berufsausbildung zukunftssicher machen Neue Förderrunde des Programms JOBSTARTER plus / Wanka : ``Wir wollen besonders kleine und mittelgroße Betriebe unterstützen'' Das Bundesministerium für Bildung und Forschung (BMBF) fördert neue Projekte, um das System der dualen Berufsausbildung zu stärken.
Bundesbildungsministerin Johanna Wanka sagte ``Wir wollen die duale Berufsausbildung zukunftssicher und attraktiver machen.
Ausbildung in Automatenwirtschaft modernisiert Für die vielen Automaten, die unser tägliches Leben begleiten, braucht es zeitgemäß ausgebildete Fachleute.
Ziel der Reform ist die Sicherung und Verbesserung der Ausbildungschancen der Jugend sowie einer hohen Qualität der beruflichen Ausbildung für alle jungen Menschen- unabhängig von ihrer sozialen oder regionalen Herkunft.
Innovation durch Vernetzung Mit dem neuen Berufsbildungsgesetz werden Ausbildungsabschnitte im Ausland erstmals zu einem gleichwertigen Teil einer anerkannten Berufsausbildung im dualen System.
Zudem wird im neuen Berufsbildungsgesetz mit einer modifizierte Stufenausbildungsregelung mit der ausdrücklich verankerten Möglichkeit, einschlägige Vorqualifikationen berufsspezifisch anzurechnen die Fortsetzung zweijähriger Berufsausbildungen in anspruchsvolleren Ausbildungsberufen ohne Zeitverlust erleichtert.
Hierfür sind Erkenntnisse über die Interessenlage und mögliche Vorbehalte aufseiten von Betrieben und Studienaussteigerinnen und -aussteigern hilfreich.
Das neue Berufsbildungsgesetz eröffnet den Ländern die Möglichkeit, sicher zu stellen, dass schulische Berufsausbildungszeiten in anerkannten Ausbildungsberufen genauso zählen wie betriebliche Ausbildungszeiten.",0.89294,0.84166,0.61916,2,515,"Vorschläge für modernisierte und neue Berufe für qualifizierte Fachkräfte, die zusätzliche Ausbildungsmöglichkeiten erschließen und gute Beschäftigungsperspektiven eröffnen, werden in der Regel innerhalb eines Jahres umgesetzt.
Abstract anzeigen Abstract ausblenden Freitag, Walburga Katharina Verbesserung der Durchlässigkeit in die Hochschule durch Anrechnung und Übergangsmaßnahmen Impulse aus den BMBF-Initiativen ANKOM In den Jahren 2005 bis 2009 sowie 2011 bis 2014 wurden unter dem Akronym ANKOM auf der Grundlage von zwei Förderlinien insgesamt 31 Entwicklungsprojekte vom Bundesministerium für Bildung und Forschung (BMBF) mit dem Ziel gefördert, die Durchlässigkeit zwischen der beruflichen und hochschulischen Bildung zu analysieren und zu erhöhen.
Abstract anzeigen Abstract ausblenden van Nahl, Andreas Aufstiegsstipendium : Studienförderung für Fachkräfte mit Berufsausbildung Das Aufstiegsstipendium des BMBF hat unter den Studienförderungen eine besondere Zielgruppe : Es richtet sich an beruflich qualifizierte Fachkräfte und unterstützt ein Hochschulstudium bis zu einem ersten akademischen Abschluss.
Abstract anzeigen Abstract ausblenden Hemkes, Barbara; Wilbers, Karl; Zinke, Gert Brücken zwischen Hochschule und Berufsbildung durch bereichsübergreifende Bildungsgänge (aus) bauen Am Beispiel der IT-Berufe wird deutlich, dass einem steigenden Fachkräftebedarf nicht allein durch mehr hochschulische Bildungsabschlüsse begegnet werden kann, sondern differenzierte Kompetenzprofile erforderlich sind.
Durch die Kopplung von Kompetenzerwerb in hochschulischen und betriebspraktischen Kontexten soll der Lerntransfer unterstützt und damit ein Vorteil gegenüber rein akademischen oder rein berufspraktischen Ausbildungsformen erreicht werden.
Allerdings fehlen eindeutige Kriterien, anhand derer sich diese Dualität beschreiben lässt.
Ziel der Förderung im Rahmen des Programms JOBSTARTER plus ist es, regionale Ausbildungsstrukturen und den Übergang von der Schule in die Ausbildung zu verbessern.
Die Lebenszeit der Jugendlichen, Ressourcen und Fähigkeiten werden auf diese Weise vergeudet.
Ein erheblicher Teil dieser Jugendlichen schließt deshalb an die schulische Berufsausbildung noch einmal eine duale Berufsausbildung an.
Hauptmenü Das Aufstiegsstipendium Mit Berufserfahrung an die Hochschule : Die Aufstiegsstipendien des Bundesministeriums für Bildung und Forschung richten sich an besonders motivierte Berufstätige, die sich mit einem Hochschulstudium beruflich und persönlich weiterentwickeln möchten.
Betriebe setzen auf reifere Bewerber für ihre Ausbildungsplätze Altbewerber mit absolvierter berufvorbereitender Maßnahme haben oft bessere Chancen auf einen Ausbildungsplatz als Schulabgänger Auch zwei Jahre nach dem Schulabschluss haben Bewerberinnen und Bewerber gute Chancen auf einen Ausbildungsplatz- insbesondere dann, wenn sie sich in dieser Zeit über eine berufsvorbereitende Maßnahme im Übergangssystem weiterqualifiziert haben.
Die Aufstiegsstipendien ergänzen die bestehende Begabtenförderung in der beruflichen Bildung und im Hochschulbereich.
Mit dem Aufstiegsstipendium wird ein Erststudium in Vollzeit oder berufsbegleitend an einer staatlichen oder staatlich anerkannten Hochschule gefördert.
Das Aufstiegsstipendium ist das einzige akademische Begabtenförderungsprogramm für Menschen mit Berufserfahrung.
mehr Fachkräfte, die sich fortbilden und einen staatlich anerkannten Abschluss machen, steigen öfter auf der Karriereleiter nach oben.
Meister und Techniker erwerben mit der Aufstiegsfortbildung zudem die Berechtigung, an jeder Hochschule das Fach ihrer Wahl zu studieren.
Das duale System der beruflichen Bildung bietet allen jungen Menschen die Chance, eine qualifizierte Beschäftigung aufzunehmen und damit ihr Leben selbstverantwortlich zu bestimmen.
Mit dem DQR wird auf nationaler Ebene eine Empfehlung des Europäischen Parlaments und des Rates vom April 2008 zur Einrichtung eines Europäischen Qualifikationsrahmens (EQR) für lebenslanges Lernen umgesetzt.
Hauptmenü Reform der Berufsbildung Das zum 1. April 2005 in Kraft getretene Berufsbildungsreformgesetz zielt darauf ab, die Ausbildungschancen zu sichern und zu verbessern und eine hohe Qualität der beruflichen Ausbildung für alle jungen Menschen zu gewährleisten- unabhängig von ihrer sozialen oder regionalen Herkunft.
Start ins neue Ausbildungsjahr mit 17 modernisierten Ausbildungsberufen Vom ``Automatenfachmann'' bis zum ``Werksteinhersteller''- mit 17 modernisierten dualen Ausbildungsberufen beginnt am 1. August das neue Ausbildungsjahr.
Gleichzeitig sichert das System den Fachkräftebedarf der Zukunft und trägt damit entscheidend zur Wettbewerbsfähigkeit und zum Wohlstand Deutschlands bei.
Ausbildungsvergütung DQR- Deutscher Qualifikationsrahmen Der Deutscher Qualifikationsrahmen (DQR) macht Ausbildungsinhalte in Deutschland transparent.
Er ist an den Europäischen Qualifikationsrahmen (EQR) gekoppelt.
Die duale Berufsausbildung in Deutschland wird so im gesamten Anwendungsgebiet des EQR vergleichbar.
BWP Aktuelle Ausgabe : Berufsbildung und Hochschule (BWP 3/2015) Das Verhältnis von Hochschule und Berufsbildung hat sich verändert.
Erstmalig im Jahr 2014 entschieden sich mehr junge Menschen für ein Studium als für eine Berufsausbildung.
Zudem öffnen sich die Hochschulen für neue Zielgruppen.
Die beste Zugangsmöglichkeit zum Arbeitsmarkt bietet auch heute ein Kammerabschlusszeugnis.
Deswegen sieht das neue Berufsbildungsrecht durch eine entsprechende Ermächtigung der Landesregierungen vor, dass Schülerinnen und Schüler einen erleichterten Zugang zur Kammerprüfung erhalten.
Nach der Reform des BBiG können und sollten die schulischen Curricula so verändert werden, dass die Absolventen die Kammerprüfungen bestehen und damit die neu eröffneten Möglichkeiten auch nutzen können.
Eingeführt wurde zusätzlich, dass der Abschluss von Berufsbildungsgängen mit weiterführenden Schulabschlüssen verknüpft werden kann.
Seit 2000 wurden rund 206 modernisierte und 51 neue Berufe in Kraft gesetzt."
9,0.85801,0.76399,0.49646,10,376,"Die Analysen zeigen, dass im Zusammenspiel mit der regionalen Bevölkerungsentwicklung und der dortigen Wirtschaftsstruktur die Arbeitsmarktsituation von hohen Arbeitskräfteengpässen bis zu hohen Überhängen an Arbeitskräften reichen kann.
Mit dem neuen Berufsbildungsgesetz werden Zusatzqualifikationen, die über das in Ausbildungsordnungen Festgelegte hinaus vermittelt werden, als eigenständige, gesondert zu prüfende und zu zertifizierende Qualifikationen eingeführt.
Damit wird es auch möglich, Teile einer Aufstiegsfortbildung bereits während der Erstausbildung zu absolvieren.
Ergebnisse des BIBB-Expertenmonitors Mit der zunehmenden Anzahl unbesetzter Ausbildungsplätze hat sich die Forderung nach mehr Durchlässigkeit im Bildungssystem auf die Frage ausgeweitet, wie sich Studienaussteiger/-innen für eine duale Ausbildung gewinnen lassen.
Abstract anzeigen Abstract ausblenden Hemkes, Barbara; Wilbers, Karl; Zinke, Gert Brücken zwischen Hochschule und Berufsbildung durch bereichsübergreifende Bildungsgänge (aus) bauen Am Beispiel der IT-Berufe wird deutlich, dass einem steigenden Fachkräftebedarf nicht allein durch mehr hochschulische Bildungsabschlüsse begegnet werden kann, sondern differenzierte Kompetenzprofile erforderlich sind.
Gefragt sind zusätzliche Optionen, die Elemente akademischer und beruflicher Bildung integrieren und dabei reziproke Übergänge zwischen den Bildungsbereichen ermöglichen.
Allerdings fehlen eindeutige Kriterien, anhand derer sich diese Dualität beschreiben lässt.
Das Aufstiegsstipendium soll es jungen Frauen und Männer, die sich in ihrem Beruf ganz besonders engagieren, finanziell ermöglichen, ein Studium an einer Hochschule zu beginnen.
INFO Für Studierende im Vollzeitstudium beträgt das Stipendium monatlich 750 Euro.
Zusätzlich wird eine Betreuungspauschale für Kinder gewährt.
Die Förderung erfolgt einkommensunabhängig und für die gesamte Dauer des Studiums.
Studierende in einem berufsbegleitenden Studiengang erhalten jährlich 2.000 Euro.
Mit dem Aufstiegsstipendium wird ein Erststudium in Vollzeit oder berufsbegleitend an einer staatlichen oder staatlich anerkannten Hochschule gefördert.
Das Aufstiegsstipendium ist das einzige akademische Begabtenförderungsprogramm für Menschen mit Berufserfahrung.
Es wurde vom Bundesministerium für Bildung und Forschung im Jahr 2008 eingeführt.
Fast 7.000 Menschen haben inzwischen ein Aufstiegsstipendium erhalten.
Unterstützung hatte sie durch das Aufstiegsstipendium.
Hauptmenü Reform der Berufsbildung Das zum 1. April 2005 in Kraft getretene Berufsbildungsreformgesetz zielt darauf ab, die Ausbildungschancen zu sichern und zu verbessern und eine hohe Qualität der beruflichen Ausbildung für alle jungen Menschen zu gewährleisten- unabhängig von ihrer sozialen oder regionalen Herkunft.
Durch gezielte Innovationen wird das System der beruflichen Bildung auch in Zukunft seinen Beitrag zum nachhaltigen Wandel der Arbeitswelten wie auch der Gesellschaft insgesamt leisten.
Das mit dem Berufsbildungsreformgesetz im Jahr 2005 vollständig novellierte Berufsbildungsgesetz (BBiG) schafft hierfür den rechtlichen Rahmen.
Dieses Ziel in ganz Deutschland zu erreichen, ist Aufgabe des Bundes, nicht zuletzt, um Innovations- und Wettbewerbsfähigkeit der Wirtschaft mit gut ausgebildeten Nachwuchskräften zu sichern.
Die ``anerkannten Ausbildungsberufe'' bilden die Grundlage für die Berufsausbildung im Dualen System.
Ein Teil der Jugendlichen nimmt nach der Schule eine der Maßnahmen der Bundesagentur für Arbeit oder aus anderen Sonderprogrammen wahr.
Mit dem neuen Berufsbildungsrecht wird nun die Anrechnung der in diesen Maßnahmen erworbenen Qualifikationen auf eine sich anschließende Ausbildungszeit erleichtert.
Dazu gibt das neue Berufsbildungsrecht den Verantwortlichen im Bund, in den Ländern und in den Regionen mehr Handlungsspielräume.
Editorial Berufsbildung in Zahlen Wenzelmann, Felix; Schönfeld, Gudrun Betriebliche Ausbildungskosten und -organisation im Verlauf der Ausbildung (PDF) Die meisten Betriebe, die Jugendliche ausbilden, tragen zunächst Kosten und sehen die Ausbildung vor allem als Investition in die Qualifizierung zukünftiger Fachkräfte.
Durch diese neuen Kombinationen von Betrieb und beruflicher Schule kann ein regionaler Mangel an betrieblichen Ausbildungsplätzen ausgeglichen werden; Betrieben, die bisher nicht ausbilden, der Einstieg in die Berufsausbildung erleichtert werden; neuer Qualifizierungsbedarf, zum Beispiel in neu entstehenden Branchen und für neue Berufstätigkeiten, auch dann gedeckt werden, wenn die betrieblichen Ausbildungskapazitäten noch nicht ausreichen; auf den in vielen Ausbildungsberufen steigenden Theorieanteil angemessener reagiert werden.
Im Jahr 2014 entschieden sich zudem erstmalig mehr Schulabsolventinnen und -absolventen für ein Studium als für eine Berufsausbildung.",0.68722,0.54867,0.38451,10,134,"Die Neuregelung tritt zum 1. August in Kraft.
Die Berufsausbildung zukunftssicher machen Neue Förderrunde des Programms JOBSTARTER plus / Wanka : ``Wir wollen besonders kleine und mittelgroße Betriebe unterstützen'' Das Bundesministerium für Bildung und Forschung (BMBF) fördert neue Projekte, um das System der dualen Berufsausbildung zu stärken.
Bundesbildungsministerin Johanna Wanka sagte ``Wir wollen die duale Berufsausbildung zukunftssicher und attraktiver machen.
Zudem wird im neuen Berufsbildungsgesetz mit einer modifizierte Stufenausbildungsregelung mit der ausdrücklich verankerten Möglichkeit, einschlägige Vorqualifikationen berufsspezifisch anzurechnen die Fortsetzung zweijähriger Berufsausbildungen in anspruchsvolleren Ausbildungsberufen ohne Zeitverlust erleichtert.
Ziel der Reform ist die Sicherung und Verbesserung der Ausbildungschancen der Jugend sowie einer hohen Qualität der beruflichen Ausbildung für alle jungen Menschen- unabhängig von ihrer sozialen oder regionalen Herkunft.
Innovation durch Vernetzung Mit dem neuen Berufsbildungsgesetz werden Ausbildungsabschnitte im Ausland erstmals zu einem gleichwertigen Teil einer anerkannten Berufsausbildung im dualen System.
Vincenzo Tutino hat Maschinenbau studiert.
Nach der Reform des BBiG können und sollten die schulischen Curricula so verändert werden, dass die Absolventen die Kammerprüfungen bestehen und damit die neu eröffneten Möglichkeiten auch nutzen können.
Das neue Berufsbildungsgesetz eröffnet den Ländern die Möglichkeit, sicher zu stellen, dass schulische Berufsausbildungszeiten in anerkannten Ausbildungsberufen genauso zählen wie betriebliche Ausbildungszeiten.",,,,,,
