0,0.86254,0.77156,0.56341,0,0,"Die modernisierte Ausbildungsordnung tritt zum 1. August in Kraft.
Die ``anerkannten Ausbildungsberufe'' bilden die Grundlage für die Berufsausbildung im Dualen System.
Editorial Berufsbildung in Zahlen Wenzelmann, Felix; Schönfeld, Gudrun Betriebliche Ausbildungskosten und -organisation im Verlauf der Ausbildung (PDF) Die meisten Betriebe, die Jugendliche ausbilden, tragen zunächst Kosten und sehen die Ausbildung vor allem als Investition in die Qualifizierung zukünftiger Fachkräfte.
Im Jahr 2014 entschieden sich zudem erstmalig mehr Schulabsolventinnen und -absolventen für ein Studium als für eine Berufsausbildung.
Die Analysen zeigen, dass im Zusammenspiel mit der regionalen Bevölkerungsentwicklung und der dortigen Wirtschaftsstruktur die Arbeitsmarktsituation von hohen Arbeitskräfteengpässen bis zu hohen Überhängen an Arbeitskräften reichen kann.
Ergebnisse des BIBB-Expertenmonitors Mit der zunehmenden Anzahl unbesetzter Ausbildungsplätze hat sich die Forderung nach mehr Durchlässigkeit im Bildungssystem auf die Frage ausgeweitet, wie sich Studienaussteiger/-innen für eine duale Ausbildung gewinnen lassen.
Abstract anzeigen Abstract ausblenden Hemkes, Barbara; Wilbers, Karl; Zinke, Gert Brücken zwischen Hochschule und Berufsbildung durch bereichsübergreifende Bildungsgänge (aus) bauen Am Beispiel der IT-Berufe wird deutlich, dass einem steigenden Fachkräftebedarf nicht allein durch mehr hochschulische Bildungsabschlüsse begegnet werden kann, sondern differenzierte Kompetenzprofile erforderlich sind.
Gefragt sind zusätzliche Optionen, die Elemente akademischer und beruflicher Bildung integrieren und dabei reziproke Übergänge zwischen den Bildungsbereichen ermöglichen.
Allerdings fehlen eindeutige Kriterien, anhand derer sich diese Dualität beschreiben lässt.
Hauptmenü Das Aufstiegsstipendium Mit Berufserfahrung an die Hochschule : Die Aufstiegsstipendien des Bundesministeriums für Bildung und Forschung richten sich an besonders motivierte Berufstätige, die sich mit einem Hochschulstudium beruflich und persönlich weiterentwickeln möchten.
Das Aufstiegsstipendium soll es jungen Frauen und Männer, die sich in ihrem Beruf ganz besonders engagieren, finanziell ermöglichen, ein Studium an einer Hochschule zu beginnen.
INFO Für Studierende im Vollzeitstudium beträgt das Stipendium monatlich 750 Euro.
Zusätzlich wird eine Betreuungspauschale für Kinder gewährt.
Die Förderung erfolgt einkommensunabhängig und für die gesamte Dauer des Studiums.
Studierende in einem berufsbegleitenden Studiengang erhalten jährlich 2.000 Euro.
Mit dem Aufstiegsstipendium wird ein Erststudium in Vollzeit oder berufsbegleitend an einer staatlichen oder staatlich anerkannten Hochschule gefördert.
Das Aufstiegsstipendium ist das einzige akademische Begabtenförderungsprogramm für Menschen mit Berufserfahrung.
Fast 7.000 Menschen haben inzwischen ein Aufstiegsstipendium erhalten.
Hauptmenü Reform der Berufsbildung Das zum 1. April 2005 in Kraft getretene Berufsbildungsreformgesetz zielt darauf ab, die Ausbildungschancen zu sichern und zu verbessern und eine hohe Qualität der beruflichen Ausbildung für alle jungen Menschen zu gewährleisten- unabhängig von ihrer sozialen oder regionalen Herkunft.
Durch gezielte Innovationen wird das System der beruflichen Bildung auch in Zukunft seinen Beitrag zum nachhaltigen Wandel der Arbeitswelten wie auch der Gesellschaft insgesamt leisten.
Das mit dem Berufsbildungsreformgesetz im Jahr 2005 vollständig novellierte Berufsbildungsgesetz (BBiG) schafft hierfür den rechtlichen Rahmen.
Dieses Ziel in ganz Deutschland zu erreichen, ist Aufgabe des Bundes, nicht zuletzt, um Innovations- und Wettbewerbsfähigkeit der Wirtschaft mit gut ausgebildeten Nachwuchskräften zu sichern.
Dazu gibt das neue Berufsbildungsrecht den Verantwortlichen im Bund, in den Ländern und in den Regionen mehr Handlungsspielräume.
Ein Teil der Jugendlichen nimmt nach der Schule eine der Maßnahmen der Bundesagentur für Arbeit oder aus anderen Sonderprogrammen wahr.
Mit dem neuen Berufsbildungsrecht wird nun die Anrechnung der in diesen Maßnahmen erworbenen Qualifikationen auf eine sich anschließende Ausbildungszeit erleichtert.
Durch diese neuen Kombinationen von Betrieb und beruflicher Schule kann ein regionaler Mangel an betrieblichen Ausbildungsplätzen ausgeglichen werden; Betrieben, die bisher nicht ausbilden, der Einstieg in die Berufsausbildung erleichtert werden; neuer Qualifizierungsbedarf, zum Beispiel in neu entstehenden Branchen und für neue Berufstätigkeiten, auch dann gedeckt werden, wenn die betrieblichen Ausbildungskapazitäten noch nicht ausreichen; auf den in vielen Ausbildungsberufen steigenden Theorieanteil angemessener reagiert werden.
Damit wird es auch möglich, Teile einer Aufstiegsfortbildung bereits während der Erstausbildung zu absolvieren.",0.76652,0.65044,0.47633,0,0,"Bundesbildungsministerin Johanna Wanka sagte ``Wir wollen die duale Berufsausbildung zukunftssicher und attraktiver machen.
Insbesondere kleine und mittelgroße Unternehmen (KMU) wollen wir unterstützen, damit sie weiterhin einen bedeutsamen Beitrag zur dualen Berufsausbildung leisten können.
Ziel der Reform ist die Sicherung und Verbesserung der Ausbildungschancen der Jugend sowie einer hohen Qualität der beruflichen Ausbildung für alle jungen Menschen- unabhängig von ihrer sozialen oder regionalen Herkunft.
Vorteile für Auszubildende Für junge Auszubildende kommt es darauf an, eine gute Berufsausbildung zu bekommen.
Nach der Reform des BBiG können und sollten die schulischen Curricula so verändert werden, dass die Absolventen die Kammerprüfungen bestehen und damit die neu eröffneten Möglichkeiten auch nutzen können.
Eingeführt wurde zusätzlich, dass der Abschluss von Berufsbildungsgängen mit weiterführenden Schulabschlüssen verknüpft werden kann.
Das neue Berufsbildungsgesetz eröffnet den Ländern die Möglichkeit, sicher zu stellen, dass schulische Berufsausbildungszeiten in anerkannten Ausbildungsberufen genauso zählen wie betriebliche Ausbildungszeiten.
Zudem wird im neuen Berufsbildungsgesetz mit einer modifizierte Stufenausbildungsregelung mit der ausdrücklich verankerten Möglichkeit, einschlägige Vorqualifikationen berufsspezifisch anzurechnen die Fortsetzung zweijähriger Berufsausbildungen in anspruchsvolleren Ausbildungsberufen ohne Zeitverlust erleichtert.
Innovation durch Vernetzung Mit dem neuen Berufsbildungsgesetz werden Ausbildungsabschnitte im Ausland erstmals zu einem gleichwertigen Teil einer anerkannten Berufsausbildung im dualen System.",0.89538,0.838,0.55744,0,0,"Ziel der Förderung im Rahmen des Programms JOBSTARTER plus ist es, regionale Ausbildungsstrukturen und den Übergang von der Schule in die Ausbildung zu verbessern.
Betriebe setzen auf reifere Bewerber für ihre Ausbildungsplätze Altbewerber mit absolvierter berufvorbereitender Maßnahme haben oft bessere Chancen auf einen Ausbildungsplatz als Schulabgänger Auch zwei Jahre nach dem Schulabschluss haben Bewerberinnen und Bewerber gute Chancen auf einen Ausbildungsplatz- insbesondere dann, wenn sie sich in dieser Zeit über eine berufsvorbereitende Maßnahme im Übergangssystem weiterqualifiziert haben.
mehr Fachkräfte, die sich fortbilden und einen staatlich anerkannten Abschluss machen, steigen öfter auf der Karriereleiter nach oben.
Meister und Techniker erwerben mit der Aufstiegsfortbildung zudem die Berechtigung, an jeder Hochschule das Fach ihrer Wahl zu studieren.
Mit dem DQR wird auf nationaler Ebene eine Empfehlung des Europäischen Parlaments und des Rates vom April 2008 zur Einrichtung eines Europäischen Qualifikationsrahmens (EQR) für lebenslanges Lernen umgesetzt.
Start ins neue Ausbildungsjahr mit 17 modernisierten Ausbildungsberufen Vom ``Automatenfachmann'' bis zum ``Werksteinhersteller''- mit 17 modernisierten dualen Ausbildungsberufen beginnt am 1. August das neue Ausbildungsjahr.
``Die hohe Zahl modernisierter Berufe zeigt, wie dynamisch und flexibel das duale Ausbildungssystem ist'', so BIBB-Präsident Esser.
Ausbildungsvergütung DQR- Deutscher Qualifikationsrahmen Der Deutscher Qualifikationsrahmen (DQR) macht Ausbildungsinhalte in Deutschland transparent.
Die duale Berufsausbildung in Deutschland wird so im gesamten Anwendungsgebiet des EQR vergleichbar.
Erstmalig im Jahr 2014 entschieden sich mehr junge Menschen für ein Studium als für eine Berufsausbildung.
Zudem öffnen sich die Hochschulen für neue Zielgruppen.
Abstract anzeigen Abstract ausblenden Freitag, Walburga Katharina Verbesserung der Durchlässigkeit in die Hochschule durch Anrechnung und Übergangsmaßnahmen Impulse aus den BMBF-Initiativen ANKOM In den Jahren 2005 bis 2009 sowie 2011 bis 2014 wurden unter dem Akronym ANKOM auf der Grundlage von zwei Förderlinien insgesamt 31 Entwicklungsprojekte vom Bundesministerium für Bildung und Forschung (BMBF) mit dem Ziel gefördert, die Durchlässigkeit zwischen der beruflichen und hochschulischen Bildung zu analysieren und zu erhöhen.
Abstract anzeigen Abstract ausblenden van Nahl, Andreas Aufstiegsstipendium : Studienförderung für Fachkräfte mit Berufsausbildung Das Aufstiegsstipendium des BMBF hat unter den Studienförderungen eine besondere Zielgruppe : Es richtet sich an beruflich qualifizierte Fachkräfte und unterstützt ein Hochschulstudium bis zu einem ersten akademischen Abschluss.
Abstract anzeigen Abstract ausblenden Hemkes, Barbara; Wilbers, Karl; Zinke, Gert Brücken zwischen Hochschule und Berufsbildung durch bereichsübergreifende Bildungsgänge (aus) bauen Am Beispiel der IT-Berufe wird deutlich, dass einem steigenden Fachkräftebedarf nicht allein durch mehr hochschulische Bildungsabschlüsse begegnet werden kann, sondern differenzierte Kompetenzprofile erforderlich sind.
Durch die Kopplung von Kompetenzerwerb in hochschulischen und betriebspraktischen Kontexten soll der Lerntransfer unterstützt und damit ein Vorteil gegenüber rein akademischen oder rein berufspraktischen Ausbildungsformen erreicht werden.
Allerdings fehlen eindeutige Kriterien, anhand derer sich diese Dualität beschreiben lässt.
Hauptmenü Das Aufstiegsstipendium Mit Berufserfahrung an die Hochschule : Die Aufstiegsstipendien des Bundesministeriums für Bildung und Forschung richten sich an besonders motivierte Berufstätige, die sich mit einem Hochschulstudium beruflich und persönlich weiterentwickeln möchten.
Mit dem Aufstiegsstipendium wird ein Erststudium in Vollzeit oder berufsbegleitend an einer staatlichen oder staatlich anerkannten Hochschule gefördert.
Das Aufstiegsstipendium ist das einzige akademische Begabtenförderungsprogramm für Menschen mit Berufserfahrung.
Hauptmenü Reform der Berufsbildung Das zum 1. April 2005 in Kraft getretene Berufsbildungsreformgesetz zielt darauf ab, die Ausbildungschancen zu sichern und zu verbessern und eine hohe Qualität der beruflichen Ausbildung für alle jungen Menschen zu gewährleisten- unabhängig von ihrer sozialen oder regionalen Herkunft.
Das duale System der beruflichen Bildung bietet allen jungen Menschen die Chance, eine qualifizierte Beschäftigung aufzunehmen und damit ihr Leben selbstverantwortlich zu bestimmen.
Gleichzeitig sichert das System den Fachkräftebedarf der Zukunft und trägt damit entscheidend zur Wettbewerbsfähigkeit und zum Wohlstand Deutschlands bei.
Ein erheblicher Teil dieser Jugendlichen schließt deshalb an die schulische Berufsausbildung noch einmal eine duale Berufsausbildung an.
Die Lebenszeit der Jugendlichen, Ressourcen und Fähigkeiten werden auf diese Weise vergeudet.
Die beste Zugangsmöglichkeit zum Arbeitsmarkt bietet auch heute ein Kammerabschlusszeugnis.
Deswegen sieht das neue Berufsbildungsrecht durch eine entsprechende Ermächtigung der Landesregierungen vor, dass Schülerinnen und Schüler einen erleichterten Zugang zur Kammerprüfung erhalten.
Nach der Reform des BBiG können und sollten die schulischen Curricula so verändert werden, dass die Absolventen die Kammerprüfungen bestehen und damit die neu eröffneten Möglichkeiten auch nutzen können.
Eingeführt wurde zusätzlich, dass der Abschluss von Berufsbildungsgängen mit weiterführenden Schulabschlüssen verknüpft werden kann.
Seit 2000 wurden rund 206 modernisierte und 51 neue Berufe in Kraft gesetzt.
Vorschläge für modernisierte und neue Berufe für qualifizierte Fachkräfte, die zusätzliche Ausbildungsmöglichkeiten erschließen und gute Beschäftigungsperspektiven eröffnen, werden in der Regel innerhalb eines Jahres umgesetzt.
Das neue Berufsbildungsgesetz unterstützt die rasche Modernisierung durch Verringerung der gesetzlichen Beratungsgremien : Der Länderausschuss des Bundesinstituts für Berufsbildung wird abgeschafft."
1,0.4577,0.16793,0.19429,0,0,"Aktuelle Nachrichten Donnerstag, 23.07.2015 Kerzenhersteller und Wachsbildner- traditionsreicher Beruf in neuem Licht Modernisierte Ausbildung für die Herstellung von Kerzen, Reliefs und Skulpturen Welche Dochte und Brennmassen wählt man für unterschiedliche Kerzendurchmesser?
Vorschläge für modernisierte und neue Berufe für qualifizierte Fachkräfte, die zusätzliche Ausbildungsmöglichkeiten erschließen und gute Beschäftigungsperspektiven eröffnen, werden in der Regel innerhalb eines Jahres umgesetzt.
Engpässe werden nach den Projektionen auf der qualifikatorischen Ebene in nahezu allen Regionen vor allem im Bereich der mittleren Ausbildungsabschlüsse auftreten, jedoch mit unterschiedlichen Folgen.
In der modernisierten Ausbildungsordnung werden traditionelle Herstellungsverfahren, technologische Weiterentwicklungen sowie die wachsende Bedeutung individueller Kundenanforderungen berücksichtigt.
Es wurde vom Bundesministerium für Bildung und Forschung im Jahr 2008 eingeführt.
Wer keine Chance erhält, nach zweijähriger Ausbildung sofort eine Anschlussausbildung zu beginnen, kann zukünftig bereits nach zweieinhalbjähriger praktischer Berufstätigkeit die Abschlussprüfung in dem anspruchsvolleren Beruf ablegen.
Mit diesen Verknüpfungen von nationaler und internationaler Ausbildung, von Allgemein- und Berufsbildung sowie Aus- und Weiterbildung eröffnen sich konkrete Perspektiven für das berufliche Fortkommen leistungsbereiter junger Menschen.
Gefragt sind zusätzliche Optionen, die Elemente akademischer und beruflicher Bildung integrieren und dabei reziproke Übergänge zwischen den Bildungsbereichen ermöglichen.
Vorteile für Auszubildende Für junge Auszubildende kommt es darauf an, eine gute Berufsausbildung zu bekommen.
Die neu gestaltete Erprobungsklausel eröffnet Wege, die Gestaltung von Ausbildungsberufen an neue Entwicklungen anzupassen, die gegenwärtig noch nicht vorhergesehen werden können.
Ziel der Förderung im Rahmen des Programms JOBSTARTER plus ist es, regionale Ausbildungsstrukturen und den Übergang von der Schule in die Ausbildung zu verbessern.
Bundesbildungsministerin Johanna Wanka sagte ``Wir wollen die duale Berufsausbildung zukunftssicher und attraktiver machen.
Abstract anzeigen Abstract ausblenden Hauptausschuss Spillner, Gunther Bericht über die Sitzung 1/2015 des Hauptausschusses am 13. März 2015 in Bonn (PDF) Der Entwurf des Berufsbildungsberichts 2015 der Bundesregierung war für den Hauptausschuss Anlass, sich intensiv über die aktuelle Ausbildungsplatzsituation zu beraten.
Start ins neue Ausbildungsjahr mit 17 modernisierten Ausbildungsberufen BIBB-Präsident Esser : ``Wirtschaft 4.0 wird Berufsbilder verändern'' Vom ``Automatenfachmann'' bis zum ``Werksteinhersteller''- mit insgesamt 17 modernisierten dualen Ausbildungsberufen beginnt am 1. August offiziell das neue Ausbildungsjahr.
Die Förderung erfolgt einkommensunabhängig und für die gesamte Dauer des Studiums.
IT-Berufe auf dem Prüfstand Das Bundesinstitut für Berufsbildung (BIBB) prüft eine Modernisierung der vier dualen IT-Berufe Fachinformatiker/-in, IT-System-Elektroniker/-in, IT-System-Kaufmann/-frau sowie Informatikkauf-mann/-frau.
Im Schnitt gaben die Deutschen für ihren Haupturlaub knapp 1.100 Euro pro Person aus, davon etwa die Hälfte im Ausland.
Die frei werdenden Mittel könnten nun genutzt werden, um die Kinderbetreuung auszubauen, zum Beispiel mit 24-Stunden-Kitas.
bwp @ ist das Online-Fachjournal für alle an der Berufs- und Wirtschaftspädagogik Interessierten, die schnell, problemlos und kostenlos auf reviewte Inhalte und Diskussionen der Scientific Community zugreifen wollen.
Fundiert, kompetent und verständlich informiert BILDUNGSPRAXIS Berufsbildungsprofis über aktuelle Entwicklungen, den effektiven Einsatz von Lehr- und Lernmitteln und nimmt die spezifischen Anliegen der Ausbilder und Berufsschullehrer in den Blick.
Mit viel Geschick von der Rohhaut zum Leder Aus dem Traditionsberuf ``Gerber/Gerberin'' wird die ``Fachkraft für Lederherstellung und Gerbereitechnik''.
Ausbildung in Automatenwirtschaft modernisiert Für die vielen Automaten, die unser tägliches Leben begleiten, braucht es zeitgemäß ausgebildete Fachleute.
Die vielseitigere, auf alle Automatentypen anwendbare neue Ausbildungsordnung tritt am 1. August in Kraft.
Die ``anerkannten Ausbildungsberufe'' bilden die Grundlage für die Berufsausbildung im Dualen System.
Ausbildungsvergütung DQR- Deutscher Qualifikationsrahmen Der Deutscher Qualifikationsrahmen (DQR) macht Ausbildungsinhalte in Deutschland transparent.
BWP- Berufsbildung in Wissenschaft und Praxis Die BIBB-Fachzeitschrift veröffentlicht wissenschaftliche Erkenntnisse und praktische Erfahrungen zu aktuellen Fragen der Berufsbildung.
Zudem öffnen sich die Hochschulen für neue Zielgruppen.
Eingeführt wurde zusätzlich, dass der Abschluss von Berufsbildungsgängen mit weiterführenden Schulabschlüssen verknüpft werden kann.
Diese Maßnahmen sollen Auszubildende dabei unterstützen, sich besser zu qualifizieren und schneller ihre Ausbildung abschließen zu können.",0.3304,0.10619,0.09286,0,0,"Aktuelle Nachrichten Donnerstag, 23.07.2015 Kerzenhersteller und Wachsbildner- traditionsreicher Beruf in neuem Licht Modernisierte Ausbildung für die Herstellung von Kerzen, Reliefs und Skulpturen Welche Dochte und Brennmassen wählt man für unterschiedliche Kerzendurchmesser?
Bundesbildungsministerin Johanna Wanka sagte ``Wir wollen die duale Berufsausbildung zukunftssicher und attraktiver machen.
Mit viel Geschick von der Rohhaut zum Leder Aus dem Traditionsberuf ``Gerber/Gerberin'' wird die ``Fachkraft für Lederherstellung und Gerbereitechnik''.
In der modernisierten Ausbildungsordnung werden traditionelle Herstellungsverfahren, technologische Weiterentwicklungen sowie die wachsende Bedeutung individueller Kundenanforderungen berücksichtigt.
Es wurde vom Bundesministerium für Bildung und Forschung im Jahr 2008 eingeführt.
Die ``anerkannten Ausbildungsberufe'' bilden die Grundlage für die Berufsausbildung im Dualen System.
Ausbildungsvergütung DQR- Deutscher Qualifikationsrahmen Der Deutscher Qualifikationsrahmen (DQR) macht Ausbildungsinhalte in Deutschland transparent.
Über Analysen, Daten und Impulse zur Weiterentwicklung der beruflichen Bildung informiert der Jahresbericht 2014 des Bundesinstituts für Berufsbildung (BIBB).
Die neue Ausbildungsordnung tritt zum 1. August in Kraft.
Start ins neue Ausbildungsjahr mit 17 modernisierten Ausbildungsberufen Vom ``Automatenfachmann'' bis zum ``Werksteinhersteller''- mit 17 modernisierten dualen Ausbildungsberufen beginnt am 1. August das neue Ausbildungsjahr.
Die Höhe der Kosten und Erträge verändert sich jedoch im Verlauf der Ausbildung.
Eine grundlegende Novellierung dieser vier Berufe war erforderlich, um aktuelle Entwicklungen und moderne Standards aufzugreifen.",0.49878,0.21924,0.22807,0,0,"Aktuelle Nachrichten Donnerstag, 23.07.2015 Kerzenhersteller und Wachsbildner- traditionsreicher Beruf in neuem Licht Modernisierte Ausbildung für die Herstellung von Kerzen, Reliefs und Skulpturen Welche Dochte und Brennmassen wählt man für unterschiedliche Kerzendurchmesser?
Vorschläge für modernisierte und neue Berufe für qualifizierte Fachkräfte, die zusätzliche Ausbildungsmöglichkeiten erschließen und gute Beschäftigungsperspektiven eröffnen, werden in der Regel innerhalb eines Jahres umgesetzt.
Engpässe werden nach den Projektionen auf der qualifikatorischen Ebene in nahezu allen Regionen vor allem im Bereich der mittleren Ausbildungsabschlüsse auftreten, jedoch mit unterschiedlichen Folgen.
In der modernisierten Ausbildungsordnung werden traditionelle Herstellungsverfahren, technologische Weiterentwicklungen sowie die wachsende Bedeutung individueller Kundenanforderungen berücksichtigt.
Start ins neue Ausbildungsjahr mit 17 modernisierten Ausbildungsberufen BIBB-Präsident Esser : ``Wirtschaft 4.0 wird Berufsbilder verändern'' Vom ``Automatenfachmann'' bis zum ``Werksteinhersteller''- mit insgesamt 17 modernisierten dualen Ausbildungsberufen beginnt am 1. August offiziell das neue Ausbildungsjahr.
Wer keine Chance erhält, nach zweijähriger Ausbildung sofort eine Anschlussausbildung zu beginnen, kann zukünftig bereits nach zweieinhalbjähriger praktischer Berufstätigkeit die Abschlussprüfung in dem anspruchsvolleren Beruf ablegen.
Auf Basis der Ergebnisse werden Vorschläge zur Gestaltung von Informations- und Beratungsangeboten an der Schnittstelle von Berufsbildung und Hochschule formuliert.
In Berlin hat Özlem Yetim eine Praxis für Sprachtherapie eröffnet.
Als Reaktion auf steigende Qualifikationsanforderungen in einer globalisierten Welt erhöhen diese Verknüpfungen die Attraktivität der dualen Ausbildung gerade auch für Leistungsstarke.
Gefragt sind zusätzliche Optionen, die Elemente akademischer und beruflicher Bildung integrieren und dabei reziproke Übergänge zwischen den Bildungsbereichen ermöglichen.
Vorteile für Auszubildende Für junge Auszubildende kommt es darauf an, eine gute Berufsausbildung zu bekommen.
Ziel der Förderung im Rahmen des Programms JOBSTARTER plus ist es, regionale Ausbildungsstrukturen und den Übergang von der Schule in die Ausbildung zu verbessern.
Bundesbildungsministerin Johanna Wanka sagte ``Wir wollen die duale Berufsausbildung zukunftssicher und attraktiver machen.
Abstract anzeigen Abstract ausblenden Hauptausschuss Spillner, Gunther Bericht über die Sitzung 1/2015 des Hauptausschusses am 13. März 2015 in Bonn (PDF) Der Entwurf des Berufsbildungsberichts 2015 der Bundesregierung war für den Hauptausschuss Anlass, sich intensiv über die aktuelle Ausbildungsplatzsituation zu beraten.
Die neue Allianz für Aus- und Weiterbildung war ebenfalls Gegenstand der Beratung.
Im Beitrag werden Ergebnisse der ersten regionalspezifischen BIBB-IAB-Qualifikations- und Berufsfeldprojektionen (QuBe-Projekt) vorgestellt.
Was bewirken Inklusion, Internationalisierung und Digitalisierung der Arbeitswelt für die Berufsbildung?
Die berufliche Bildung muss sich unter veränderten Rahmenbedingungen vielfältig bewähren.
IT-Kompetenz für das Ausbildungspersonal BeMeKo-Pilotphase erfolgreich abgeschlossen Am 19. Juni trafen sich die Kooperationspartner des Pilotprojekts ``Berufsbegleitende Medienkompetenzentwicklung für Ausbildungsprofessionals'' (BeMeKo) in den Räumen der Dienstleistungsgesellschaft für Informatik (DLGI) zur Abschlussveranstaltung.
Im Auftrag des Bundesministeriums für Bildung und Forschung führen das Bundesinstitut für Berufsbildung (BIBB) und TNS Infratest eine repräsentative Studie zur Nutzung digitaler Medien in Betrieben in Deutschland durch.
Die Förderung erfolgt einkommensunabhängig und für die gesamte Dauer des Studiums.
Wie können Angebot und Nachfrage in regionalen Ausbildungsmärkten besser zusammenfinden?
Das Aufstiegsstipendium ist das einzige akademische Begabtenförderungsprogramm für Menschen mit Berufserfahrung.
Egal ob Autos von DriveNow, Schlafplätze über Airbnb oder Wissen bei Wikipedia- unter dem Stichwort Sharing Economy werden Ressourcen gemeinsam und damit effizienter genutzt.
Im Schnitt gaben die Deutschen für ihren Haupturlaub knapp 1.100 Euro pro Person aus, davon etwa die Hälfte im Ausland.
Die frei werdenden Mittel könnten nun genutzt werden, um die Kinderbetreuung auszubauen, zum Beispiel mit 24-Stunden-Kitas.
bwp @ ist das Online-Fachjournal für alle an der Berufs- und Wirtschaftspädagogik Interessierten, die schnell, problemlos und kostenlos auf reviewte Inhalte und Diskussionen der Scientific Community zugreifen wollen.
Fundiert, kompetent und verständlich informiert BILDUNGSPRAXIS Berufsbildungsprofis über aktuelle Entwicklungen, den effektiven Einsatz von Lehr- und Lernmitteln und nimmt die spezifischen Anliegen der Ausbilder und Berufsschullehrer in den Blick.
Mit viel Geschick von der Rohhaut zum Leder Aus dem Traditionsberuf ``Gerber/Gerberin'' wird die ``Fachkraft für Lederherstellung und Gerbereitechnik''.
Ausbildung in Automatenwirtschaft modernisiert Für die vielen Automaten, die unser tägliches Leben begleiten, braucht es zeitgemäß ausgebildete Fachleute.
Die vielseitigere, auf alle Automatentypen anwendbare neue Ausbildungsordnung tritt am 1. August in Kraft.
Die ``anerkannten Ausbildungsberufe'' bilden die Grundlage für die Berufsausbildung im Dualen System.
Ausbildungsvergütung DQR- Deutscher Qualifikationsrahmen Der Deutscher Qualifikationsrahmen (DQR) macht Ausbildungsinhalte in Deutschland transparent.
Steigende Studienanfängerzahlen und die Öffnung der Hochschulen für beruflich Qualifizierte verändern das Verhältnis von Hochschule und Berufsbildung.
BWP- Berufsbildung in Wissenschaft und Praxis Die BIBB-Fachzeitschrift veröffentlicht wissenschaftliche Erkenntnisse und praktische Erfahrungen zu aktuellen Fragen der Berufsbildung.
Erstmalig im Jahr 2014 entschieden sich mehr junge Menschen für ein Studium als für eine Berufsausbildung.
Zudem öffnen sich die Hochschulen für neue Zielgruppen.
Eingeführt wurde zusätzlich, dass der Abschluss von Berufsbildungsgängen mit weiterführenden Schulabschlüssen verknüpft werden kann.
Diese Maßnahmen sollen Auszubildende dabei unterstützen, sich besser zu qualifizieren und schneller ihre Ausbildung abschließen zu können."
