2,0.61027,0.38729,0.29124,83,439,"Im Beitrag werden Ergebnisse der ersten regionalspezifischen BIBB-IAB-Qualifikations- und Berufsfeldprojektionen (QuBe-Projekt) vorgestellt.
Engpässe werden nach den Projektionen auf der qualifikatorischen Ebene in nahezu allen Regionen vor allem im Bereich der mittleren Ausbildungsabschlüsse auftreten, jedoch mit unterschiedlichen Folgen.
Als Reaktion auf steigende Qualifikationsanforderungen in einer globalisierten Welt erhöhen diese Verknüpfungen die Attraktivität der dualen Ausbildung gerade auch für Leistungsstarke.
Abstract anzeigen Abstract ausblenden Hemkes, Barbara; Wilbers, Karl; Zinke, Gert Brücken zwischen Hochschule und Berufsbildung durch bereichsübergreifende Bildungsgänge (aus) bauen Am Beispiel der IT-Berufe wird deutlich, dass einem steigenden Fachkräftebedarf nicht allein durch mehr hochschulische Bildungsabschlüsse begegnet werden kann, sondern differenzierte Kompetenzprofile erforderlich sind.
Gefragt sind zusätzliche Optionen, die Elemente akademischer und beruflicher Bildung integrieren und dabei reziproke Übergänge zwischen den Bildungsbereichen ermöglichen.
Ziel der Förderung im Rahmen des Programms JOBSTARTER plus ist es, regionale Ausbildungsstrukturen und den Übergang von der Schule in die Ausbildung zu verbessern.
Zum ersten Mal seit mehr als zehn Jahren verabschiedete der Hauptausschuss eine Gemeinsame Stellungnahme zum Berufsbildungsbericht, ohne diese, wie in den Vorjahren, durch Voten der ``Bänke'' zu ergänzen.
Ausbildungsberufe in der Bekleidungsindustrie im neuen Gewand Wer sorgt eigentlich dafür, dass wir in allen Lebenslagen passend gekleidet sind?
Was bewirken Inklusion, Internationalisierung und Digitalisierung der Arbeitswelt für die Berufsbildung?
Die berufliche Bildung muss sich unter veränderten Rahmenbedingungen vielfältig bewähren.
Hauptmenü Das Aufstiegsstipendium Mit Berufserfahrung an die Hochschule : Die Aufstiegsstipendien des Bundesministeriums für Bildung und Forschung richten sich an besonders motivierte Berufstätige, die sich mit einem Hochschulstudium beruflich und persönlich weiterentwickeln möchten.
Das Aufstiegsstipendium soll es jungen Frauen und Männer, die sich in ihrem Beruf ganz besonders engagieren, finanziell ermöglichen, ein Studium an einer Hochschule zu beginnen.
Die Förderung erfolgt einkommensunabhängig und für die gesamte Dauer des Studiums.
Wie können Angebot und Nachfrage in regionalen Ausbildungsmärkten besser zusammenfinden?
Antworten liefert die neue Ausgabe der JOBSTARTER REGIONAL.
Es wurde vom Bundesministerium für Bildung und Forschung im Jahr 2008 eingeführt.
Dabei haben diese kaum eine Chance auf Anerkennung- im zweiten Quartal 2015 endeten nur 0,3 Prozent der entsprechenden Asylverfahren mit einem positiven Ergebnis.
Egal ob Autos von DriveNow, Schlafplätze über Airbnb oder Wissen bei Wikipedia- unter dem Stichwort Sharing Economy werden Ressourcen gemeinsam und damit effizienter genutzt.
Sie schloss das Studium erfolgreich ab und studierte darauf im Master-Studiengang ``Neuroscience'' am Queensland Brain Institute im australischen Brisbane.
In Berlin hat Özlem Yetim eine Praxis für Sprachtherapie eröffnet.
gibt Carsten Sieling seine erste Regierungserklärung als Bürgermeister des Stadtstaates Bremen ab.
Start ins neue Ausbildungsjahr mit 17 modernisierten Ausbildungsberufen Vom ``Automatenfachmann'' bis zum ``Werksteinhersteller''- mit 17 modernisierten dualen Ausbildungsberufen beginnt am 1. August das neue Ausbildungsjahr.
Gleichzeitig sichert das System den Fachkräftebedarf der Zukunft und trägt damit entscheidend zur Wettbewerbsfähigkeit und zum Wohlstand Deutschlands bei.
Die modernisierte Ausbildungsordnung, die erhöhte Qualitäts- und Umweltanforderungen berücksichtigt, tritt am 1. August in Kraft.
Ziel der Reform ist die Sicherung und Verbesserung der Ausbildungschancen der Jugend sowie einer hohen Qualität der beruflichen Ausbildung für alle jungen Menschen- unabhängig von ihrer sozialen oder regionalen Herkunft.
Dieses Ziel in ganz Deutschland zu erreichen, ist Aufgabe des Bundes, nicht zuletzt, um Innovations- und Wettbewerbsfähigkeit der Wirtschaft mit gut ausgebildeten Nachwuchskräften zu sichern.
Die ``anerkannten Ausbildungsberufe'' bilden die Grundlage für die Berufsausbildung im Dualen System.
Durch diese neuen Kombinationen von Betrieb und beruflicher Schule kann ein regionaler Mangel an betrieblichen Ausbildungsplätzen ausgeglichen werden; Betrieben, die bisher nicht ausbilden, der Einstieg in die Berufsausbildung erleichtert werden; neuer Qualifizierungsbedarf, zum Beispiel in neu entstehenden Branchen und für neue Berufstätigkeiten, auch dann gedeckt werden, wenn die betrieblichen Ausbildungskapazitäten noch nicht ausreichen; auf den in vielen Ausbildungsberufen steigenden Theorieanteil angemessener reagiert werden.",0.48458,0.32743,0.20319,20,153,"Die Neuregelung tritt zum 1. August in Kraft.
BWP- Berufsbildung in Wissenschaft und Praxis Die BIBB-Fachzeitschrift veröffentlicht wissenschaftliche Erkenntnisse und praktische Erfahrungen zu aktuellen Fragen der Berufsbildung.
Bundesbildungsministerin Johanna Wanka sagte ``Wir wollen die duale Berufsausbildung zukunftssicher und attraktiver machen.
Ziel der Reform ist die Sicherung und Verbesserung der Ausbildungschancen der Jugend sowie einer hohen Qualität der beruflichen Ausbildung für alle jungen Menschen- unabhängig von ihrer sozialen oder regionalen Herkunft.
Innovation durch Vernetzung Mit dem neuen Berufsbildungsgesetz werden Ausbildungsabschnitte im Ausland erstmals zu einem gleichwertigen Teil einer anerkannten Berufsausbildung im dualen System.
Das neue Berufsbildungsgesetz eröffnet den Ländern die Möglichkeit, sicher zu stellen, dass schulische Berufsausbildungszeiten in anerkannten Ausbildungsberufen genauso zählen wie betriebliche Ausbildungszeiten.
Wir bedanken uns für Ihr Verständnis.
Hauptmenü Das Aufstiegsstipendium Mit Berufserfahrung an die Hochschule : Die Aufstiegsstipendien des Bundesministeriums für Bildung und Forschung richten sich an besonders motivierte Berufstätige, die sich mit einem Hochschulstudium beruflich und persönlich weiterentwickeln möchten.
Die frei werdenden Mittel könnten nun genutzt werden, um die Kinderbetreuung auszubauen, zum Beispiel mit 24-Stunden-Kitas.
Die Ausbildung ist nun vielseitiger, auf alle Automatentypen anwendbar und besteht aus den Fachrichtungen ``Automatenmechatronik'' und ``Automatendienstleistung''.
Die Förderung erfolgt einkommensunabhängig und für die gesamte Dauer des Studiums.",0.60219,0.3849,0.30224,134,522,"Das Aufstiegsstipendium ist das einzige akademische Begabtenförderungsprogramm für Menschen mit Berufserfahrung.
Vorschläge für modernisierte und neue Berufe für qualifizierte Fachkräfte, die zusätzliche Ausbildungsmöglichkeiten erschließen und gute Beschäftigungsperspektiven eröffnen, werden in der Regel innerhalb eines Jahres umgesetzt.
Die Bedeutung der Berufserfahrung als Zulassungskriterium für beruflich Qualifizierte Im Zuge der Novellierung des rheinland-pfälzischen Hochschulgesetzes im Jahr 2010 hat das Ministerium für Wissenschaft, Weiterbildung und Kultur ein Modellprojekt initiiert, in dem erprobt werden sollte, inwiefern auf das bisher gängige Kriterium der Berufserfahrung für den Hochschulzugang beruflich Qualifizierter verzichtet werden kann.
Hierfür sind Erkenntnisse über die Interessenlage und mögliche Vorbehalte aufseiten von Betrieben und Studienaussteigerinnen und -aussteigern hilfreich.
Eine grundlegende Novellierung dieser vier Berufe war erforderlich, um aktuelle Entwicklungen und moderne Standards aufzugreifen.
Die Berufsausbildung zukunftssicher machen Neue Förderrunde des Programms JOBSTARTER plus / Wanka : ``Wir wollen besonders kleine und mittelgroße Betriebe unterstützen'' Das Bundesministerium für Bildung und Forschung (BMBF) fördert neue Projekte, um das System der dualen Berufsausbildung zu stärken.
Ziel der Förderung im Rahmen des Programms JOBSTARTER plus ist es, regionale Ausbildungsstrukturen und den Übergang von der Schule in die Ausbildung zu verbessern.
Zum ersten Mal seit mehr als zehn Jahren verabschiedete der Hauptausschuss eine Gemeinsame Stellungnahme zum Berufsbildungsbericht, ohne diese, wie in den Vorjahren, durch Voten der ``Bänke'' zu ergänzen.
Ausbildungsberufe in der Bekleidungsindustrie im neuen Gewand Wer sorgt eigentlich dafür, dass wir in allen Lebenslagen passend gekleidet sind?
Aber auch funktionelle Bekleidung und textile Artikel wie Skijacken, Feuerwehranzüge, Rucksäcke und Airbags, Heimtextilien wie Vorhänge und Decken sowie medizinische Produkte wie Kompressionsstrümpfe gehören zum breiten Produktspektrum.
BIBB-Präsident Esser : ``Duales System weiterentwickeln'' Jahresbericht 2014 des Bundesinstituts für Berufsbildung erschienen Wie muss die berufliche Bildung auf den anhaltenden Akademisierungstrend reagieren?
Zu jeder Kurzbericht-Ausgabe gibt es die darin enthaltenen Grafiken separat zum kostenlosen Download.
Hauptmenü Das Aufstiegsstipendium Mit Berufserfahrung an die Hochschule : Die Aufstiegsstipendien des Bundesministeriums für Bildung und Forschung richten sich an besonders motivierte Berufstätige, die sich mit einem Hochschulstudium beruflich und persönlich weiterentwickeln möchten.
INFO Für Studierende im Vollzeitstudium beträgt das Stipendium monatlich 750 Euro.
Antworten liefert die neue Ausgabe der JOBSTARTER REGIONAL.
Dabei haben diese kaum eine Chance auf Anerkennung- im zweiten Quartal 2015 endeten nur 0,3 Prozent der entsprechenden Asylverfahren mit einem positiven Ergebnis.
Meister und Techniker erwerben mit der Aufstiegsfortbildung zudem die Berechtigung, an jeder Hochschule das Fach ihrer Wahl zu studieren.
Bestimmte ökonomische- und nicht ganz einfache- Themen wie Produktivität, Arbeitszeiten und Arbeitskosten werden so gut wie gar nicht angesprochen, obwohl sie interessante Zusammenhänge offenbaren.
Sie schloss das Studium erfolgreich ab und studierte darauf im Master-Studiengang ``Neuroscience'' am Queensland Brain Institute im australischen Brisbane.
Sie verwenden einen veralteten Browser, mit dem nicht alle Inhalte des Internetauftritts www.bibb.de korrekt wiedergegeben werden können.
Sie wendet sich an betriebliche Ausbilder, Führungskräfte, Aus- und Weiterbildungsverantwortliche in Unternehmen und überbetrieblichen Ausbildungsstätten sowie an Lehrkräfte in Berufsschulen und -akademien, an Techniker- und Meisterschulen.
Start ins neue Ausbildungsjahr mit 17 modernisierten Ausbildungsberufen Vom ``Automatenfachmann'' bis zum ``Werksteinhersteller''- mit 17 modernisierten dualen Ausbildungsberufen beginnt am 1. August das neue Ausbildungsjahr.
Ziel der Reform ist die Sicherung und Verbesserung der Ausbildungschancen der Jugend sowie einer hohen Qualität der beruflichen Ausbildung für alle jungen Menschen- unabhängig von ihrer sozialen oder regionalen Herkunft.
Dieses Ziel in ganz Deutschland zu erreichen, ist Aufgabe des Bundes, nicht zuletzt, um Innovations- und Wettbewerbsfähigkeit der Wirtschaft mit gut ausgebildeten Nachwuchskräften zu sichern.
Neue und modernisierte Ausbildungsberufe Alle Berufe, die seit 2002 unter Federführung des BIBB neu entwickelt oder modernisiert wurden, zur zeitlich befristeten Erprobung erlassen wurden (Erprobungsverordnung) oder in Dauerrecht überführt wurden.
Ausbildungsvergütung DQR- Deutscher Qualifikationsrahmen Der Deutscher Qualifikationsrahmen (DQR) macht Ausbildungsinhalte in Deutschland transparent.
Die duale Berufsausbildung in Deutschland wird so im gesamten Anwendungsgebiet des EQR vergleichbar.
BWP Aktuelle Ausgabe : Berufsbildung und Hochschule (BWP 3/2015) Das Verhältnis von Hochschule und Berufsbildung hat sich verändert.
Erstmalig im Jahr 2014 entschieden sich mehr junge Menschen für ein Studium als für eine Berufsausbildung.
Zudem öffnen sich die Hochschulen für neue Zielgruppen.
Deswegen sieht das neue Berufsbildungsrecht durch eine entsprechende Ermächtigung der Landesregierungen vor, dass Schülerinnen und Schüler einen erleichterten Zugang zur Kammerprüfung erhalten.
Auch Ausbildungsverbünde von Schulen und Betrieben mit den Schulen als Träger werden möglich.
Eingeführt wurde zusätzlich, dass der Abschluss von Berufsbildungsgängen mit weiterführenden Schulabschlüssen verknüpft werden kann.
Die Höhe der Kosten und Erträge verändert sich jedoch im Verlauf der Ausbildung.
Der Beitrag stellt diese Entwicklungen anhand der Daten der BIBB-Kosten-Nutzen- Erhebung 2012/13 in Berufen unterschiedlicher Ausbildungsdauer dar.
Seit 2000 wurden rund 206 modernisierte und 51 neue Berufe in Kraft gesetzt."
3,0.76435,0.62935,0.43361,74,373,"Engpässe werden nach den Projektionen auf der qualifikatorischen Ebene in nahezu allen Regionen vor allem im Bereich der mittleren Ausbildungsabschlüsse auftreten, jedoch mit unterschiedlichen Folgen.
Das neue Berufsbildungsgesetz trägt dazu bei, starre Grenzen zwischen den Bildungsbereichen aufzuheben : Mit den neuen Chancen beruflicher Schulen zur Beteiligung an der dualen Berufsausbildung werden zugleich die Möglichkeiten der Länder deutlich verbessert, berufliche Ausbildung mit weiterführenden allgemein bildenden Abschlüssen bis hin zur Hochschulreife zu kombinieren.
Mit dem neuen Berufsbildungsgesetz werden Zusatzqualifikationen, die über das in Ausbildungsordnungen Festgelegte hinaus vermittelt werden, als eigenständige, gesondert zu prüfende und zu zertifizierende Qualifikationen eingeführt.
Ergebnisse des BIBB-Expertenmonitors Mit der zunehmenden Anzahl unbesetzter Ausbildungsplätze hat sich die Forderung nach mehr Durchlässigkeit im Bildungssystem auf die Frage ausgeweitet, wie sich Studienaussteiger/-innen für eine duale Ausbildung gewinnen lassen.
Abstract anzeigen Abstract ausblenden Hemkes, Barbara; Wilbers, Karl; Zinke, Gert Brücken zwischen Hochschule und Berufsbildung durch bereichsübergreifende Bildungsgänge (aus) bauen Am Beispiel der IT-Berufe wird deutlich, dass einem steigenden Fachkräftebedarf nicht allein durch mehr hochschulische Bildungsabschlüsse begegnet werden kann, sondern differenzierte Kompetenzprofile erforderlich sind.
Gefragt sind zusätzliche Optionen, die Elemente akademischer und beruflicher Bildung integrieren und dabei reziproke Übergänge zwischen den Bildungsbereichen ermöglichen.
Ziel der Förderung im Rahmen des Programms JOBSTARTER plus ist es, regionale Ausbildungsstrukturen und den Übergang von der Schule in die Ausbildung zu verbessern.
Hauptmenü Das Aufstiegsstipendium Mit Berufserfahrung an die Hochschule : Die Aufstiegsstipendien des Bundesministeriums für Bildung und Forschung richten sich an besonders motivierte Berufstätige, die sich mit einem Hochschulstudium beruflich und persönlich weiterentwickeln möchten.
Das Aufstiegsstipendium soll es jungen Frauen und Männer, die sich in ihrem Beruf ganz besonders engagieren, finanziell ermöglichen, ein Studium an einer Hochschule zu beginnen.
Zusätzlich wird eine Betreuungspauschale für Kinder gewährt.
Die Förderung erfolgt einkommensunabhängig und für die gesamte Dauer des Studiums.
Mit dem Aufstiegsstipendium wird ein Erststudium in Vollzeit oder berufsbegleitend an einer staatlichen oder staatlich anerkannten Hochschule gefördert.
Antworten liefert die neue Ausgabe der JOBSTARTER REGIONAL.
Es wurde vom Bundesministerium für Bildung und Forschung im Jahr 2008 eingeführt.
In Berlin hat Özlem Yetim eine Praxis für Sprachtherapie eröffnet.
Durch gezielte Innovationen wird das System der beruflichen Bildung auch in Zukunft seinen Beitrag zum nachhaltigen Wandel der Arbeitswelten wie auch der Gesellschaft insgesamt leisten.
Hauptmenü Reform der Berufsbildung Das zum 1. April 2005 in Kraft getretene Berufsbildungsreformgesetz zielt darauf ab, die Ausbildungschancen zu sichern und zu verbessern und eine hohe Qualität der beruflichen Ausbildung für alle jungen Menschen zu gewährleisten- unabhängig von ihrer sozialen oder regionalen Herkunft.
Start ins neue Ausbildungsjahr mit 17 modernisierten Ausbildungsberufen Vom ``Automatenfachmann'' bis zum ``Werksteinhersteller''- mit 17 modernisierten dualen Ausbildungsberufen beginnt am 1. August das neue Ausbildungsjahr.
Die modernisierte Ausbildungsordnung, die erhöhte Qualitäts- und Umweltanforderungen berücksichtigt, tritt am 1. August in Kraft.
Das mit dem Berufsbildungsreformgesetz im Jahr 2005 vollständig novellierte Berufsbildungsgesetz (BBiG) schafft hierfür den rechtlichen Rahmen.
Die ``anerkannten Ausbildungsberufe'' bilden die Grundlage für die Berufsausbildung im Dualen System.
Ein Teil der Jugendlichen nimmt nach der Schule eine der Maßnahmen der Bundesagentur für Arbeit oder aus anderen Sonderprogrammen wahr.
Auch Ausbildungsverbünde von Schulen und Betrieben mit den Schulen als Träger werden möglich.
Durch diese neuen Kombinationen von Betrieb und beruflicher Schule kann ein regionaler Mangel an betrieblichen Ausbildungsplätzen ausgeglichen werden; Betrieben, die bisher nicht ausbilden, der Einstieg in die Berufsausbildung erleichtert werden; neuer Qualifizierungsbedarf, zum Beispiel in neu entstehenden Branchen und für neue Berufstätigkeiten, auch dann gedeckt werden, wenn die betrieblichen Ausbildungskapazitäten noch nicht ausreichen; auf den in vielen Ausbildungsberufen steigenden Theorieanteil angemessener reagiert werden.
Im Jahr 2014 entschieden sich zudem erstmalig mehr Schulabsolventinnen und -absolventen für ein Studium als für eine Berufsausbildung.",0.48458,0.30531,0.20899,1,162,"Die Neuregelung tritt zum 1. August in Kraft.
Die Berufsausbildung zukunftssicher machen Neue Förderrunde des Programms JOBSTARTER plus / Wanka : ``Wir wollen besonders kleine und mittelgroße Betriebe unterstützen'' Das Bundesministerium für Bildung und Forschung (BMBF) fördert neue Projekte, um das System der dualen Berufsausbildung zu stärken.
Vorschläge für modernisierte und neue Berufe für qualifizierte Fachkräfte, die zusätzliche Ausbildungsmöglichkeiten erschließen und gute Beschäftigungsperspektiven eröffnen, werden in der Regel innerhalb eines Jahres umgesetzt.
Bundesbildungsministerin Johanna Wanka sagte ``Wir wollen die duale Berufsausbildung zukunftssicher und attraktiver machen.
Ausbildung in Automatenwirtschaft modernisiert Für die vielen Automaten, die unser tägliches Leben begleiten, braucht es zeitgemäß ausgebildete Fachleute.
Innovation durch Vernetzung Mit dem neuen Berufsbildungsgesetz werden Ausbildungsabschnitte im Ausland erstmals zu einem gleichwertigen Teil einer anerkannten Berufsausbildung im dualen System.
Vincenzo Tutino hat Maschinenbau studiert.
Die Ausbildung ist nun vielseitiger, auf alle Automatentypen anwendbar und besteht aus den Fachrichtungen ``Automatenmechatronik'' und ``Automatendienstleistung''.
bwp @ ist das Online-Fachjournal für alle an der Berufs- und Wirtschaftspädagogik Interessierten, die schnell, problemlos und kostenlos auf reviewte Inhalte und Diskussionen der Scientific Community zugreifen wollen.
Das neue Berufsbildungsgesetz eröffnet den Ländern die Möglichkeit, sicher zu stellen, dass schulische Berufsausbildungszeiten in anerkannten Ausbildungsberufen genauso zählen wie betriebliche Ausbildungszeiten.",0.81509,0.70646,0.52977,181,386,"Vorschläge für modernisierte und neue Berufe für qualifizierte Fachkräfte, die zusätzliche Ausbildungsmöglichkeiten erschließen und gute Beschäftigungsperspektiven eröffnen, werden in der Regel innerhalb eines Jahres umgesetzt.
Abstract anzeigen Abstract ausblenden Freitag, Walburga Katharina Verbesserung der Durchlässigkeit in die Hochschule durch Anrechnung und Übergangsmaßnahmen Impulse aus den BMBF-Initiativen ANKOM In den Jahren 2005 bis 2009 sowie 2011 bis 2014 wurden unter dem Akronym ANKOM auf der Grundlage von zwei Förderlinien insgesamt 31 Entwicklungsprojekte vom Bundesministerium für Bildung und Forschung (BMBF) mit dem Ziel gefördert, die Durchlässigkeit zwischen der beruflichen und hochschulischen Bildung zu analysieren und zu erhöhen.
Abstract anzeigen Abstract ausblenden van Nahl, Andreas Aufstiegsstipendium : Studienförderung für Fachkräfte mit Berufsausbildung Das Aufstiegsstipendium des BMBF hat unter den Studienförderungen eine besondere Zielgruppe : Es richtet sich an beruflich qualifizierte Fachkräfte und unterstützt ein Hochschulstudium bis zu einem ersten akademischen Abschluss.
Hierfür sind Erkenntnisse über die Interessenlage und mögliche Vorbehalte aufseiten von Betrieben und Studienaussteigerinnen und -aussteigern hilfreich.
Ziel der Förderung im Rahmen des Programms JOBSTARTER plus ist es, regionale Ausbildungsstrukturen und den Übergang von der Schule in die Ausbildung zu verbessern.
Zum ersten Mal seit mehr als zehn Jahren verabschiedete der Hauptausschuss eine Gemeinsame Stellungnahme zum Berufsbildungsbericht, ohne diese, wie in den Vorjahren, durch Voten der ``Bänke'' zu ergänzen.
Das neue Berufsbildungsgesetz knüpft an diese bewährten Strukturen an.
BIBB-Präsident Esser : ``Duales System weiterentwickeln'' Jahresbericht 2014 des Bundesinstituts für Berufsbildung erschienen Wie muss die berufliche Bildung auf den anhaltenden Akademisierungstrend reagieren?
Und was bedeutet die zunehmende Heterogenität, also die Unterschiede in den persönlichen Ausbildungsvoraussetzungen, für die Zukunft der dualen Berufsausbildung?
Ein erheblicher Teil dieser Jugendlichen schließt deshalb an die schulische Berufsausbildung noch einmal eine duale Berufsausbildung an.
Betriebe setzen auf reifere Bewerber für ihre Ausbildungsplätze Altbewerber mit absolvierter berufvorbereitender Maßnahme haben oft bessere Chancen auf einen Ausbildungsplatz als Schulabgänger Auch zwei Jahre nach dem Schulabschluss haben Bewerberinnen und Bewerber gute Chancen auf einen Ausbildungsplatz- insbesondere dann, wenn sie sich in dieser Zeit über eine berufsvorbereitende Maßnahme im Übergangssystem weiterqualifiziert haben.
Die Aufstiegsstipendien ergänzen die bestehende Begabtenförderung in der beruflichen Bildung und im Hochschulbereich.
Mit dem Aufstiegsstipendium wird ein Erststudium in Vollzeit oder berufsbegleitend an einer staatlichen oder staatlich anerkannten Hochschule gefördert.
Das Aufstiegsstipendium ist das einzige akademische Begabtenförderungsprogramm für Menschen mit Berufserfahrung.
Das im Auftrag des Bundesministeriums für Wirtschaft und Energie (BMWi) jetzt gestartete neue BIBB-Projekt wird von einem Beirat unterstützt, dem Vertreterinnen und Vertreter aus Fachverbänden, Unternehmen, Ministerien, Berufsschulen und der Wissenschaft angehören.
Meister und Techniker erwerben mit der Aufstiegsfortbildung zudem die Berechtigung, an jeder Hochschule das Fach ihrer Wahl zu studieren.
Das duale System der beruflichen Bildung bietet allen jungen Menschen die Chance, eine qualifizierte Beschäftigung aufzunehmen und damit ihr Leben selbstverantwortlich zu bestimmen.
Sie schloss das Studium erfolgreich ab und studierte darauf im Master-Studiengang ``Neuroscience'' am Queensland Brain Institute im australischen Brisbane.
Mit dem DQR wird auf nationaler Ebene eine Empfehlung des Europäischen Parlaments und des Rates vom April 2008 zur Einrichtung eines Europäischen Qualifikationsrahmens (EQR) für lebenslanges Lernen umgesetzt.
Hauptmenü Reform der Berufsbildung Das zum 1. April 2005 in Kraft getretene Berufsbildungsreformgesetz zielt darauf ab, die Ausbildungschancen zu sichern und zu verbessern und eine hohe Qualität der beruflichen Ausbildung für alle jungen Menschen zu gewährleisten- unabhängig von ihrer sozialen oder regionalen Herkunft.
Start ins neue Ausbildungsjahr mit 17 modernisierten Ausbildungsberufen Vom ``Automatenfachmann'' bis zum ``Werksteinhersteller''- mit 17 modernisierten dualen Ausbildungsberufen beginnt am 1. August das neue Ausbildungsjahr.
Gleichzeitig sichert das System den Fachkräftebedarf der Zukunft und trägt damit entscheidend zur Wettbewerbsfähigkeit und zum Wohlstand Deutschlands bei.
Ausbildungsvergütung DQR- Deutscher Qualifikationsrahmen Der Deutscher Qualifikationsrahmen (DQR) macht Ausbildungsinhalte in Deutschland transparent.
Er ist an den Europäischen Qualifikationsrahmen (EQR) gekoppelt.
Die duale Berufsausbildung in Deutschland wird so im gesamten Anwendungsgebiet des EQR vergleichbar.
BWP Aktuelle Ausgabe : Berufsbildung und Hochschule (BWP 3/2015) Das Verhältnis von Hochschule und Berufsbildung hat sich verändert.
Erstmalig im Jahr 2014 entschieden sich mehr junge Menschen für ein Studium als für eine Berufsausbildung.
Zudem öffnen sich die Hochschulen für neue Zielgruppen.
Die beste Zugangsmöglichkeit zum Arbeitsmarkt bietet auch heute ein Kammerabschlusszeugnis.
Deswegen sieht das neue Berufsbildungsrecht durch eine entsprechende Ermächtigung der Landesregierungen vor, dass Schülerinnen und Schüler einen erleichterten Zugang zur Kammerprüfung erhalten.
Nach der Reform des BBiG können und sollten die schulischen Curricula so verändert werden, dass die Absolventen die Kammerprüfungen bestehen und damit die neu eröffneten Möglichkeiten auch nutzen können.
Eingeführt wurde zusätzlich, dass der Abschluss von Berufsbildungsgängen mit weiterführenden Schulabschlüssen verknüpft werden kann.
Seit 2000 wurden rund 206 modernisierte und 51 neue Berufe in Kraft gesetzt."
